{
  "eccn": "1B229",
  "normalized": "1B229",
  "history": [
    {
      "version": "2017-01-15",
      "fetchedAt": "2025-10-02T20:33:28.357Z",
      "sourceUrl": "https://www.ecfr.gov/api/versioner/v1/full/2017-01-15/title-15?format=xml",
      "heading": "1B229 Water-hydrogen sulphide exchange tray columns and “internal contactors”, as follows (see List of Items Controlled).",
      "title": "Water-hydrogen sulphide exchange tray columns and “internal contactors”, as follows (see List of Items Controlled).",
      "category": "1",
      "group": "1B",
      "supplement": {
        "number": "1",
        "heading": "Supplement No. 1 to Part 774 - The Commerce Control List"
      },
      "breadcrumbs": [
        "B. “Test”, “Inspection” and “Production Equipment”"
      ],
      "ancestors": [],
      "text": "1B229 Water-hydrogen sulphide exchange tray columns and “internal contactors”, as follows (see List of Items Controlled).\nLicense Requirements\nReason for Control:\nNP, AT\nControl(s) Country Chart (See Supp. No. 1 to part 738) NP applies to entire entryNP Column 1 AT applies to entire entryAT Column 1\nControl(s)\nCountry Chart (See Supp. No. 1 to part 738)\nNP applies to entire entry\nNP Column 1\nAT applies to entire entry\nAT Column 1\nList Based License Exceptions (See Part 740 for a description of all license exceptions)\nLVS:\nN/A\nGBS:\nN/A\nCIV:\nN/A\nList of Items Controlled\nRelated Controls:\n(1) Equipment “specially designed” or prepared for the production of heavy water is subject to the export licensing authority of the Nuclear Regulatory Commission (see 10 CFR part 110). (2) See ECCNs 1E001 (“development” and “production”) and 1E201 (“use”) for technology for items controlled by this entry.\nRelated Definitions:\nThe “internal contactors” controlled by 1B229.b are segmented trays that have an effective assembled diameter of 1.8 m (6 ft.) or greater, are designed to facilitate countercurrent contacting, and are constructed of stainless steels with a carbon content of 0.03% or less. These may be sieve trays, valve trays, bubble cap trays, or turbogrid trays.\nItems:\na. Water-hydrogen sulphide exchange tray columns, having all of the following characteristics:\n1B229.a\nCan operate at pressures of 2 MPa or greater;\na.1. Can operate at pressures of 2 MPa or greater;\nConstructed of carbon steel having an austenitic ASTM (or equivalent standard) grain size number of 5 or greater; and\na.2. Constructed of carbon steel having an austenitic ASTM (or equivalent standard) grain size number of 5 or greater; and\nWith a diameter of 1.8 m (6 ft.) or greater;\na.3. With a diameter of 1.8 m (6 ft.) or greater;\n“Internal contactors” for the water-hydrogen sulphide exchange tray columns controlled by 1B229.a.\nb. “Internal contactors” for the water-hydrogen sulphide exchange tray columns controlled by 1B229.a.",
      "structure": {
        "identifier": "1B229",
        "heading": "1B229 Water-hydrogen sulphide exchange tray columns and “internal contactors”, as follows (see List of Items Controlled).",
        "label": "1B229 – 1B229 Water-hydrogen sulphide exchange tray columns and “internal contactors”, as follows (see List of Items Controlled).",
        "content": [
          {
            "type": "text",
            "text": "License Requirements"
          },
          {
            "type": "text",
            "text": "Reason for Control:"
          },
          {
            "type": "text",
            "text": "NP, AT"
          },
          {
            "type": "html",
            "tag": "TABLE",
            "html": "<TABLE border=\"1\" cellpadding=\"1\" cellspacing=\"1\" class=\"gpotbl_table\" frame=\"void\" width=\"100%\"><TR><TH class=\"gpotbl_colhed\" scope=\"col\">Control(s)\n</TH><TH class=\"gpotbl_colhed\" scope=\"col\">Country Chart (See Supp. No. 1 to part 738)\n</TH></TR><TR><TD align=\"left\" class=\"gpotbl_cell\" scope=\"row\">NP applies to entire entry (1B229)</TD><TD align=\"left\" class=\"gpotbl_cell\">NP Column 1\n</TD></TR><TR><TD align=\"left\" class=\"gpotbl_cell\" scope=\"row\">AT applies to entire entry (1B229)</TD><TD align=\"left\" class=\"gpotbl_cell\">AT Column 1</TD></TR></TABLE>",
            "text": "Control(s) Country Chart (See Supp. No. 1 to part 738) NP applies to entire entryNP Column 1 AT applies to entire entryAT Column 1",
            "id": null
          },
          {
            "type": "text",
            "text": "Control(s)"
          },
          {
            "type": "text",
            "text": "Country Chart (See Supp. No. 1 to part 738)"
          },
          {
            "type": "text",
            "text": "NP applies to entire entry"
          },
          {
            "type": "text",
            "text": "NP Column 1"
          },
          {
            "type": "text",
            "text": "AT applies to entire entry"
          },
          {
            "type": "text",
            "text": "AT Column 1"
          },
          {
            "type": "text",
            "text": "List Based License Exceptions (See Part 740 for a description of all license exceptions)"
          },
          {
            "type": "text",
            "text": "LVS:"
          },
          {
            "type": "text",
            "text": "N/A"
          },
          {
            "type": "text",
            "text": "GBS:"
          },
          {
            "type": "text",
            "text": "N/A"
          },
          {
            "type": "text",
            "text": "CIV:"
          },
          {
            "type": "text",
            "text": "N/A"
          },
          {
            "type": "text",
            "text": "List of Items Controlled"
          },
          {
            "type": "text",
            "text": "Related Controls:"
          },
          {
            "type": "text",
            "text": "(1) Equipment “specially designed” or prepared for the production of heavy water is subject to the export licensing authority of the Nuclear Regulatory Commission (see 10 CFR part 110). (2) See ECCNs 1E001 (“development” and “production”) and 1E201 (“use”) for technology for items controlled by this entry."
          },
          {
            "type": "text",
            "text": "Related Definitions:"
          },
          {
            "type": "text",
            "text": "The “internal contactors” controlled by 1B229.b are segmented trays that have an effective assembled diameter of 1.8 m (6 ft.) or greater, are designed to facilitate countercurrent contacting, and are constructed of stainless steels with a carbon content of 0.03% or less. These may be sieve trays, valve trays, bubble cap trays, or turbogrid trays."
          },
          {
            "type": "text",
            "text": "Items:"
          },
          {
            "type": "text",
            "text": "a. Water-hydrogen sulphide exchange tray columns, having all of the following characteristics:"
          }
        ],
        "children": [
          {
            "identifier": "1B229.a",
            "heading": null,
            "label": "1B229.a",
            "children": [
              {
                "identifier": "1B229.a.1",
                "heading": "Can operate at pressures of 2 MPa or greater;",
                "label": "1B229.a.1 – Can operate at pressures of 2 MPa or greater;",
                "content": [
                  {
                    "type": "html",
                    "tag": "P",
                    "html": "<P>a.1. Can operate at pressures of 2 MPa or greater;</P>",
                    "text": "a.1. Can operate at pressures of 2 MPa or greater;",
                    "id": null
                  }
                ],
                "isEccn": true,
                "boundToParent": true,
                "requireAllChildren": false
              },
              {
                "identifier": "1B229.a.2",
                "heading": "Constructed of carbon steel having an austenitic ASTM (or equivalent standard) grain size number of 5 or greater; and",
                "label": "1B229.a.2 – Constructed of carbon steel having an austenitic ASTM (or equivalent standard) grain size number of 5 or greater; and",
                "content": [
                  {
                    "type": "html",
                    "tag": "P",
                    "html": "<P>a.2. Constructed of carbon steel having an austenitic ASTM (or equivalent standard) grain size number of 5 or greater; <I>and</I></P>",
                    "text": "a.2. Constructed of carbon steel having an austenitic ASTM (or equivalent standard) grain size number of 5 or greater; and",
                    "id": null
                  }
                ],
                "isEccn": true,
                "boundToParent": true,
                "requireAllChildren": false
              },
              {
                "identifier": "1B229.a.3",
                "heading": "With a diameter of 1.8 m (6 ft.) or greater;",
                "label": "1B229.a.3 – With a diameter of 1.8 m (6 ft.) or greater;",
                "content": [
                  {
                    "type": "html",
                    "tag": "P",
                    "html": "<P>a.3. With a diameter of 1.8 m (6 ft.) or greater;</P>",
                    "text": "a.3. With a diameter of 1.8 m (6 ft.) or greater;",
                    "id": null
                  }
                ],
                "isEccn": true,
                "boundToParent": true,
                "requireAllChildren": false
              }
            ],
            "isEccn": true,
            "boundToParent": true,
            "requireAllChildren": false
          },
          {
            "identifier": "1B229.b",
            "heading": "“Internal contactors” for the water-hydrogen sulphide exchange tray columns controlled by 1B229.a.",
            "label": "1B229.b – “Internal contactors” for the water-hydrogen sulphide exchange tray columns controlled by 1B229.a.",
            "content": [
              {
                "type": "html",
                "tag": "P",
                "html": "<P>b. “Internal contactors” for the water-hydrogen sulphide exchange tray columns controlled by 1B229.a.</P>",
                "text": "b. “Internal contactors” for the water-hydrogen sulphide exchange tray columns controlled by 1B229.a.",
                "id": null
              }
            ],
            "isEccn": true,
            "boundToParent": true,
            "requireAllChildren": false
          }
        ],
        "isEccn": true,
        "boundToParent": false,
        "requireAllChildren": true
      }
    },
    {
      "version": "2017-07-07",
      "fetchedAt": "2025-10-02T20:33:28.904Z",
      "sourceUrl": "https://www.ecfr.gov/api/versioner/v1/full/2017-07-07/title-15?format=xml",
      "heading": "1B229 Water-hydrogen sulphide exchange tray columns and “internal contactors”, as follows (see List of Items Controlled).",
      "title": "Water-hydrogen sulphide exchange tray columns and “internal contactors”, as follows (see List of Items Controlled).",
      "category": "1",
      "group": "1B",
      "supplement": {
        "number": "1",
        "heading": "Supplement No. 1 to Part 774 - The Commerce Control List"
      },
      "breadcrumbs": [
        "B. “Test”, “Inspection” and “Production Equipment”"
      ],
      "ancestors": [],
      "text": "1B229 Water-hydrogen sulphide exchange tray columns and “internal contactors”, as follows (see List of Items Controlled).\nLicense Requirements\nReason for Control:\nNP, AT\nControl(s) Country Chart (See Supp. No. 1 to part 738) NP applies to entire entryNP Column 1 AT applies to entire entryAT Column 1\nControl(s)\nCountry Chart (See Supp. No. 1 to part 738)\nNP applies to entire entry\nNP Column 1\nAT applies to entire entry\nAT Column 1\nList Based License Exceptions (See Part 740 for a description of all license exceptions)\nLVS:\nN/A\nGBS:\nN/A\nCIV:\nN/A\nList of Items Controlled\nRelated Controls:\n(1) Equipment “specially designed” or prepared for the production of heavy water is subject to the export licensing authority of the Nuclear Regulatory Commission (see 10 CFR part 110). (2) See ECCNs 1E001 (“development” and “production”) and 1E201 (“use”) for technology for items controlled by this entry.\nRelated Definitions:\nThe “internal contactors” controlled by 1B229.b are segmented trays that have an effective assembled diameter of 1.8 m (6 ft.) or greater, are designed to facilitate countercurrent contacting, and are constructed of stainless steels with a carbon content of 0.03% or less. These may be sieve trays, valve trays, bubble cap trays, or turbogrid trays.\nItems:\na. Water-hydrogen sulphide exchange tray columns, having all of the following characteristics:\n1B229.a\nCan operate at pressures of 2 MPa or greater;\na.1. Can operate at pressures of 2 MPa or greater;\nConstructed of carbon steel having an austenitic ASTM (or equivalent standard) grain size number of 5 or greater; and\na.2. Constructed of carbon steel having an austenitic ASTM (or equivalent standard) grain size number of 5 or greater; and\nWith a diameter of 1.8 m (6 ft.) or greater;\na.3. With a diameter of 1.8 m (6 ft.) or greater;\n“Internal contactors” for the water-hydrogen sulphide exchange tray columns controlled by 1B229.a.\nb. “Internal contactors” for the water-hydrogen sulphide exchange tray columns controlled by 1B229.a.",
      "structure": {
        "identifier": "1B229",
        "heading": "1B229 Water-hydrogen sulphide exchange tray columns and “internal contactors”, as follows (see List of Items Controlled).",
        "label": "1B229 – 1B229 Water-hydrogen sulphide exchange tray columns and “internal contactors”, as follows (see List of Items Controlled).",
        "content": [
          {
            "type": "text",
            "text": "License Requirements"
          },
          {
            "type": "text",
            "text": "Reason for Control:"
          },
          {
            "type": "text",
            "text": "NP, AT"
          },
          {
            "type": "html",
            "tag": "TABLE",
            "html": "<TABLE border=\"1\" cellpadding=\"1\" cellspacing=\"1\" class=\"gpotbl_table\" frame=\"void\" width=\"100%\"><TR><TH class=\"gpotbl_colhed\" scope=\"col\">Control(s)\n</TH><TH class=\"gpotbl_colhed\" scope=\"col\">Country Chart (See Supp. No. 1 to part 738)\n</TH></TR><TR><TD align=\"left\" class=\"gpotbl_cell\" scope=\"row\">NP applies to entire entry (1B229)</TD><TD align=\"left\" class=\"gpotbl_cell\">NP Column 1\n</TD></TR><TR><TD align=\"left\" class=\"gpotbl_cell\" scope=\"row\">AT applies to entire entry (1B229)</TD><TD align=\"left\" class=\"gpotbl_cell\">AT Column 1</TD></TR></TABLE>",
            "text": "Control(s) Country Chart (See Supp. No. 1 to part 738) NP applies to entire entryNP Column 1 AT applies to entire entryAT Column 1",
            "id": null
          },
          {
            "type": "text",
            "text": "Control(s)"
          },
          {
            "type": "text",
            "text": "Country Chart (See Supp. No. 1 to part 738)"
          },
          {
            "type": "text",
            "text": "NP applies to entire entry"
          },
          {
            "type": "text",
            "text": "NP Column 1"
          },
          {
            "type": "text",
            "text": "AT applies to entire entry"
          },
          {
            "type": "text",
            "text": "AT Column 1"
          },
          {
            "type": "text",
            "text": "List Based License Exceptions (See Part 740 for a description of all license exceptions)"
          },
          {
            "type": "text",
            "text": "LVS:"
          },
          {
            "type": "text",
            "text": "N/A"
          },
          {
            "type": "text",
            "text": "GBS:"
          },
          {
            "type": "text",
            "text": "N/A"
          },
          {
            "type": "text",
            "text": "CIV:"
          },
          {
            "type": "text",
            "text": "N/A"
          },
          {
            "type": "text",
            "text": "List of Items Controlled"
          },
          {
            "type": "text",
            "text": "Related Controls:"
          },
          {
            "type": "text",
            "text": "(1) Equipment “specially designed” or prepared for the production of heavy water is subject to the export licensing authority of the Nuclear Regulatory Commission (see 10 CFR part 110). (2) See ECCNs 1E001 (“development” and “production”) and 1E201 (“use”) for technology for items controlled by this entry."
          },
          {
            "type": "text",
            "text": "Related Definitions:"
          },
          {
            "type": "text",
            "text": "The “internal contactors” controlled by 1B229.b are segmented trays that have an effective assembled diameter of 1.8 m (6 ft.) or greater, are designed to facilitate countercurrent contacting, and are constructed of stainless steels with a carbon content of 0.03% or less. These may be sieve trays, valve trays, bubble cap trays, or turbogrid trays."
          },
          {
            "type": "text",
            "text": "Items:"
          },
          {
            "type": "text",
            "text": "a. Water-hydrogen sulphide exchange tray columns, having all of the following characteristics:"
          }
        ],
        "children": [
          {
            "identifier": "1B229.a",
            "heading": null,
            "label": "1B229.a",
            "children": [
              {
                "identifier": "1B229.a.1",
                "heading": "Can operate at pressures of 2 MPa or greater;",
                "label": "1B229.a.1 – Can operate at pressures of 2 MPa or greater;",
                "content": [
                  {
                    "type": "html",
                    "tag": "P",
                    "html": "<P>a.1. Can operate at pressures of 2 MPa or greater;</P>",
                    "text": "a.1. Can operate at pressures of 2 MPa or greater;",
                    "id": null
                  }
                ],
                "isEccn": true,
                "boundToParent": true,
                "requireAllChildren": false
              },
              {
                "identifier": "1B229.a.2",
                "heading": "Constructed of carbon steel having an austenitic ASTM (or equivalent standard) grain size number of 5 or greater; and",
                "label": "1B229.a.2 – Constructed of carbon steel having an austenitic ASTM (or equivalent standard) grain size number of 5 or greater; and",
                "content": [
                  {
                    "type": "html",
                    "tag": "P",
                    "html": "<P>a.2. Constructed of carbon steel having an austenitic ASTM (or equivalent standard) grain size number of 5 or greater; <I>and</I></P>",
                    "text": "a.2. Constructed of carbon steel having an austenitic ASTM (or equivalent standard) grain size number of 5 or greater; and",
                    "id": null
                  }
                ],
                "isEccn": true,
                "boundToParent": true,
                "requireAllChildren": false
              },
              {
                "identifier": "1B229.a.3",
                "heading": "With a diameter of 1.8 m (6 ft.) or greater;",
                "label": "1B229.a.3 – With a diameter of 1.8 m (6 ft.) or greater;",
                "content": [
                  {
                    "type": "html",
                    "tag": "P",
                    "html": "<P>a.3. With a diameter of 1.8 m (6 ft.) or greater;</P>",
                    "text": "a.3. With a diameter of 1.8 m (6 ft.) or greater;",
                    "id": null
                  }
                ],
                "isEccn": true,
                "boundToParent": true,
                "requireAllChildren": false
              }
            ],
            "isEccn": true,
            "boundToParent": true,
            "requireAllChildren": false
          },
          {
            "identifier": "1B229.b",
            "heading": "“Internal contactors” for the water-hydrogen sulphide exchange tray columns controlled by 1B229.a.",
            "label": "1B229.b – “Internal contactors” for the water-hydrogen sulphide exchange tray columns controlled by 1B229.a.",
            "content": [
              {
                "type": "html",
                "tag": "P",
                "html": "<P>b. “Internal contactors” for the water-hydrogen sulphide exchange tray columns controlled by 1B229.a.</P>",
                "text": "b. “Internal contactors” for the water-hydrogen sulphide exchange tray columns controlled by 1B229.a.",
                "id": null
              }
            ],
            "isEccn": true,
            "boundToParent": true,
            "requireAllChildren": false
          }
        ],
        "isEccn": true,
        "boundToParent": false,
        "requireAllChildren": true
      }
    },
    {
      "version": "2017-08-15",
      "fetchedAt": "2025-10-02T20:33:29.324Z",
      "sourceUrl": "https://www.ecfr.gov/api/versioner/v1/full/2017-08-15/title-15?format=xml",
      "heading": "1B229 Water-hydrogen sulphide exchange tray columns and “internal contactors”, as follows (see List of Items Controlled).",
      "title": "Water-hydrogen sulphide exchange tray columns and “internal contactors”, as follows (see List of Items Controlled).",
      "category": "1",
      "group": "1B",
      "supplement": {
        "number": "1",
        "heading": "Supplement No. 1 to Part 774 - The Commerce Control List"
      },
      "breadcrumbs": [
        "List of Items Controlled"
      ],
      "ancestors": [],
      "text": "1B229 Water-hydrogen sulphide exchange tray columns and “internal contactors”, as follows (see List of Items Controlled).\nLicense Requirements\nReason for Control:\nNP, AT\nControl(s) Country Chart (See Supp. No. 1 to part 738) NP applies to entire entryNP Column 1 AT applies to entire entryAT Column 1\nControl(s)\nCountry Chart (See Supp. No. 1 to part 738)\nNP applies to entire entry\nNP Column 1\nAT applies to entire entry\nAT Column 1\nList Based License Exceptions (See Part 740 for a description of all license exceptions)\nLVS:\nN/A\nGBS:\nN/A\nCIV:\nN/A\nList of Items Controlled\nRelated Controls:\n(1) Equipment “specially designed” or prepared for the production of heavy water is subject to the export licensing authority of the Nuclear Regulatory Commission (see 10 CFR part 110). (2) See ECCNs 1E001 (“development” and “production”) and 1E201 (“use”) for technology for items controlled by this entry.\nRelated Definitions:\nThe “internal contactors” controlled by 1B229.b are segmented trays that have an effective assembled diameter of 1.8 m (6 ft.) or greater, are designed to facilitate countercurrent contacting, and are constructed of stainless steels with a carbon content of 0.03% or less. These may be sieve trays, valve trays, bubble cap trays, or turbogrid trays.\nItems:\na. Water-hydrogen sulphide exchange tray columns, having all of the following characteristics:\n1B229.a\nCan operate at pressures of 2 MPa or greater;\na.1. Can operate at pressures of 2 MPa or greater;\nConstructed of carbon steel having an austenitic ASTM (or equivalent standard) grain size number of 5 or greater; and\na.2. Constructed of carbon steel having an austenitic ASTM (or equivalent standard) grain size number of 5 or greater; and\nWith a diameter of 1.8 m (6 ft.) or greater;\na.3. With a diameter of 1.8 m (6 ft.) or greater;\n“Internal contactors” for the water-hydrogen sulphide exchange tray columns controlled by 1B229.a.\nb. “Internal contactors” for the water-hydrogen sulphide exchange tray columns controlled by 1B229.a.",
      "structure": {
        "identifier": "1B229",
        "heading": "1B229 Water-hydrogen sulphide exchange tray columns and “internal contactors”, as follows (see List of Items Controlled).",
        "label": "1B229 – 1B229 Water-hydrogen sulphide exchange tray columns and “internal contactors”, as follows (see List of Items Controlled).",
        "content": [
          {
            "type": "text",
            "text": "License Requirements"
          },
          {
            "type": "text",
            "text": "Reason for Control:"
          },
          {
            "type": "text",
            "text": "NP, AT"
          },
          {
            "type": "html",
            "tag": "TABLE",
            "html": "<TABLE border=\"1\" cellpadding=\"1\" cellspacing=\"1\" class=\"gpotbl_table\" frame=\"void\" width=\"100%\"><TR><TH class=\"gpotbl_colhed\" scope=\"col\">Control(s)\n</TH><TH class=\"gpotbl_colhed\" scope=\"col\">Country Chart (See Supp. No. 1 to part 738)\n</TH></TR><TR><TD align=\"left\" class=\"gpotbl_cell\" scope=\"row\">NP applies to entire entry (1B229)</TD><TD align=\"left\" class=\"gpotbl_cell\">NP Column 1\n</TD></TR><TR><TD align=\"left\" class=\"gpotbl_cell\" scope=\"row\">AT applies to entire entry (1B229)</TD><TD align=\"left\" class=\"gpotbl_cell\">AT Column 1</TD></TR></TABLE>",
            "text": "Control(s) Country Chart (See Supp. No. 1 to part 738) NP applies to entire entryNP Column 1 AT applies to entire entryAT Column 1",
            "id": null
          },
          {
            "type": "text",
            "text": "Control(s)"
          },
          {
            "type": "text",
            "text": "Country Chart (See Supp. No. 1 to part 738)"
          },
          {
            "type": "text",
            "text": "NP applies to entire entry"
          },
          {
            "type": "text",
            "text": "NP Column 1"
          },
          {
            "type": "text",
            "text": "AT applies to entire entry"
          },
          {
            "type": "text",
            "text": "AT Column 1"
          },
          {
            "type": "text",
            "text": "List Based License Exceptions (See Part 740 for a description of all license exceptions)"
          },
          {
            "type": "text",
            "text": "LVS:"
          },
          {
            "type": "text",
            "text": "N/A"
          },
          {
            "type": "text",
            "text": "GBS:"
          },
          {
            "type": "text",
            "text": "N/A"
          },
          {
            "type": "text",
            "text": "CIV:"
          },
          {
            "type": "text",
            "text": "N/A"
          },
          {
            "type": "text",
            "text": "List of Items Controlled"
          },
          {
            "type": "text",
            "text": "Related Controls:"
          },
          {
            "type": "text",
            "text": "(1) Equipment “specially designed” or prepared for the production of heavy water is subject to the export licensing authority of the Nuclear Regulatory Commission (see 10 CFR part 110). (2) See ECCNs 1E001 (“development” and “production”) and 1E201 (“use”) for technology for items controlled by this entry."
          },
          {
            "type": "text",
            "text": "Related Definitions:"
          },
          {
            "type": "text",
            "text": "The “internal contactors” controlled by 1B229.b are segmented trays that have an effective assembled diameter of 1.8 m (6 ft.) or greater, are designed to facilitate countercurrent contacting, and are constructed of stainless steels with a carbon content of 0.03% or less. These may be sieve trays, valve trays, bubble cap trays, or turbogrid trays."
          },
          {
            "type": "text",
            "text": "Items:"
          },
          {
            "type": "text",
            "text": "a. Water-hydrogen sulphide exchange tray columns, having all of the following characteristics:"
          }
        ],
        "children": [
          {
            "identifier": "1B229.a",
            "heading": null,
            "label": "1B229.a",
            "children": [
              {
                "identifier": "1B229.a.1",
                "heading": "Can operate at pressures of 2 MPa or greater;",
                "label": "1B229.a.1 – Can operate at pressures of 2 MPa or greater;",
                "content": [
                  {
                    "type": "html",
                    "tag": "P",
                    "html": "<P>a.1. Can operate at pressures of 2 MPa or greater;</P>",
                    "text": "a.1. Can operate at pressures of 2 MPa or greater;",
                    "id": null
                  }
                ],
                "isEccn": true,
                "boundToParent": true,
                "requireAllChildren": false
              },
              {
                "identifier": "1B229.a.2",
                "heading": "Constructed of carbon steel having an austenitic ASTM (or equivalent standard) grain size number of 5 or greater; and",
                "label": "1B229.a.2 – Constructed of carbon steel having an austenitic ASTM (or equivalent standard) grain size number of 5 or greater; and",
                "content": [
                  {
                    "type": "html",
                    "tag": "P",
                    "html": "<P>a.2. Constructed of carbon steel having an austenitic ASTM (or equivalent standard) grain size number of 5 or greater; <I>and</I></P>",
                    "text": "a.2. Constructed of carbon steel having an austenitic ASTM (or equivalent standard) grain size number of 5 or greater; and",
                    "id": null
                  }
                ],
                "isEccn": true,
                "boundToParent": true,
                "requireAllChildren": false
              },
              {
                "identifier": "1B229.a.3",
                "heading": "With a diameter of 1.8 m (6 ft.) or greater;",
                "label": "1B229.a.3 – With a diameter of 1.8 m (6 ft.) or greater;",
                "content": [
                  {
                    "type": "html",
                    "tag": "P",
                    "html": "<P>a.3. With a diameter of 1.8 m (6 ft.) or greater;</P>",
                    "text": "a.3. With a diameter of 1.8 m (6 ft.) or greater;",
                    "id": null
                  }
                ],
                "isEccn": true,
                "boundToParent": true,
                "requireAllChildren": false
              }
            ],
            "isEccn": true,
            "boundToParent": true,
            "requireAllChildren": false
          },
          {
            "identifier": "1B229.b",
            "heading": "“Internal contactors” for the water-hydrogen sulphide exchange tray columns controlled by 1B229.a.",
            "label": "1B229.b – “Internal contactors” for the water-hydrogen sulphide exchange tray columns controlled by 1B229.a.",
            "content": [
              {
                "type": "html",
                "tag": "P",
                "html": "<P>b. “Internal contactors” for the water-hydrogen sulphide exchange tray columns controlled by 1B229.a.</P>",
                "text": "b. “Internal contactors” for the water-hydrogen sulphide exchange tray columns controlled by 1B229.a.",
                "id": null
              }
            ],
            "isEccn": true,
            "boundToParent": true,
            "requireAllChildren": false
          }
        ],
        "isEccn": true,
        "boundToParent": false,
        "requireAllChildren": true
      }
    },
    {
      "version": "2017-12-27",
      "fetchedAt": "2025-10-02T20:33:29.759Z",
      "sourceUrl": "https://www.ecfr.gov/api/versioner/v1/full/2017-12-27/title-15?format=xml",
      "heading": "1B229 Water-hydrogen sulphide exchange tray columns and “internal contactors”, as follows (see List of Items Controlled).",
      "title": "Water-hydrogen sulphide exchange tray columns and “internal contactors”, as follows (see List of Items Controlled).",
      "category": "1",
      "group": "1B",
      "supplement": {
        "number": "1",
        "heading": "Supplement No. 1 to Part 774 - The Commerce Control List"
      },
      "breadcrumbs": [
        "List of Items Controlled"
      ],
      "ancestors": [],
      "text": "1B229 Water-hydrogen sulphide exchange tray columns and “internal contactors”, as follows (see List of Items Controlled).\nLicense Requirements\nReason for Control:\nNP, AT\nControl(s) Country Chart (See Supp. No. 1 to part 738) NP applies to entire entryNP Column 1 AT applies to entire entryAT Column 1\nControl(s)\nCountry Chart (See Supp. No. 1 to part 738)\nNP applies to entire entry\nNP Column 1\nAT applies to entire entry\nAT Column 1\nList Based License Exceptions (See Part 740 for a description of all license exceptions)\nLVS:\nN/A\nGBS:\nN/A\nCIV:\nN/A\nList of Items Controlled\nRelated Controls:\n(1) Equipment “specially designed” or prepared for the production of heavy water is subject to the export licensing authority of the Nuclear Regulatory Commission (see 10 CFR part 110). (2) See ECCNs 1E001 (“development” and “production”) and 1E201 (“use”) for technology for items controlled by this entry.\nRelated Definitions:\nThe “internal contactors” controlled by 1B229.b are segmented trays that have an effective assembled diameter of 1.8 m (6 ft.) or greater, are designed to facilitate countercurrent contacting, and are constructed of stainless steels with a carbon content of 0.03% or less. These may be sieve trays, valve trays, bubble cap trays, or turbogrid trays.\nItems:\na. Water-hydrogen sulphide exchange tray columns, having all of the following characteristics:\n1B229.a\nCan operate at pressures of 2 MPa or greater;\na.1. Can operate at pressures of 2 MPa or greater;\nConstructed of carbon steel having an austenitic ASTM (or equivalent standard) grain size number of 5 or greater; and\na.2. Constructed of carbon steel having an austenitic ASTM (or equivalent standard) grain size number of 5 or greater; and\nWith a diameter of 1.8 m (6 ft.) or greater;\na.3. With a diameter of 1.8 m (6 ft.) or greater;\n“Internal contactors” for the water-hydrogen sulphide exchange tray columns controlled by 1B229.a.\nb. “Internal contactors” for the water-hydrogen sulphide exchange tray columns controlled by 1B229.a.",
      "structure": {
        "identifier": "1B229",
        "heading": "1B229 Water-hydrogen sulphide exchange tray columns and “internal contactors”, as follows (see List of Items Controlled).",
        "label": "1B229 – 1B229 Water-hydrogen sulphide exchange tray columns and “internal contactors”, as follows (see List of Items Controlled).",
        "content": [
          {
            "type": "text",
            "text": "License Requirements"
          },
          {
            "type": "text",
            "text": "Reason for Control:"
          },
          {
            "type": "text",
            "text": "NP, AT"
          },
          {
            "type": "html",
            "tag": "TABLE",
            "html": "<TABLE border=\"1\" cellpadding=\"1\" cellspacing=\"1\" class=\"gpotbl_table\" frame=\"void\" width=\"100%\"><TR><TH class=\"gpotbl_colhed\" scope=\"col\">Control(s)\n</TH><TH class=\"gpotbl_colhed\" scope=\"col\">Country Chart (See Supp. No. 1 to part 738)\n</TH></TR><TR><TD align=\"left\" class=\"gpotbl_cell\" scope=\"row\">NP applies to entire entry (1B229)</TD><TD align=\"left\" class=\"gpotbl_cell\">NP Column 1\n</TD></TR><TR><TD align=\"left\" class=\"gpotbl_cell\" scope=\"row\">AT applies to entire entry (1B229)</TD><TD align=\"left\" class=\"gpotbl_cell\">AT Column 1</TD></TR></TABLE>",
            "text": "Control(s) Country Chart (See Supp. No. 1 to part 738) NP applies to entire entryNP Column 1 AT applies to entire entryAT Column 1",
            "id": null
          },
          {
            "type": "text",
            "text": "Control(s)"
          },
          {
            "type": "text",
            "text": "Country Chart (See Supp. No. 1 to part 738)"
          },
          {
            "type": "text",
            "text": "NP applies to entire entry"
          },
          {
            "type": "text",
            "text": "NP Column 1"
          },
          {
            "type": "text",
            "text": "AT applies to entire entry"
          },
          {
            "type": "text",
            "text": "AT Column 1"
          },
          {
            "type": "text",
            "text": "List Based License Exceptions (See Part 740 for a description of all license exceptions)"
          },
          {
            "type": "text",
            "text": "LVS:"
          },
          {
            "type": "text",
            "text": "N/A"
          },
          {
            "type": "text",
            "text": "GBS:"
          },
          {
            "type": "text",
            "text": "N/A"
          },
          {
            "type": "text",
            "text": "CIV:"
          },
          {
            "type": "text",
            "text": "N/A"
          },
          {
            "type": "text",
            "text": "List of Items Controlled"
          },
          {
            "type": "text",
            "text": "Related Controls:"
          },
          {
            "type": "text",
            "text": "(1) Equipment “specially designed” or prepared for the production of heavy water is subject to the export licensing authority of the Nuclear Regulatory Commission (see 10 CFR part 110). (2) See ECCNs 1E001 (“development” and “production”) and 1E201 (“use”) for technology for items controlled by this entry."
          },
          {
            "type": "text",
            "text": "Related Definitions:"
          },
          {
            "type": "text",
            "text": "The “internal contactors” controlled by 1B229.b are segmented trays that have an effective assembled diameter of 1.8 m (6 ft.) or greater, are designed to facilitate countercurrent contacting, and are constructed of stainless steels with a carbon content of 0.03% or less. These may be sieve trays, valve trays, bubble cap trays, or turbogrid trays."
          },
          {
            "type": "text",
            "text": "Items:"
          },
          {
            "type": "text",
            "text": "a. Water-hydrogen sulphide exchange tray columns, having all of the following characteristics:"
          }
        ],
        "children": [
          {
            "identifier": "1B229.a",
            "heading": null,
            "label": "1B229.a",
            "children": [
              {
                "identifier": "1B229.a.1",
                "heading": "Can operate at pressures of 2 MPa or greater;",
                "label": "1B229.a.1 – Can operate at pressures of 2 MPa or greater;",
                "content": [
                  {
                    "type": "html",
                    "tag": "P",
                    "html": "<P>a.1. Can operate at pressures of 2 MPa or greater;</P>",
                    "text": "a.1. Can operate at pressures of 2 MPa or greater;",
                    "id": null
                  }
                ],
                "isEccn": true,
                "boundToParent": true,
                "requireAllChildren": false
              },
              {
                "identifier": "1B229.a.2",
                "heading": "Constructed of carbon steel having an austenitic ASTM (or equivalent standard) grain size number of 5 or greater; and",
                "label": "1B229.a.2 – Constructed of carbon steel having an austenitic ASTM (or equivalent standard) grain size number of 5 or greater; and",
                "content": [
                  {
                    "type": "html",
                    "tag": "P",
                    "html": "<P>a.2. Constructed of carbon steel having an austenitic ASTM (or equivalent standard) grain size number of 5 or greater; <I>and</I></P>",
                    "text": "a.2. Constructed of carbon steel having an austenitic ASTM (or equivalent standard) grain size number of 5 or greater; and",
                    "id": null
                  }
                ],
                "isEccn": true,
                "boundToParent": true,
                "requireAllChildren": false
              },
              {
                "identifier": "1B229.a.3",
                "heading": "With a diameter of 1.8 m (6 ft.) or greater;",
                "label": "1B229.a.3 – With a diameter of 1.8 m (6 ft.) or greater;",
                "content": [
                  {
                    "type": "html",
                    "tag": "P",
                    "html": "<P>a.3. With a diameter of 1.8 m (6 ft.) or greater;</P>",
                    "text": "a.3. With a diameter of 1.8 m (6 ft.) or greater;",
                    "id": null
                  }
                ],
                "isEccn": true,
                "boundToParent": true,
                "requireAllChildren": false
              }
            ],
            "isEccn": true,
            "boundToParent": true,
            "requireAllChildren": false
          },
          {
            "identifier": "1B229.b",
            "heading": "“Internal contactors” for the water-hydrogen sulphide exchange tray columns controlled by 1B229.a.",
            "label": "1B229.b – “Internal contactors” for the water-hydrogen sulphide exchange tray columns controlled by 1B229.a.",
            "content": [
              {
                "type": "html",
                "tag": "P",
                "html": "<P>b. “Internal contactors” for the water-hydrogen sulphide exchange tray columns controlled by 1B229.a.</P>",
                "text": "b. “Internal contactors” for the water-hydrogen sulphide exchange tray columns controlled by 1B229.a.",
                "id": null
              }
            ],
            "isEccn": true,
            "boundToParent": true,
            "requireAllChildren": false
          }
        ],
        "isEccn": true,
        "boundToParent": false,
        "requireAllChildren": true
      }
    },
    {
      "version": "2018-01-08",
      "fetchedAt": "2025-10-02T20:33:30.194Z",
      "sourceUrl": "https://www.ecfr.gov/api/versioner/v1/full/2018-01-08/title-15?format=xml",
      "heading": "1B229 Water-hydrogen sulphide exchange tray columns and “internal contactors”, as follows (see List of Items Controlled).",
      "title": "Water-hydrogen sulphide exchange tray columns and “internal contactors”, as follows (see List of Items Controlled).",
      "category": "1",
      "group": "1B",
      "supplement": {
        "number": "1",
        "heading": "Supplement No. 1 to Part 774 - The Commerce Control List"
      },
      "breadcrumbs": [
        "List of Items Controlled"
      ],
      "ancestors": [],
      "text": "1B229 Water-hydrogen sulphide exchange tray columns and “internal contactors”, as follows (see List of Items Controlled).\nLicense Requirements\nReason for Control:\nNP, AT\nControl(s) Country Chart (See Supp. No. 1 to part 738) NP applies to entire entryNP Column 1 AT applies to entire entryAT Column 1\nControl(s)\nCountry Chart (See Supp. No. 1 to part 738)\nNP applies to entire entry\nNP Column 1\nAT applies to entire entry\nAT Column 1\nList Based License Exceptions (See Part 740 for a description of all license exceptions)\nLVS:\nN/A\nGBS:\nN/A\nCIV:\nN/A\nList of Items Controlled\nRelated Controls:\n(1) Equipment “specially designed” or prepared for the production of heavy water is subject to the export licensing authority of the Nuclear Regulatory Commission (see 10 CFR part 110). (2) See ECCNs 1E001 (“development” and “production”) and 1E201 (“use”) for technology for items controlled by this entry.\nRelated Definitions:\nThe “internal contactors” controlled by 1B229.b are segmented trays that have an effective assembled diameter of 1.8 m (6 ft.) or greater, are designed to facilitate countercurrent contacting, and are constructed of stainless steels with a carbon content of 0.03% or less. These may be sieve trays, valve trays, bubble cap trays, or turbogrid trays.\nItems:\na. Water-hydrogen sulphide exchange tray columns, having all of the following characteristics:\n1B229.a\nCan operate at pressures of 2 MPa or greater;\na.1. Can operate at pressures of 2 MPa or greater;\nConstructed of carbon steel having an austenitic ASTM (or equivalent standard) grain size number of 5 or greater; and\na.2. Constructed of carbon steel having an austenitic ASTM (or equivalent standard) grain size number of 5 or greater; and\nWith a diameter of 1.8 m (6 ft.) or greater;\na.3. With a diameter of 1.8 m (6 ft.) or greater;\n“Internal contactors” for the water-hydrogen sulphide exchange tray columns controlled by 1B229.a.\nb. “Internal contactors” for the water-hydrogen sulphide exchange tray columns controlled by 1B229.a.",
      "structure": {
        "identifier": "1B229",
        "heading": "1B229 Water-hydrogen sulphide exchange tray columns and “internal contactors”, as follows (see List of Items Controlled).",
        "label": "1B229 – 1B229 Water-hydrogen sulphide exchange tray columns and “internal contactors”, as follows (see List of Items Controlled).",
        "content": [
          {
            "type": "text",
            "text": "License Requirements"
          },
          {
            "type": "text",
            "text": "Reason for Control:"
          },
          {
            "type": "text",
            "text": "NP, AT"
          },
          {
            "type": "html",
            "tag": "TABLE",
            "html": "<TABLE border=\"1\" cellpadding=\"1\" cellspacing=\"1\" class=\"gpotbl_table\" frame=\"void\" width=\"100%\"><TR><TH class=\"gpotbl_colhed\" scope=\"col\">Control(s)\n</TH><TH class=\"gpotbl_colhed\" scope=\"col\">Country Chart (See Supp. No. 1 to part 738)\n</TH></TR><TR><TD align=\"left\" class=\"gpotbl_cell\" scope=\"row\">NP applies to entire entry (1B229)</TD><TD align=\"left\" class=\"gpotbl_cell\">NP Column 1\n</TD></TR><TR><TD align=\"left\" class=\"gpotbl_cell\" scope=\"row\">AT applies to entire entry (1B229)</TD><TD align=\"left\" class=\"gpotbl_cell\">AT Column 1</TD></TR></TABLE>",
            "text": "Control(s) Country Chart (See Supp. No. 1 to part 738) NP applies to entire entryNP Column 1 AT applies to entire entryAT Column 1",
            "id": null
          },
          {
            "type": "text",
            "text": "Control(s)"
          },
          {
            "type": "text",
            "text": "Country Chart (See Supp. No. 1 to part 738)"
          },
          {
            "type": "text",
            "text": "NP applies to entire entry"
          },
          {
            "type": "text",
            "text": "NP Column 1"
          },
          {
            "type": "text",
            "text": "AT applies to entire entry"
          },
          {
            "type": "text",
            "text": "AT Column 1"
          },
          {
            "type": "text",
            "text": "List Based License Exceptions (See Part 740 for a description of all license exceptions)"
          },
          {
            "type": "text",
            "text": "LVS:"
          },
          {
            "type": "text",
            "text": "N/A"
          },
          {
            "type": "text",
            "text": "GBS:"
          },
          {
            "type": "text",
            "text": "N/A"
          },
          {
            "type": "text",
            "text": "CIV:"
          },
          {
            "type": "text",
            "text": "N/A"
          },
          {
            "type": "text",
            "text": "List of Items Controlled"
          },
          {
            "type": "text",
            "text": "Related Controls:"
          },
          {
            "type": "text",
            "text": "(1) Equipment “specially designed” or prepared for the production of heavy water is subject to the export licensing authority of the Nuclear Regulatory Commission (see 10 CFR part 110). (2) See ECCNs 1E001 (“development” and “production”) and 1E201 (“use”) for technology for items controlled by this entry."
          },
          {
            "type": "text",
            "text": "Related Definitions:"
          },
          {
            "type": "text",
            "text": "The “internal contactors” controlled by 1B229.b are segmented trays that have an effective assembled diameter of 1.8 m (6 ft.) or greater, are designed to facilitate countercurrent contacting, and are constructed of stainless steels with a carbon content of 0.03% or less. These may be sieve trays, valve trays, bubble cap trays, or turbogrid trays."
          },
          {
            "type": "text",
            "text": "Items:"
          },
          {
            "type": "text",
            "text": "a. Water-hydrogen sulphide exchange tray columns, having all of the following characteristics:"
          }
        ],
        "children": [
          {
            "identifier": "1B229.a",
            "heading": null,
            "label": "1B229.a",
            "children": [
              {
                "identifier": "1B229.a.1",
                "heading": "Can operate at pressures of 2 MPa or greater;",
                "label": "1B229.a.1 – Can operate at pressures of 2 MPa or greater;",
                "content": [
                  {
                    "type": "html",
                    "tag": "P",
                    "html": "<P>a.1. Can operate at pressures of 2 MPa or greater;</P>",
                    "text": "a.1. Can operate at pressures of 2 MPa or greater;",
                    "id": null
                  }
                ],
                "isEccn": true,
                "boundToParent": true,
                "requireAllChildren": false
              },
              {
                "identifier": "1B229.a.2",
                "heading": "Constructed of carbon steel having an austenitic ASTM (or equivalent standard) grain size number of 5 or greater; and",
                "label": "1B229.a.2 – Constructed of carbon steel having an austenitic ASTM (or equivalent standard) grain size number of 5 or greater; and",
                "content": [
                  {
                    "type": "html",
                    "tag": "P",
                    "html": "<P>a.2. Constructed of carbon steel having an austenitic ASTM (or equivalent standard) grain size number of 5 or greater; <I>and</I></P>",
                    "text": "a.2. Constructed of carbon steel having an austenitic ASTM (or equivalent standard) grain size number of 5 or greater; and",
                    "id": null
                  }
                ],
                "isEccn": true,
                "boundToParent": true,
                "requireAllChildren": false
              },
              {
                "identifier": "1B229.a.3",
                "heading": "With a diameter of 1.8 m (6 ft.) or greater;",
                "label": "1B229.a.3 – With a diameter of 1.8 m (6 ft.) or greater;",
                "content": [
                  {
                    "type": "html",
                    "tag": "P",
                    "html": "<P>a.3. With a diameter of 1.8 m (6 ft.) or greater;</P>",
                    "text": "a.3. With a diameter of 1.8 m (6 ft.) or greater;",
                    "id": null
                  }
                ],
                "isEccn": true,
                "boundToParent": true,
                "requireAllChildren": false
              }
            ],
            "isEccn": true,
            "boundToParent": true,
            "requireAllChildren": false
          },
          {
            "identifier": "1B229.b",
            "heading": "“Internal contactors” for the water-hydrogen sulphide exchange tray columns controlled by 1B229.a.",
            "label": "1B229.b – “Internal contactors” for the water-hydrogen sulphide exchange tray columns controlled by 1B229.a.",
            "content": [
              {
                "type": "html",
                "tag": "P",
                "html": "<P>b. “Internal contactors” for the water-hydrogen sulphide exchange tray columns controlled by 1B229.a.</P>",
                "text": "b. “Internal contactors” for the water-hydrogen sulphide exchange tray columns controlled by 1B229.a.",
                "id": null
              }
            ],
            "isEccn": true,
            "boundToParent": true,
            "requireAllChildren": false
          }
        ],
        "isEccn": true,
        "boundToParent": false,
        "requireAllChildren": true
      }
    },
    {
      "version": "2018-04-02",
      "fetchedAt": "2025-10-02T20:33:30.716Z",
      "sourceUrl": "https://www.ecfr.gov/api/versioner/v1/full/2018-04-02/title-15?format=xml",
      "heading": "1B229 Water-hydrogen sulphide exchange tray columns and “internal contactors”, as follows (see List of Items Controlled).",
      "title": "Water-hydrogen sulphide exchange tray columns and “internal contactors”, as follows (see List of Items Controlled).",
      "category": "1",
      "group": "1B",
      "supplement": {
        "number": "1",
        "heading": "Supplement No. 1 to Part 774 - The Commerce Control List"
      },
      "breadcrumbs": [
        "List of Items Controlled"
      ],
      "ancestors": [],
      "text": "1B229 Water-hydrogen sulphide exchange tray columns and “internal contactors”, as follows (see List of Items Controlled).\nLicense Requirements\nReason for Control:\nNP, AT\nControl(s) Country Chart (See Supp. No. 1 to part 738) NP applies to entire entryNP Column 1 AT applies to entire entryAT Column 1\nControl(s)\nCountry Chart (See Supp. No. 1 to part 738)\nNP applies to entire entry\nNP Column 1\nAT applies to entire entry\nAT Column 1\nList Based License Exceptions (See Part 740 for a description of all license exceptions)\nLVS:\nN/A\nGBS:\nN/A\nCIV:\nN/A\nList of Items Controlled\nRelated Controls:\n(1) Equipment “specially designed” or prepared for the production of heavy water is subject to the export licensing authority of the Nuclear Regulatory Commission (see 10 CFR part 110). (2) See ECCNs 1E001 (“development” and “production”) and 1E201 (“use”) for technology for items controlled by this entry.\nRelated Definitions:\nThe “internal contactors” controlled by 1B229.b are segmented trays that have an effective assembled diameter of 1.8 m (6 ft.) or greater, are designed to facilitate countercurrent contacting, and are constructed of stainless steels with a carbon content of 0.03% or less. These may be sieve trays, valve trays, bubble cap trays, or turbogrid trays.\nItems:\na. Water-hydrogen sulphide exchange tray columns, having all of the following characteristics:\n1B229.a\nCan operate at pressures of 2 MPa or greater;\na.1. Can operate at pressures of 2 MPa or greater;\nConstructed of carbon steel having an austenitic ASTM (or equivalent standard) grain size number of 5 or greater; and\na.2. Constructed of carbon steel having an austenitic ASTM (or equivalent standard) grain size number of 5 or greater; and\nWith a diameter of 1.8 m (6 ft.) or greater;\na.3. With a diameter of 1.8 m (6 ft.) or greater;\n“Internal contactors” for the water-hydrogen sulphide exchange tray columns controlled by 1B229.a.\nb. “Internal contactors” for the water-hydrogen sulphide exchange tray columns controlled by 1B229.a.",
      "structure": {
        "identifier": "1B229",
        "heading": "1B229 Water-hydrogen sulphide exchange tray columns and “internal contactors”, as follows (see List of Items Controlled).",
        "label": "1B229 – 1B229 Water-hydrogen sulphide exchange tray columns and “internal contactors”, as follows (see List of Items Controlled).",
        "content": [
          {
            "type": "text",
            "text": "License Requirements"
          },
          {
            "type": "text",
            "text": "Reason for Control:"
          },
          {
            "type": "text",
            "text": "NP, AT"
          },
          {
            "type": "html",
            "tag": "TABLE",
            "html": "<TABLE border=\"1\" cellpadding=\"1\" cellspacing=\"1\" class=\"gpotbl_table\" frame=\"void\" width=\"100%\"><TR><TH class=\"gpotbl_colhed\" scope=\"col\">Control(s)\n</TH><TH class=\"gpotbl_colhed\" scope=\"col\">Country Chart (See Supp. No. 1 to part 738)\n</TH></TR><TR><TD align=\"left\" class=\"gpotbl_cell\" scope=\"row\">NP applies to entire entry (1B229)</TD><TD align=\"left\" class=\"gpotbl_cell\">NP Column 1\n</TD></TR><TR><TD align=\"left\" class=\"gpotbl_cell\" scope=\"row\">AT applies to entire entry (1B229)</TD><TD align=\"left\" class=\"gpotbl_cell\">AT Column 1</TD></TR></TABLE>",
            "text": "Control(s) Country Chart (See Supp. No. 1 to part 738) NP applies to entire entryNP Column 1 AT applies to entire entryAT Column 1",
            "id": null
          },
          {
            "type": "text",
            "text": "Control(s)"
          },
          {
            "type": "text",
            "text": "Country Chart (See Supp. No. 1 to part 738)"
          },
          {
            "type": "text",
            "text": "NP applies to entire entry"
          },
          {
            "type": "text",
            "text": "NP Column 1"
          },
          {
            "type": "text",
            "text": "AT applies to entire entry"
          },
          {
            "type": "text",
            "text": "AT Column 1"
          },
          {
            "type": "text",
            "text": "List Based License Exceptions (See Part 740 for a description of all license exceptions)"
          },
          {
            "type": "text",
            "text": "LVS:"
          },
          {
            "type": "text",
            "text": "N/A"
          },
          {
            "type": "text",
            "text": "GBS:"
          },
          {
            "type": "text",
            "text": "N/A"
          },
          {
            "type": "text",
            "text": "CIV:"
          },
          {
            "type": "text",
            "text": "N/A"
          },
          {
            "type": "text",
            "text": "List of Items Controlled"
          },
          {
            "type": "text",
            "text": "Related Controls:"
          },
          {
            "type": "text",
            "text": "(1) Equipment “specially designed” or prepared for the production of heavy water is subject to the export licensing authority of the Nuclear Regulatory Commission (see 10 CFR part 110). (2) See ECCNs 1E001 (“development” and “production”) and 1E201 (“use”) for technology for items controlled by this entry."
          },
          {
            "type": "text",
            "text": "Related Definitions:"
          },
          {
            "type": "text",
            "text": "The “internal contactors” controlled by 1B229.b are segmented trays that have an effective assembled diameter of 1.8 m (6 ft.) or greater, are designed to facilitate countercurrent contacting, and are constructed of stainless steels with a carbon content of 0.03% or less. These may be sieve trays, valve trays, bubble cap trays, or turbogrid trays."
          },
          {
            "type": "text",
            "text": "Items:"
          },
          {
            "type": "text",
            "text": "a. Water-hydrogen sulphide exchange tray columns, having all of the following characteristics:"
          }
        ],
        "children": [
          {
            "identifier": "1B229.a",
            "heading": null,
            "label": "1B229.a",
            "children": [
              {
                "identifier": "1B229.a.1",
                "heading": "Can operate at pressures of 2 MPa or greater;",
                "label": "1B229.a.1 – Can operate at pressures of 2 MPa or greater;",
                "content": [
                  {
                    "type": "html",
                    "tag": "P",
                    "html": "<P>a.1. Can operate at pressures of 2 MPa or greater;</P>",
                    "text": "a.1. Can operate at pressures of 2 MPa or greater;",
                    "id": null
                  }
                ],
                "isEccn": true,
                "boundToParent": true,
                "requireAllChildren": false
              },
              {
                "identifier": "1B229.a.2",
                "heading": "Constructed of carbon steel having an austenitic ASTM (or equivalent standard) grain size number of 5 or greater; and",
                "label": "1B229.a.2 – Constructed of carbon steel having an austenitic ASTM (or equivalent standard) grain size number of 5 or greater; and",
                "content": [
                  {
                    "type": "html",
                    "tag": "P",
                    "html": "<P>a.2. Constructed of carbon steel having an austenitic ASTM (or equivalent standard) grain size number of 5 or greater; <I>and</I></P>",
                    "text": "a.2. Constructed of carbon steel having an austenitic ASTM (or equivalent standard) grain size number of 5 or greater; and",
                    "id": null
                  }
                ],
                "isEccn": true,
                "boundToParent": true,
                "requireAllChildren": false
              },
              {
                "identifier": "1B229.a.3",
                "heading": "With a diameter of 1.8 m (6 ft.) or greater;",
                "label": "1B229.a.3 – With a diameter of 1.8 m (6 ft.) or greater;",
                "content": [
                  {
                    "type": "html",
                    "tag": "P",
                    "html": "<P>a.3. With a diameter of 1.8 m (6 ft.) or greater;</P>",
                    "text": "a.3. With a diameter of 1.8 m (6 ft.) or greater;",
                    "id": null
                  }
                ],
                "isEccn": true,
                "boundToParent": true,
                "requireAllChildren": false
              }
            ],
            "isEccn": true,
            "boundToParent": true,
            "requireAllChildren": false
          },
          {
            "identifier": "1B229.b",
            "heading": "“Internal contactors” for the water-hydrogen sulphide exchange tray columns controlled by 1B229.a.",
            "label": "1B229.b – “Internal contactors” for the water-hydrogen sulphide exchange tray columns controlled by 1B229.a.",
            "content": [
              {
                "type": "html",
                "tag": "P",
                "html": "<P>b. “Internal contactors” for the water-hydrogen sulphide exchange tray columns controlled by 1B229.a.</P>",
                "text": "b. “Internal contactors” for the water-hydrogen sulphide exchange tray columns controlled by 1B229.a.",
                "id": null
              }
            ],
            "isEccn": true,
            "boundToParent": true,
            "requireAllChildren": false
          }
        ],
        "isEccn": true,
        "boundToParent": false,
        "requireAllChildren": true
      }
    },
    {
      "version": "2018-04-05",
      "fetchedAt": "2025-10-02T20:33:31.145Z",
      "sourceUrl": "https://www.ecfr.gov/api/versioner/v1/full/2018-04-05/title-15?format=xml",
      "heading": "1B229 Water-hydrogen sulphide exchange tray columns and “internal contactors”, as follows (see List of Items Controlled).",
      "title": "Water-hydrogen sulphide exchange tray columns and “internal contactors”, as follows (see List of Items Controlled).",
      "category": "1",
      "group": "1B",
      "supplement": {
        "number": "1",
        "heading": "Supplement No. 1 to Part 774 - The Commerce Control List"
      },
      "breadcrumbs": [
        "List of Items Controlled"
      ],
      "ancestors": [],
      "text": "1B229 Water-hydrogen sulphide exchange tray columns and “internal contactors”, as follows (see List of Items Controlled).\nLicense Requirements\nReason for Control:\nNP, AT\nControl(s) Country Chart (See Supp. No. 1 to part 738) NP applies to entire entryNP Column 1 AT applies to entire entryAT Column 1\nControl(s)\nCountry Chart (See Supp. No. 1 to part 738)\nNP applies to entire entry\nNP Column 1\nAT applies to entire entry\nAT Column 1\nList Based License Exceptions (See Part 740 for a description of all license exceptions)\nLVS:\nN/A\nGBS:\nN/A\nCIV:\nN/A\nList of Items Controlled\nRelated Controls:\n(1) Equipment “specially designed” or prepared for the production of heavy water is subject to the export licensing authority of the Nuclear Regulatory Commission (see 10 CFR part 110). (2) See ECCNs 1E001 (“development” and “production”) and 1E201 (“use”) for technology for items controlled by this entry.\nRelated Definitions:\nThe “internal contactors” controlled by 1B229.b are segmented trays that have an effective assembled diameter of 1.8 m (6 ft.) or greater, are designed to facilitate countercurrent contacting, and are constructed of stainless steels with a carbon content of 0.03% or less. These may be sieve trays, valve trays, bubble cap trays, or turbogrid trays.\nItems:\na. Water-hydrogen sulphide exchange tray columns, having all of the following characteristics:\n1B229.a\nCan operate at pressures of 2 MPa or greater;\na.1. Can operate at pressures of 2 MPa or greater;\nConstructed of carbon steel having an austenitic ASTM (or equivalent standard) grain size number of 5 or greater; and\na.2. Constructed of carbon steel having an austenitic ASTM (or equivalent standard) grain size number of 5 or greater; and\nWith a diameter of 1.8 m (6 ft.) or greater;\na.3. With a diameter of 1.8 m (6 ft.) or greater;\n“Internal contactors” for the water-hydrogen sulphide exchange tray columns controlled by 1B229.a.\nb. “Internal contactors” for the water-hydrogen sulphide exchange tray columns controlled by 1B229.a.",
      "structure": {
        "identifier": "1B229",
        "heading": "1B229 Water-hydrogen sulphide exchange tray columns and “internal contactors”, as follows (see List of Items Controlled).",
        "label": "1B229 – 1B229 Water-hydrogen sulphide exchange tray columns and “internal contactors”, as follows (see List of Items Controlled).",
        "content": [
          {
            "type": "text",
            "text": "License Requirements"
          },
          {
            "type": "text",
            "text": "Reason for Control:"
          },
          {
            "type": "text",
            "text": "NP, AT"
          },
          {
            "type": "html",
            "tag": "TABLE",
            "html": "<TABLE border=\"1\" cellpadding=\"1\" cellspacing=\"1\" class=\"gpotbl_table\" frame=\"void\" width=\"100%\"><TR><TH class=\"gpotbl_colhed\" scope=\"col\">Control(s)\n</TH><TH class=\"gpotbl_colhed\" scope=\"col\">Country Chart (See Supp. No. 1 to part 738)\n</TH></TR><TR><TD align=\"left\" class=\"gpotbl_cell\" scope=\"row\">NP applies to entire entry (1B229)</TD><TD align=\"left\" class=\"gpotbl_cell\">NP Column 1\n</TD></TR><TR><TD align=\"left\" class=\"gpotbl_cell\" scope=\"row\">AT applies to entire entry (1B229)</TD><TD align=\"left\" class=\"gpotbl_cell\">AT Column 1</TD></TR></TABLE>",
            "text": "Control(s) Country Chart (See Supp. No. 1 to part 738) NP applies to entire entryNP Column 1 AT applies to entire entryAT Column 1",
            "id": null
          },
          {
            "type": "text",
            "text": "Control(s)"
          },
          {
            "type": "text",
            "text": "Country Chart (See Supp. No. 1 to part 738)"
          },
          {
            "type": "text",
            "text": "NP applies to entire entry"
          },
          {
            "type": "text",
            "text": "NP Column 1"
          },
          {
            "type": "text",
            "text": "AT applies to entire entry"
          },
          {
            "type": "text",
            "text": "AT Column 1"
          },
          {
            "type": "text",
            "text": "List Based License Exceptions (See Part 740 for a description of all license exceptions)"
          },
          {
            "type": "text",
            "text": "LVS:"
          },
          {
            "type": "text",
            "text": "N/A"
          },
          {
            "type": "text",
            "text": "GBS:"
          },
          {
            "type": "text",
            "text": "N/A"
          },
          {
            "type": "text",
            "text": "CIV:"
          },
          {
            "type": "text",
            "text": "N/A"
          },
          {
            "type": "text",
            "text": "List of Items Controlled"
          },
          {
            "type": "text",
            "text": "Related Controls:"
          },
          {
            "type": "text",
            "text": "(1) Equipment “specially designed” or prepared for the production of heavy water is subject to the export licensing authority of the Nuclear Regulatory Commission (see 10 CFR part 110). (2) See ECCNs 1E001 (“development” and “production”) and 1E201 (“use”) for technology for items controlled by this entry."
          },
          {
            "type": "text",
            "text": "Related Definitions:"
          },
          {
            "type": "text",
            "text": "The “internal contactors” controlled by 1B229.b are segmented trays that have an effective assembled diameter of 1.8 m (6 ft.) or greater, are designed to facilitate countercurrent contacting, and are constructed of stainless steels with a carbon content of 0.03% or less. These may be sieve trays, valve trays, bubble cap trays, or turbogrid trays."
          },
          {
            "type": "text",
            "text": "Items:"
          },
          {
            "type": "text",
            "text": "a. Water-hydrogen sulphide exchange tray columns, having all of the following characteristics:"
          }
        ],
        "children": [
          {
            "identifier": "1B229.a",
            "heading": null,
            "label": "1B229.a",
            "children": [
              {
                "identifier": "1B229.a.1",
                "heading": "Can operate at pressures of 2 MPa or greater;",
                "label": "1B229.a.1 – Can operate at pressures of 2 MPa or greater;",
                "content": [
                  {
                    "type": "html",
                    "tag": "P",
                    "html": "<P>a.1. Can operate at pressures of 2 MPa or greater;</P>",
                    "text": "a.1. Can operate at pressures of 2 MPa or greater;",
                    "id": null
                  }
                ],
                "isEccn": true,
                "boundToParent": true,
                "requireAllChildren": false
              },
              {
                "identifier": "1B229.a.2",
                "heading": "Constructed of carbon steel having an austenitic ASTM (or equivalent standard) grain size number of 5 or greater; and",
                "label": "1B229.a.2 – Constructed of carbon steel having an austenitic ASTM (or equivalent standard) grain size number of 5 or greater; and",
                "content": [
                  {
                    "type": "html",
                    "tag": "P",
                    "html": "<P>a.2. Constructed of carbon steel having an austenitic ASTM (or equivalent standard) grain size number of 5 or greater; <I>and</I></P>",
                    "text": "a.2. Constructed of carbon steel having an austenitic ASTM (or equivalent standard) grain size number of 5 or greater; and",
                    "id": null
                  }
                ],
                "isEccn": true,
                "boundToParent": true,
                "requireAllChildren": false
              },
              {
                "identifier": "1B229.a.3",
                "heading": "With a diameter of 1.8 m (6 ft.) or greater;",
                "label": "1B229.a.3 – With a diameter of 1.8 m (6 ft.) or greater;",
                "content": [
                  {
                    "type": "html",
                    "tag": "P",
                    "html": "<P>a.3. With a diameter of 1.8 m (6 ft.) or greater;</P>",
                    "text": "a.3. With a diameter of 1.8 m (6 ft.) or greater;",
                    "id": null
                  }
                ],
                "isEccn": true,
                "boundToParent": true,
                "requireAllChildren": false
              }
            ],
            "isEccn": true,
            "boundToParent": true,
            "requireAllChildren": false
          },
          {
            "identifier": "1B229.b",
            "heading": "“Internal contactors” for the water-hydrogen sulphide exchange tray columns controlled by 1B229.a.",
            "label": "1B229.b – “Internal contactors” for the water-hydrogen sulphide exchange tray columns controlled by 1B229.a.",
            "content": [
              {
                "type": "html",
                "tag": "P",
                "html": "<P>b. “Internal contactors” for the water-hydrogen sulphide exchange tray columns controlled by 1B229.a.</P>",
                "text": "b. “Internal contactors” for the water-hydrogen sulphide exchange tray columns controlled by 1B229.a.",
                "id": null
              }
            ],
            "isEccn": true,
            "boundToParent": true,
            "requireAllChildren": false
          }
        ],
        "isEccn": true,
        "boundToParent": false,
        "requireAllChildren": true
      }
    },
    {
      "version": "2018-08-30",
      "fetchedAt": "2025-10-02T20:33:31.567Z",
      "sourceUrl": "https://www.ecfr.gov/api/versioner/v1/full/2018-08-30/title-15?format=xml",
      "heading": "1B229 Water-hydrogen sulphide exchange tray columns and “internal contactors”, as follows (see List of Items Controlled).",
      "title": "Water-hydrogen sulphide exchange tray columns and “internal contactors”, as follows (see List of Items Controlled).",
      "category": "1",
      "group": "1B",
      "supplement": {
        "number": "1",
        "heading": "Supplement No. 1 to Part 774 - The Commerce Control List"
      },
      "breadcrumbs": [
        "List of Items Controlled"
      ],
      "ancestors": [],
      "text": "1B229 Water-hydrogen sulphide exchange tray columns and “internal contactors”, as follows (see List of Items Controlled).\nLicense Requirements\nReason for Control:\nNP, AT\nControl(s) Country Chart (See Supp. No. 1 to part 738) NP applies to entire entryNP Column 1 AT applies to entire entryAT Column 1\nControl(s)\nCountry Chart (See Supp. No. 1 to part 738)\nNP applies to entire entry\nNP Column 1\nAT applies to entire entry\nAT Column 1\nList Based License Exceptions (See Part 740 for a description of all license exceptions)\nLVS:\nN/A\nGBS:\nN/A\nCIV:\nN/A\nList of Items Controlled\nRelated Controls:\n(1) Equipment “specially designed” or prepared for the production of heavy water is subject to the export licensing authority of the Nuclear Regulatory Commission (see 10 CFR part 110). (2) See ECCNs 1E001 (“development” and “production”) and 1E201 (“use”) for technology for items controlled by this entry.\nRelated Definitions:\nThe “internal contactors” controlled by 1B229.b are segmented trays that have an effective assembled diameter of 1.8 m (6 ft.) or greater, are designed to facilitate countercurrent contacting, and are constructed of stainless steels with a carbon content of 0.03% or less. These may be sieve trays, valve trays, bubble cap trays, or turbogrid trays.\nItems:\na. Water-hydrogen sulphide exchange tray columns, having all of the following characteristics:\n1B229.a\nCan operate at pressures of 2 MPa or greater;\na.1. Can operate at pressures of 2 MPa or greater;\nConstructed of carbon steel having an austenitic ASTM (or equivalent standard) grain size number of 5 or greater; and\na.2. Constructed of carbon steel having an austenitic ASTM (or equivalent standard) grain size number of 5 or greater; and\nWith a diameter of 1.8 m (6 ft.) or greater;\na.3. With a diameter of 1.8 m (6 ft.) or greater;\n“Internal contactors” for the water-hydrogen sulphide exchange tray columns controlled by 1B229.a.\nb. “Internal contactors” for the water-hydrogen sulphide exchange tray columns controlled by 1B229.a.",
      "structure": {
        "identifier": "1B229",
        "heading": "1B229 Water-hydrogen sulphide exchange tray columns and “internal contactors”, as follows (see List of Items Controlled).",
        "label": "1B229 – 1B229 Water-hydrogen sulphide exchange tray columns and “internal contactors”, as follows (see List of Items Controlled).",
        "content": [
          {
            "type": "text",
            "text": "License Requirements"
          },
          {
            "type": "text",
            "text": "Reason for Control:"
          },
          {
            "type": "text",
            "text": "NP, AT"
          },
          {
            "type": "html",
            "tag": "TABLE",
            "html": "<TABLE border=\"1\" cellpadding=\"1\" cellspacing=\"1\" class=\"gpotbl_table\" frame=\"void\" width=\"100%\"><TR><TH class=\"gpotbl_colhed\" scope=\"col\">Control(s)\n</TH><TH class=\"gpotbl_colhed\" scope=\"col\">Country Chart (See Supp. No. 1 to part 738)\n</TH></TR><TR><TD align=\"left\" class=\"gpotbl_cell\" scope=\"row\">NP applies to entire entry (1B229)</TD><TD align=\"left\" class=\"gpotbl_cell\">NP Column 1\n</TD></TR><TR><TD align=\"left\" class=\"gpotbl_cell\" scope=\"row\">AT applies to entire entry (1B229)</TD><TD align=\"left\" class=\"gpotbl_cell\">AT Column 1</TD></TR></TABLE>",
            "text": "Control(s) Country Chart (See Supp. No. 1 to part 738) NP applies to entire entryNP Column 1 AT applies to entire entryAT Column 1",
            "id": null
          },
          {
            "type": "text",
            "text": "Control(s)"
          },
          {
            "type": "text",
            "text": "Country Chart (See Supp. No. 1 to part 738)"
          },
          {
            "type": "text",
            "text": "NP applies to entire entry"
          },
          {
            "type": "text",
            "text": "NP Column 1"
          },
          {
            "type": "text",
            "text": "AT applies to entire entry"
          },
          {
            "type": "text",
            "text": "AT Column 1"
          },
          {
            "type": "text",
            "text": "List Based License Exceptions (See Part 740 for a description of all license exceptions)"
          },
          {
            "type": "text",
            "text": "LVS:"
          },
          {
            "type": "text",
            "text": "N/A"
          },
          {
            "type": "text",
            "text": "GBS:"
          },
          {
            "type": "text",
            "text": "N/A"
          },
          {
            "type": "text",
            "text": "CIV:"
          },
          {
            "type": "text",
            "text": "N/A"
          },
          {
            "type": "text",
            "text": "List of Items Controlled"
          },
          {
            "type": "text",
            "text": "Related Controls:"
          },
          {
            "type": "text",
            "text": "(1) Equipment “specially designed” or prepared for the production of heavy water is subject to the export licensing authority of the Nuclear Regulatory Commission (see 10 CFR part 110). (2) See ECCNs 1E001 (“development” and “production”) and 1E201 (“use”) for technology for items controlled by this entry."
          },
          {
            "type": "text",
            "text": "Related Definitions:"
          },
          {
            "type": "text",
            "text": "The “internal contactors” controlled by 1B229.b are segmented trays that have an effective assembled diameter of 1.8 m (6 ft.) or greater, are designed to facilitate countercurrent contacting, and are constructed of stainless steels with a carbon content of 0.03% or less. These may be sieve trays, valve trays, bubble cap trays, or turbogrid trays."
          },
          {
            "type": "text",
            "text": "Items:"
          },
          {
            "type": "text",
            "text": "a. Water-hydrogen sulphide exchange tray columns, having all of the following characteristics:"
          }
        ],
        "children": [
          {
            "identifier": "1B229.a",
            "heading": null,
            "label": "1B229.a",
            "children": [
              {
                "identifier": "1B229.a.1",
                "heading": "Can operate at pressures of 2 MPa or greater;",
                "label": "1B229.a.1 – Can operate at pressures of 2 MPa or greater;",
                "content": [
                  {
                    "type": "html",
                    "tag": "P",
                    "html": "<P>a.1. Can operate at pressures of 2 MPa or greater;</P>",
                    "text": "a.1. Can operate at pressures of 2 MPa or greater;",
                    "id": null
                  }
                ],
                "isEccn": true,
                "boundToParent": true,
                "requireAllChildren": false
              },
              {
                "identifier": "1B229.a.2",
                "heading": "Constructed of carbon steel having an austenitic ASTM (or equivalent standard) grain size number of 5 or greater; and",
                "label": "1B229.a.2 – Constructed of carbon steel having an austenitic ASTM (or equivalent standard) grain size number of 5 or greater; and",
                "content": [
                  {
                    "type": "html",
                    "tag": "P",
                    "html": "<P>a.2. Constructed of carbon steel having an austenitic ASTM (or equivalent standard) grain size number of 5 or greater; <I>and</I></P>",
                    "text": "a.2. Constructed of carbon steel having an austenitic ASTM (or equivalent standard) grain size number of 5 or greater; and",
                    "id": null
                  }
                ],
                "isEccn": true,
                "boundToParent": true,
                "requireAllChildren": false
              },
              {
                "identifier": "1B229.a.3",
                "heading": "With a diameter of 1.8 m (6 ft.) or greater;",
                "label": "1B229.a.3 – With a diameter of 1.8 m (6 ft.) or greater;",
                "content": [
                  {
                    "type": "html",
                    "tag": "P",
                    "html": "<P>a.3. With a diameter of 1.8 m (6 ft.) or greater;</P>",
                    "text": "a.3. With a diameter of 1.8 m (6 ft.) or greater;",
                    "id": null
                  }
                ],
                "isEccn": true,
                "boundToParent": true,
                "requireAllChildren": false
              }
            ],
            "isEccn": true,
            "boundToParent": true,
            "requireAllChildren": false
          },
          {
            "identifier": "1B229.b",
            "heading": "“Internal contactors” for the water-hydrogen sulphide exchange tray columns controlled by 1B229.a.",
            "label": "1B229.b – “Internal contactors” for the water-hydrogen sulphide exchange tray columns controlled by 1B229.a.",
            "content": [
              {
                "type": "html",
                "tag": "P",
                "html": "<P>b. “Internal contactors” for the water-hydrogen sulphide exchange tray columns controlled by 1B229.a.</P>",
                "text": "b. “Internal contactors” for the water-hydrogen sulphide exchange tray columns controlled by 1B229.a.",
                "id": null
              }
            ],
            "isEccn": true,
            "boundToParent": true,
            "requireAllChildren": false
          }
        ],
        "isEccn": true,
        "boundToParent": false,
        "requireAllChildren": true
      }
    },
    {
      "version": "2018-10-24",
      "fetchedAt": "2025-10-02T20:33:31.990Z",
      "sourceUrl": "https://www.ecfr.gov/api/versioner/v1/full/2018-10-24/title-15?format=xml",
      "heading": "1B229 Water-hydrogen sulphide exchange tray columns and “internal contactors”, as follows (see List of Items Controlled).",
      "title": "Water-hydrogen sulphide exchange tray columns and “internal contactors”, as follows (see List of Items Controlled).",
      "category": "1",
      "group": "1B",
      "supplement": {
        "number": "1",
        "heading": "Supplement No. 1 to Part 774 - The Commerce Control List"
      },
      "breadcrumbs": [
        "List of Items Controlled"
      ],
      "ancestors": [],
      "text": "1B229 Water-hydrogen sulphide exchange tray columns and “internal contactors”, as follows (see List of Items Controlled).\nLicense Requirements\nReason for Control:\nNP, AT\nControl(s) Country Chart (See Supp. No. 1 to part 738) NP applies to entire entryNP Column 1 AT applies to entire entryAT Column 1\nControl(s)\nCountry Chart (See Supp. No. 1 to part 738)\nNP applies to entire entry\nNP Column 1\nAT applies to entire entry\nAT Column 1\nList Based License Exceptions (See Part 740 for a description of all license exceptions)\nLVS:\nN/A\nGBS:\nN/A\nCIV:\nN/A\nList of Items Controlled\nRelated Controls:\n(1) Equipment “specially designed” or prepared for the production of heavy water is subject to the export licensing authority of the Nuclear Regulatory Commission (see 10 CFR part 110). (2) See ECCNs 1E001 (“development” and “production”) and 1E201 (“use”) for technology for items controlled by this entry.\nRelated Definitions:\nThe “internal contactors” controlled by 1B229.b are segmented trays that have an effective assembled diameter of 1.8 m (6 ft.) or greater, are designed to facilitate countercurrent contacting, and are constructed of stainless steels with a carbon content of 0.03% or less. These may be sieve trays, valve trays, bubble cap trays, or turbogrid trays.\nItems:\na. Water-hydrogen sulphide exchange tray columns, having all of the following characteristics:\n1B229.a\nCan operate at pressures of 2 MPa or greater;\na.1. Can operate at pressures of 2 MPa or greater;\nConstructed of carbon steel having an austenitic ASTM (or equivalent standard) grain size number of 5 or greater; and\na.2. Constructed of carbon steel having an austenitic ASTM (or equivalent standard) grain size number of 5 or greater; and\nWith a diameter of 1.8 m (6 ft.) or greater;\na.3. With a diameter of 1.8 m (6 ft.) or greater;\n“Internal contactors” for the water-hydrogen sulphide exchange tray columns controlled by 1B229.a.\nb. “Internal contactors” for the water-hydrogen sulphide exchange tray columns controlled by 1B229.a.",
      "structure": {
        "identifier": "1B229",
        "heading": "1B229 Water-hydrogen sulphide exchange tray columns and “internal contactors”, as follows (see List of Items Controlled).",
        "label": "1B229 – 1B229 Water-hydrogen sulphide exchange tray columns and “internal contactors”, as follows (see List of Items Controlled).",
        "content": [
          {
            "type": "text",
            "text": "License Requirements"
          },
          {
            "type": "text",
            "text": "Reason for Control:"
          },
          {
            "type": "text",
            "text": "NP, AT"
          },
          {
            "type": "html",
            "tag": "TABLE",
            "html": "<TABLE border=\"1\" cellpadding=\"1\" cellspacing=\"1\" class=\"gpotbl_table\" frame=\"void\" width=\"100%\"><TR><TH class=\"gpotbl_colhed\" scope=\"col\">Control(s)\n</TH><TH class=\"gpotbl_colhed\" scope=\"col\">Country Chart (See Supp. No. 1 to part 738)\n</TH></TR><TR><TD align=\"left\" class=\"gpotbl_cell\" scope=\"row\">NP applies to entire entry (1B229)</TD><TD align=\"left\" class=\"gpotbl_cell\">NP Column 1\n</TD></TR><TR><TD align=\"left\" class=\"gpotbl_cell\" scope=\"row\">AT applies to entire entry (1B229)</TD><TD align=\"left\" class=\"gpotbl_cell\">AT Column 1</TD></TR></TABLE>",
            "text": "Control(s) Country Chart (See Supp. No. 1 to part 738) NP applies to entire entryNP Column 1 AT applies to entire entryAT Column 1",
            "id": null
          },
          {
            "type": "text",
            "text": "Control(s)"
          },
          {
            "type": "text",
            "text": "Country Chart (See Supp. No. 1 to part 738)"
          },
          {
            "type": "text",
            "text": "NP applies to entire entry"
          },
          {
            "type": "text",
            "text": "NP Column 1"
          },
          {
            "type": "text",
            "text": "AT applies to entire entry"
          },
          {
            "type": "text",
            "text": "AT Column 1"
          },
          {
            "type": "text",
            "text": "List Based License Exceptions (See Part 740 for a description of all license exceptions)"
          },
          {
            "type": "text",
            "text": "LVS:"
          },
          {
            "type": "text",
            "text": "N/A"
          },
          {
            "type": "text",
            "text": "GBS:"
          },
          {
            "type": "text",
            "text": "N/A"
          },
          {
            "type": "text",
            "text": "CIV:"
          },
          {
            "type": "text",
            "text": "N/A"
          },
          {
            "type": "text",
            "text": "List of Items Controlled"
          },
          {
            "type": "text",
            "text": "Related Controls:"
          },
          {
            "type": "text",
            "text": "(1) Equipment “specially designed” or prepared for the production of heavy water is subject to the export licensing authority of the Nuclear Regulatory Commission (see 10 CFR part 110). (2) See ECCNs 1E001 (“development” and “production”) and 1E201 (“use”) for technology for items controlled by this entry."
          },
          {
            "type": "text",
            "text": "Related Definitions:"
          },
          {
            "type": "text",
            "text": "The “internal contactors” controlled by 1B229.b are segmented trays that have an effective assembled diameter of 1.8 m (6 ft.) or greater, are designed to facilitate countercurrent contacting, and are constructed of stainless steels with a carbon content of 0.03% or less. These may be sieve trays, valve trays, bubble cap trays, or turbogrid trays."
          },
          {
            "type": "text",
            "text": "Items:"
          },
          {
            "type": "text",
            "text": "a. Water-hydrogen sulphide exchange tray columns, having all of the following characteristics:"
          }
        ],
        "children": [
          {
            "identifier": "1B229.a",
            "heading": null,
            "label": "1B229.a",
            "children": [
              {
                "identifier": "1B229.a.1",
                "heading": "Can operate at pressures of 2 MPa or greater;",
                "label": "1B229.a.1 – Can operate at pressures of 2 MPa or greater;",
                "content": [
                  {
                    "type": "html",
                    "tag": "P",
                    "html": "<P>a.1. Can operate at pressures of 2 MPa or greater;</P>",
                    "text": "a.1. Can operate at pressures of 2 MPa or greater;",
                    "id": null
                  }
                ],
                "isEccn": true,
                "boundToParent": true,
                "requireAllChildren": false
              },
              {
                "identifier": "1B229.a.2",
                "heading": "Constructed of carbon steel having an austenitic ASTM (or equivalent standard) grain size number of 5 or greater; and",
                "label": "1B229.a.2 – Constructed of carbon steel having an austenitic ASTM (or equivalent standard) grain size number of 5 or greater; and",
                "content": [
                  {
                    "type": "html",
                    "tag": "P",
                    "html": "<P>a.2. Constructed of carbon steel having an austenitic ASTM (or equivalent standard) grain size number of 5 or greater; <I>and</I></P>",
                    "text": "a.2. Constructed of carbon steel having an austenitic ASTM (or equivalent standard) grain size number of 5 or greater; and",
                    "id": null
                  }
                ],
                "isEccn": true,
                "boundToParent": true,
                "requireAllChildren": false
              },
              {
                "identifier": "1B229.a.3",
                "heading": "With a diameter of 1.8 m (6 ft.) or greater;",
                "label": "1B229.a.3 – With a diameter of 1.8 m (6 ft.) or greater;",
                "content": [
                  {
                    "type": "html",
                    "tag": "P",
                    "html": "<P>a.3. With a diameter of 1.8 m (6 ft.) or greater;</P>",
                    "text": "a.3. With a diameter of 1.8 m (6 ft.) or greater;",
                    "id": null
                  }
                ],
                "isEccn": true,
                "boundToParent": true,
                "requireAllChildren": false
              }
            ],
            "isEccn": true,
            "boundToParent": true,
            "requireAllChildren": false
          },
          {
            "identifier": "1B229.b",
            "heading": "“Internal contactors” for the water-hydrogen sulphide exchange tray columns controlled by 1B229.a.",
            "label": "1B229.b – “Internal contactors” for the water-hydrogen sulphide exchange tray columns controlled by 1B229.a.",
            "content": [
              {
                "type": "html",
                "tag": "P",
                "html": "<P>b. “Internal contactors” for the water-hydrogen sulphide exchange tray columns controlled by 1B229.a.</P>",
                "text": "b. “Internal contactors” for the water-hydrogen sulphide exchange tray columns controlled by 1B229.a.",
                "id": null
              }
            ],
            "isEccn": true,
            "boundToParent": true,
            "requireAllChildren": false
          }
        ],
        "isEccn": true,
        "boundToParent": false,
        "requireAllChildren": true
      }
    },
    {
      "version": "2018-11-02",
      "fetchedAt": "2025-10-02T20:33:32.381Z",
      "sourceUrl": "https://www.ecfr.gov/api/versioner/v1/full/2018-11-02/title-15?format=xml",
      "heading": "1B229 Water-hydrogen sulphide exchange tray columns and “internal contactors”, as follows (see List of Items Controlled).",
      "title": "Water-hydrogen sulphide exchange tray columns and “internal contactors”, as follows (see List of Items Controlled).",
      "category": "1",
      "group": "1B",
      "supplement": {
        "number": "1",
        "heading": "Supplement No. 1 to Part 774 - The Commerce Control List"
      },
      "breadcrumbs": [
        "List of Items Controlled"
      ],
      "ancestors": [],
      "text": "1B229 Water-hydrogen sulphide exchange tray columns and “internal contactors”, as follows (see List of Items Controlled).\nLicense Requirements\nReason for Control:\nNP, AT\nControl(s) Country Chart (See Supp. No. 1 to part 738) NP applies to entire entryNP Column 1 AT applies to entire entryAT Column 1\nControl(s)\nCountry Chart (See Supp. No. 1 to part 738)\nNP applies to entire entry\nNP Column 1\nAT applies to entire entry\nAT Column 1\nList Based License Exceptions (See Part 740 for a description of all license exceptions)\nLVS:\nN/A\nGBS:\nN/A\nCIV:\nN/A\nList of Items Controlled\nRelated Controls:\n(1) Equipment “specially designed” or prepared for the production of heavy water is subject to the export licensing authority of the Nuclear Regulatory Commission (see 10 CFR part 110). (2) See ECCNs 1E001 (“development” and “production”) and 1E201 (“use”) for technology for items controlled by this entry.\nRelated Definitions:\nThe “internal contactors” controlled by 1B229.b are segmented trays that have an effective assembled diameter of 1.8 m (6 ft.) or greater, are designed to facilitate countercurrent contacting, and are constructed of stainless steels with a carbon content of 0.03% or less. These may be sieve trays, valve trays, bubble cap trays, or turbogrid trays.\nItems:\na. Water-hydrogen sulphide exchange tray columns, having all of the following characteristics:\n1B229.a\nCan operate at pressures of 2 MPa or greater;\na.1. Can operate at pressures of 2 MPa or greater;\nConstructed of carbon steel having an austenitic ASTM (or equivalent standard) grain size number of 5 or greater; and\na.2. Constructed of carbon steel having an austenitic ASTM (or equivalent standard) grain size number of 5 or greater; and\nWith a diameter of 1.8 m (6 ft.) or greater;\na.3. With a diameter of 1.8 m (6 ft.) or greater;\n“Internal contactors” for the water-hydrogen sulphide exchange tray columns controlled by 1B229.a.\nb. “Internal contactors” for the water-hydrogen sulphide exchange tray columns controlled by 1B229.a.",
      "structure": {
        "identifier": "1B229",
        "heading": "1B229 Water-hydrogen sulphide exchange tray columns and “internal contactors”, as follows (see List of Items Controlled).",
        "label": "1B229 – 1B229 Water-hydrogen sulphide exchange tray columns and “internal contactors”, as follows (see List of Items Controlled).",
        "content": [
          {
            "type": "text",
            "text": "License Requirements"
          },
          {
            "type": "text",
            "text": "Reason for Control:"
          },
          {
            "type": "text",
            "text": "NP, AT"
          },
          {
            "type": "html",
            "tag": "TABLE",
            "html": "<TABLE border=\"1\" cellpadding=\"1\" cellspacing=\"1\" class=\"gpotbl_table\" frame=\"void\" width=\"100%\"><TR><TH class=\"gpotbl_colhed\" scope=\"col\">Control(s)\n</TH><TH class=\"gpotbl_colhed\" scope=\"col\">Country Chart (See Supp. No. 1 to part 738)\n</TH></TR><TR><TD align=\"left\" class=\"gpotbl_cell\" scope=\"row\">NP applies to entire entry (1B229)</TD><TD align=\"left\" class=\"gpotbl_cell\">NP Column 1\n</TD></TR><TR><TD align=\"left\" class=\"gpotbl_cell\" scope=\"row\">AT applies to entire entry (1B229)</TD><TD align=\"left\" class=\"gpotbl_cell\">AT Column 1</TD></TR></TABLE>",
            "text": "Control(s) Country Chart (See Supp. No. 1 to part 738) NP applies to entire entryNP Column 1 AT applies to entire entryAT Column 1",
            "id": null
          },
          {
            "type": "text",
            "text": "Control(s)"
          },
          {
            "type": "text",
            "text": "Country Chart (See Supp. No. 1 to part 738)"
          },
          {
            "type": "text",
            "text": "NP applies to entire entry"
          },
          {
            "type": "text",
            "text": "NP Column 1"
          },
          {
            "type": "text",
            "text": "AT applies to entire entry"
          },
          {
            "type": "text",
            "text": "AT Column 1"
          },
          {
            "type": "text",
            "text": "List Based License Exceptions (See Part 740 for a description of all license exceptions)"
          },
          {
            "type": "text",
            "text": "LVS:"
          },
          {
            "type": "text",
            "text": "N/A"
          },
          {
            "type": "text",
            "text": "GBS:"
          },
          {
            "type": "text",
            "text": "N/A"
          },
          {
            "type": "text",
            "text": "CIV:"
          },
          {
            "type": "text",
            "text": "N/A"
          },
          {
            "type": "text",
            "text": "List of Items Controlled"
          },
          {
            "type": "text",
            "text": "Related Controls:"
          },
          {
            "type": "text",
            "text": "(1) Equipment “specially designed” or prepared for the production of heavy water is subject to the export licensing authority of the Nuclear Regulatory Commission (see 10 CFR part 110). (2) See ECCNs 1E001 (“development” and “production”) and 1E201 (“use”) for technology for items controlled by this entry."
          },
          {
            "type": "text",
            "text": "Related Definitions:"
          },
          {
            "type": "text",
            "text": "The “internal contactors” controlled by 1B229.b are segmented trays that have an effective assembled diameter of 1.8 m (6 ft.) or greater, are designed to facilitate countercurrent contacting, and are constructed of stainless steels with a carbon content of 0.03% or less. These may be sieve trays, valve trays, bubble cap trays, or turbogrid trays."
          },
          {
            "type": "text",
            "text": "Items:"
          },
          {
            "type": "text",
            "text": "a. Water-hydrogen sulphide exchange tray columns, having all of the following characteristics:"
          }
        ],
        "children": [
          {
            "identifier": "1B229.a",
            "heading": null,
            "label": "1B229.a",
            "children": [
              {
                "identifier": "1B229.a.1",
                "heading": "Can operate at pressures of 2 MPa or greater;",
                "label": "1B229.a.1 – Can operate at pressures of 2 MPa or greater;",
                "content": [
                  {
                    "type": "html",
                    "tag": "P",
                    "html": "<P>a.1. Can operate at pressures of 2 MPa or greater;</P>",
                    "text": "a.1. Can operate at pressures of 2 MPa or greater;",
                    "id": null
                  }
                ],
                "isEccn": true,
                "boundToParent": true,
                "requireAllChildren": false
              },
              {
                "identifier": "1B229.a.2",
                "heading": "Constructed of carbon steel having an austenitic ASTM (or equivalent standard) grain size number of 5 or greater; and",
                "label": "1B229.a.2 – Constructed of carbon steel having an austenitic ASTM (or equivalent standard) grain size number of 5 or greater; and",
                "content": [
                  {
                    "type": "html",
                    "tag": "P",
                    "html": "<P>a.2. Constructed of carbon steel having an austenitic ASTM (or equivalent standard) grain size number of 5 or greater; <I>and</I></P>",
                    "text": "a.2. Constructed of carbon steel having an austenitic ASTM (or equivalent standard) grain size number of 5 or greater; and",
                    "id": null
                  }
                ],
                "isEccn": true,
                "boundToParent": true,
                "requireAllChildren": false
              },
              {
                "identifier": "1B229.a.3",
                "heading": "With a diameter of 1.8 m (6 ft.) or greater;",
                "label": "1B229.a.3 – With a diameter of 1.8 m (6 ft.) or greater;",
                "content": [
                  {
                    "type": "html",
                    "tag": "P",
                    "html": "<P>a.3. With a diameter of 1.8 m (6 ft.) or greater;</P>",
                    "text": "a.3. With a diameter of 1.8 m (6 ft.) or greater;",
                    "id": null
                  }
                ],
                "isEccn": true,
                "boundToParent": true,
                "requireAllChildren": false
              }
            ],
            "isEccn": true,
            "boundToParent": true,
            "requireAllChildren": false
          },
          {
            "identifier": "1B229.b",
            "heading": "“Internal contactors” for the water-hydrogen sulphide exchange tray columns controlled by 1B229.a.",
            "label": "1B229.b – “Internal contactors” for the water-hydrogen sulphide exchange tray columns controlled by 1B229.a.",
            "content": [
              {
                "type": "html",
                "tag": "P",
                "html": "<P>b. “Internal contactors” for the water-hydrogen sulphide exchange tray columns controlled by 1B229.a.</P>",
                "text": "b. “Internal contactors” for the water-hydrogen sulphide exchange tray columns controlled by 1B229.a.",
                "id": null
              }
            ],
            "isEccn": true,
            "boundToParent": true,
            "requireAllChildren": false
          }
        ],
        "isEccn": true,
        "boundToParent": false,
        "requireAllChildren": true
      }
    },
    {
      "version": "2018-12-20",
      "fetchedAt": "2025-10-02T20:33:32.762Z",
      "sourceUrl": "https://www.ecfr.gov/api/versioner/v1/full/2018-12-20/title-15?format=xml",
      "heading": "1B229 Water-hydrogen sulphide exchange tray columns and “internal contactors”, as follows (see List of Items Controlled).",
      "title": "Water-hydrogen sulphide exchange tray columns and “internal contactors”, as follows (see List of Items Controlled).",
      "category": "1",
      "group": "1B",
      "supplement": {
        "number": "1",
        "heading": "Supplement No. 1 to Part 774 - The Commerce Control List"
      },
      "breadcrumbs": [
        "List of Items Controlled"
      ],
      "ancestors": [],
      "text": "1B229 Water-hydrogen sulphide exchange tray columns and “internal contactors”, as follows (see List of Items Controlled).\nLicense Requirements\nReason for Control:\nNP, AT\nControl(s) Country Chart (See Supp. No. 1 to part 738) NP applies to entire entryNP Column 1 AT applies to entire entryAT Column 1\nControl(s)\nCountry Chart (See Supp. No. 1 to part 738)\nNP applies to entire entry\nNP Column 1\nAT applies to entire entry\nAT Column 1\nList Based License Exceptions (See Part 740 for a description of all license exceptions)\nLVS:\nN/A\nGBS:\nN/A\nCIV:\nN/A\nList of Items Controlled\nRelated Controls:\n(1) Equipment “specially designed” or prepared for the production of heavy water is subject to the export licensing authority of the Nuclear Regulatory Commission (see 10 CFR part 110). (2) See ECCNs 1E001 (“development” and “production”) and 1E201 (“use”) for technology for items controlled by this entry.\nRelated Definitions:\nThe “internal contactors” controlled by 1B229.b are segmented trays that have an effective assembled diameter of 1.8 m (6 ft.) or greater, are designed to facilitate countercurrent contacting, and are constructed of stainless steels with a carbon content of 0.03% or less. These may be sieve trays, valve trays, bubble cap trays, or turbogrid trays.\nItems:\na. Water-hydrogen sulphide exchange tray columns, having all of the following characteristics:\n1B229.a\nCan operate at pressures of 2 MPa or greater;\na.1. Can operate at pressures of 2 MPa or greater;\nConstructed of carbon steel having an austenitic ASTM (or equivalent standard) grain size number of 5 or greater; and\na.2. Constructed of carbon steel having an austenitic ASTM (or equivalent standard) grain size number of 5 or greater; and\nWith a diameter of 1.8 m (6 ft.) or greater;\na.3. With a diameter of 1.8 m (6 ft.) or greater;\n“Internal contactors” for the water-hydrogen sulphide exchange tray columns controlled by 1B229.a.\nb. “Internal contactors” for the water-hydrogen sulphide exchange tray columns controlled by 1B229.a.",
      "structure": {
        "identifier": "1B229",
        "heading": "1B229 Water-hydrogen sulphide exchange tray columns and “internal contactors”, as follows (see List of Items Controlled).",
        "label": "1B229 – 1B229 Water-hydrogen sulphide exchange tray columns and “internal contactors”, as follows (see List of Items Controlled).",
        "content": [
          {
            "type": "text",
            "text": "License Requirements"
          },
          {
            "type": "text",
            "text": "Reason for Control:"
          },
          {
            "type": "text",
            "text": "NP, AT"
          },
          {
            "type": "html",
            "tag": "TABLE",
            "html": "<TABLE border=\"1\" cellpadding=\"1\" cellspacing=\"1\" class=\"gpotbl_table\" frame=\"void\" width=\"100%\"><TR><TH class=\"gpotbl_colhed\" scope=\"col\">Control(s)\n</TH><TH class=\"gpotbl_colhed\" scope=\"col\">Country Chart (See Supp. No. 1 to part 738)\n</TH></TR><TR><TD align=\"left\" class=\"gpotbl_cell\" scope=\"row\">NP applies to entire entry (1B229)</TD><TD align=\"left\" class=\"gpotbl_cell\">NP Column 1\n</TD></TR><TR><TD align=\"left\" class=\"gpotbl_cell\" scope=\"row\">AT applies to entire entry (1B229)</TD><TD align=\"left\" class=\"gpotbl_cell\">AT Column 1</TD></TR></TABLE>",
            "text": "Control(s) Country Chart (See Supp. No. 1 to part 738) NP applies to entire entryNP Column 1 AT applies to entire entryAT Column 1",
            "id": null
          },
          {
            "type": "text",
            "text": "Control(s)"
          },
          {
            "type": "text",
            "text": "Country Chart (See Supp. No. 1 to part 738)"
          },
          {
            "type": "text",
            "text": "NP applies to entire entry"
          },
          {
            "type": "text",
            "text": "NP Column 1"
          },
          {
            "type": "text",
            "text": "AT applies to entire entry"
          },
          {
            "type": "text",
            "text": "AT Column 1"
          },
          {
            "type": "text",
            "text": "List Based License Exceptions (See Part 740 for a description of all license exceptions)"
          },
          {
            "type": "text",
            "text": "LVS:"
          },
          {
            "type": "text",
            "text": "N/A"
          },
          {
            "type": "text",
            "text": "GBS:"
          },
          {
            "type": "text",
            "text": "N/A"
          },
          {
            "type": "text",
            "text": "CIV:"
          },
          {
            "type": "text",
            "text": "N/A"
          },
          {
            "type": "text",
            "text": "List of Items Controlled"
          },
          {
            "type": "text",
            "text": "Related Controls:"
          },
          {
            "type": "text",
            "text": "(1) Equipment “specially designed” or prepared for the production of heavy water is subject to the export licensing authority of the Nuclear Regulatory Commission (see 10 CFR part 110). (2) See ECCNs 1E001 (“development” and “production”) and 1E201 (“use”) for technology for items controlled by this entry."
          },
          {
            "type": "text",
            "text": "Related Definitions:"
          },
          {
            "type": "text",
            "text": "The “internal contactors” controlled by 1B229.b are segmented trays that have an effective assembled diameter of 1.8 m (6 ft.) or greater, are designed to facilitate countercurrent contacting, and are constructed of stainless steels with a carbon content of 0.03% or less. These may be sieve trays, valve trays, bubble cap trays, or turbogrid trays."
          },
          {
            "type": "text",
            "text": "Items:"
          },
          {
            "type": "text",
            "text": "a. Water-hydrogen sulphide exchange tray columns, having all of the following characteristics:"
          }
        ],
        "children": [
          {
            "identifier": "1B229.a",
            "heading": null,
            "label": "1B229.a",
            "children": [
              {
                "identifier": "1B229.a.1",
                "heading": "Can operate at pressures of 2 MPa or greater;",
                "label": "1B229.a.1 – Can operate at pressures of 2 MPa or greater;",
                "content": [
                  {
                    "type": "html",
                    "tag": "P",
                    "html": "<P>a.1. Can operate at pressures of 2 MPa or greater;</P>",
                    "text": "a.1. Can operate at pressures of 2 MPa or greater;",
                    "id": null
                  }
                ],
                "isEccn": true,
                "boundToParent": true,
                "requireAllChildren": false
              },
              {
                "identifier": "1B229.a.2",
                "heading": "Constructed of carbon steel having an austenitic ASTM (or equivalent standard) grain size number of 5 or greater; and",
                "label": "1B229.a.2 – Constructed of carbon steel having an austenitic ASTM (or equivalent standard) grain size number of 5 or greater; and",
                "content": [
                  {
                    "type": "html",
                    "tag": "P",
                    "html": "<P>a.2. Constructed of carbon steel having an austenitic ASTM (or equivalent standard) grain size number of 5 or greater; <I>and</I></P>",
                    "text": "a.2. Constructed of carbon steel having an austenitic ASTM (or equivalent standard) grain size number of 5 or greater; and",
                    "id": null
                  }
                ],
                "isEccn": true,
                "boundToParent": true,
                "requireAllChildren": false
              },
              {
                "identifier": "1B229.a.3",
                "heading": "With a diameter of 1.8 m (6 ft.) or greater;",
                "label": "1B229.a.3 – With a diameter of 1.8 m (6 ft.) or greater;",
                "content": [
                  {
                    "type": "html",
                    "tag": "P",
                    "html": "<P>a.3. With a diameter of 1.8 m (6 ft.) or greater;</P>",
                    "text": "a.3. With a diameter of 1.8 m (6 ft.) or greater;",
                    "id": null
                  }
                ],
                "isEccn": true,
                "boundToParent": true,
                "requireAllChildren": false
              }
            ],
            "isEccn": true,
            "boundToParent": true,
            "requireAllChildren": false
          },
          {
            "identifier": "1B229.b",
            "heading": "“Internal contactors” for the water-hydrogen sulphide exchange tray columns controlled by 1B229.a.",
            "label": "1B229.b – “Internal contactors” for the water-hydrogen sulphide exchange tray columns controlled by 1B229.a.",
            "content": [
              {
                "type": "html",
                "tag": "P",
                "html": "<P>b. “Internal contactors” for the water-hydrogen sulphide exchange tray columns controlled by 1B229.a.</P>",
                "text": "b. “Internal contactors” for the water-hydrogen sulphide exchange tray columns controlled by 1B229.a.",
                "id": null
              }
            ],
            "isEccn": true,
            "boundToParent": true,
            "requireAllChildren": false
          }
        ],
        "isEccn": true,
        "boundToParent": false,
        "requireAllChildren": true
      }
    },
    {
      "version": "2019-05-23",
      "fetchedAt": "2025-10-02T20:33:33.148Z",
      "sourceUrl": "https://www.ecfr.gov/api/versioner/v1/full/2019-05-23/title-15?format=xml",
      "heading": "1B229 Water-hydrogen sulphide exchange tray columns and “internal contactors”, as follows (see List of Items Controlled).",
      "title": "Water-hydrogen sulphide exchange tray columns and “internal contactors”, as follows (see List of Items Controlled).",
      "category": "1",
      "group": "1B",
      "supplement": {
        "number": "1",
        "heading": "Supplement No. 1 to Part 774 - The Commerce Control List"
      },
      "breadcrumbs": [
        "List of Items Controlled"
      ],
      "ancestors": [],
      "text": "1B229 Water-hydrogen sulphide exchange tray columns and “internal contactors”, as follows (see List of Items Controlled).\nLicense Requirements\nReason for Control:\nNP, AT\nControl(s) Country Chart (See Supp. No. 1 to part 738) NP applies to entire entryNP Column 1 AT applies to entire entryAT Column 1\nControl(s)\nCountry Chart (See Supp. No. 1 to part 738)\nNP applies to entire entry\nNP Column 1\nAT applies to entire entry\nAT Column 1\nList Based License Exceptions (See Part 740 for a description of all license exceptions)\nLVS:\nN/A\nGBS:\nN/A\nCIV:\nN/A\nList of Items Controlled\nRelated Controls:\n(1) Equipment “specially designed” or prepared for the production of heavy water is subject to the export licensing authority of the Nuclear Regulatory Commission (see 10 CFR part 110). (2) See ECCNs 1E001 (“development” and “production”) and 1E201 (“use”) for technology for items controlled by this entry.\nRelated Definitions:\nThe “internal contactors” controlled by 1B229.b are segmented trays that have an effective assembled diameter of 1.8 m (6 ft.) or greater, are designed to facilitate countercurrent contacting, and are constructed of stainless steels with a carbon content of 0.03% or less. These may be sieve trays, valve trays, bubble cap trays, or turbogrid trays.\nItems:\na. Water-hydrogen sulphide exchange tray columns, having all of the following characteristics:\n1B229.a\nCan operate at pressures of 2 MPa or greater;\na.1. Can operate at pressures of 2 MPa or greater;\nConstructed of carbon steel having an austenitic ASTM (or equivalent standard) grain size number of 5 or greater; and\na.2. Constructed of carbon steel having an austenitic ASTM (or equivalent standard) grain size number of 5 or greater; and\nWith a diameter of 1.8 m (6 ft.) or greater;\na.3. With a diameter of 1.8 m (6 ft.) or greater;\n“Internal contactors” for the water-hydrogen sulphide exchange tray columns controlled by 1B229.a.\nb. “Internal contactors” for the water-hydrogen sulphide exchange tray columns controlled by 1B229.a.",
      "structure": {
        "identifier": "1B229",
        "heading": "1B229 Water-hydrogen sulphide exchange tray columns and “internal contactors”, as follows (see List of Items Controlled).",
        "label": "1B229 – 1B229 Water-hydrogen sulphide exchange tray columns and “internal contactors”, as follows (see List of Items Controlled).",
        "content": [
          {
            "type": "text",
            "text": "License Requirements"
          },
          {
            "type": "text",
            "text": "Reason for Control:"
          },
          {
            "type": "text",
            "text": "NP, AT"
          },
          {
            "type": "html",
            "tag": "TABLE",
            "html": "<TABLE border=\"1\" cellpadding=\"1\" cellspacing=\"1\" class=\"gpotbl_table\" frame=\"void\" width=\"100%\"><TR><TH class=\"gpotbl_colhed\" scope=\"col\">Control(s)\n</TH><TH class=\"gpotbl_colhed\" scope=\"col\">Country Chart (See Supp. No. 1 to part 738)\n</TH></TR><TR><TD align=\"left\" class=\"gpotbl_cell\" scope=\"row\">NP applies to entire entry (1B229)</TD><TD align=\"left\" class=\"gpotbl_cell\">NP Column 1\n</TD></TR><TR><TD align=\"left\" class=\"gpotbl_cell\" scope=\"row\">AT applies to entire entry (1B229)</TD><TD align=\"left\" class=\"gpotbl_cell\">AT Column 1</TD></TR></TABLE>",
            "text": "Control(s) Country Chart (See Supp. No. 1 to part 738) NP applies to entire entryNP Column 1 AT applies to entire entryAT Column 1",
            "id": null
          },
          {
            "type": "text",
            "text": "Control(s)"
          },
          {
            "type": "text",
            "text": "Country Chart (See Supp. No. 1 to part 738)"
          },
          {
            "type": "text",
            "text": "NP applies to entire entry"
          },
          {
            "type": "text",
            "text": "NP Column 1"
          },
          {
            "type": "text",
            "text": "AT applies to entire entry"
          },
          {
            "type": "text",
            "text": "AT Column 1"
          },
          {
            "type": "text",
            "text": "List Based License Exceptions (See Part 740 for a description of all license exceptions)"
          },
          {
            "type": "text",
            "text": "LVS:"
          },
          {
            "type": "text",
            "text": "N/A"
          },
          {
            "type": "text",
            "text": "GBS:"
          },
          {
            "type": "text",
            "text": "N/A"
          },
          {
            "type": "text",
            "text": "CIV:"
          },
          {
            "type": "text",
            "text": "N/A"
          },
          {
            "type": "text",
            "text": "List of Items Controlled"
          },
          {
            "type": "text",
            "text": "Related Controls:"
          },
          {
            "type": "text",
            "text": "(1) Equipment “specially designed” or prepared for the production of heavy water is subject to the export licensing authority of the Nuclear Regulatory Commission (see 10 CFR part 110). (2) See ECCNs 1E001 (“development” and “production”) and 1E201 (“use”) for technology for items controlled by this entry."
          },
          {
            "type": "text",
            "text": "Related Definitions:"
          },
          {
            "type": "text",
            "text": "The “internal contactors” controlled by 1B229.b are segmented trays that have an effective assembled diameter of 1.8 m (6 ft.) or greater, are designed to facilitate countercurrent contacting, and are constructed of stainless steels with a carbon content of 0.03% or less. These may be sieve trays, valve trays, bubble cap trays, or turbogrid trays."
          },
          {
            "type": "text",
            "text": "Items:"
          },
          {
            "type": "text",
            "text": "a. Water-hydrogen sulphide exchange tray columns, having all of the following characteristics:"
          }
        ],
        "children": [
          {
            "identifier": "1B229.a",
            "heading": null,
            "label": "1B229.a",
            "children": [
              {
                "identifier": "1B229.a.1",
                "heading": "Can operate at pressures of 2 MPa or greater;",
                "label": "1B229.a.1 – Can operate at pressures of 2 MPa or greater;",
                "content": [
                  {
                    "type": "html",
                    "tag": "P",
                    "html": "<P>a.1. Can operate at pressures of 2 MPa or greater;</P>",
                    "text": "a.1. Can operate at pressures of 2 MPa or greater;",
                    "id": null
                  }
                ],
                "isEccn": true,
                "boundToParent": true,
                "requireAllChildren": false
              },
              {
                "identifier": "1B229.a.2",
                "heading": "Constructed of carbon steel having an austenitic ASTM (or equivalent standard) grain size number of 5 or greater; and",
                "label": "1B229.a.2 – Constructed of carbon steel having an austenitic ASTM (or equivalent standard) grain size number of 5 or greater; and",
                "content": [
                  {
                    "type": "html",
                    "tag": "P",
                    "html": "<P>a.2. Constructed of carbon steel having an austenitic ASTM (or equivalent standard) grain size number of 5 or greater; <I>and</I></P>",
                    "text": "a.2. Constructed of carbon steel having an austenitic ASTM (or equivalent standard) grain size number of 5 or greater; and",
                    "id": null
                  }
                ],
                "isEccn": true,
                "boundToParent": true,
                "requireAllChildren": false
              },
              {
                "identifier": "1B229.a.3",
                "heading": "With a diameter of 1.8 m (6 ft.) or greater;",
                "label": "1B229.a.3 – With a diameter of 1.8 m (6 ft.) or greater;",
                "content": [
                  {
                    "type": "html",
                    "tag": "P",
                    "html": "<P>a.3. With a diameter of 1.8 m (6 ft.) or greater;</P>",
                    "text": "a.3. With a diameter of 1.8 m (6 ft.) or greater;",
                    "id": null
                  }
                ],
                "isEccn": true,
                "boundToParent": true,
                "requireAllChildren": false
              }
            ],
            "isEccn": true,
            "boundToParent": true,
            "requireAllChildren": false
          },
          {
            "identifier": "1B229.b",
            "heading": "“Internal contactors” for the water-hydrogen sulphide exchange tray columns controlled by 1B229.a.",
            "label": "1B229.b – “Internal contactors” for the water-hydrogen sulphide exchange tray columns controlled by 1B229.a.",
            "content": [
              {
                "type": "html",
                "tag": "P",
                "html": "<P>b. “Internal contactors” for the water-hydrogen sulphide exchange tray columns controlled by 1B229.a.</P>",
                "text": "b. “Internal contactors” for the water-hydrogen sulphide exchange tray columns controlled by 1B229.a.",
                "id": null
              }
            ],
            "isEccn": true,
            "boundToParent": true,
            "requireAllChildren": false
          }
        ],
        "isEccn": true,
        "boundToParent": false,
        "requireAllChildren": true
      }
    },
    {
      "version": "2020-01-06",
      "fetchedAt": "2025-10-02T20:33:33.561Z",
      "sourceUrl": "https://www.ecfr.gov/api/versioner/v1/full/2020-01-06/title-15?format=xml",
      "heading": "1B229 Water-hydrogen sulphide exchange tray columns and “internal contactors”, as follows (see List of Items Controlled).",
      "title": "Water-hydrogen sulphide exchange tray columns and “internal contactors”, as follows (see List of Items Controlled).",
      "category": "1",
      "group": "1B",
      "supplement": {
        "number": "1",
        "heading": "Supplement No. 1 to Part 774 - The Commerce Control List"
      },
      "breadcrumbs": [
        "List of Items Controlled"
      ],
      "ancestors": [],
      "text": "1B229 Water-hydrogen sulphide exchange tray columns and “internal contactors”, as follows (see List of Items Controlled).\nLicense Requirements\nReason for Control:\nNP, AT\nControl(s) Country Chart (See Supp. No. 1 to part 738) NP applies to entire entryNP Column 1 AT applies to entire entryAT Column 1\nControl(s)\nCountry Chart (See Supp. No. 1 to part 738)\nNP applies to entire entry\nNP Column 1\nAT applies to entire entry\nAT Column 1\nList Based License Exceptions (See Part 740 for a description of all license exceptions)\nLVS:\nN/A\nGBS:\nN/A\nCIV:\nN/A\nList of Items Controlled\nRelated Controls:\n(1) Equipment “specially designed” or prepared for the production of heavy water is subject to the export licensing authority of the Nuclear Regulatory Commission (see 10 CFR part 110). (2) See ECCNs 1E001 (“development” and “production”) and 1E201 (“use”) for technology for items controlled by this entry.\nRelated Definitions:\nThe “internal contactors” controlled by 1B229.b are segmented trays that have an effective assembled diameter of 1.8 m (6 ft.) or greater, are designed to facilitate countercurrent contacting, and are constructed of stainless steels with a carbon content of 0.03% or less. These may be sieve trays, valve trays, bubble cap trays, or turbogrid trays.\nItems:\na. Water-hydrogen sulphide exchange tray columns, having all of the following characteristics:\n1B229.a\nCan operate at pressures of 2 MPa or greater;\na.1. Can operate at pressures of 2 MPa or greater;\nConstructed of carbon steel having an austenitic ASTM (or equivalent standard) grain size number of 5 or greater; and\na.2. Constructed of carbon steel having an austenitic ASTM (or equivalent standard) grain size number of 5 or greater; and\nWith a diameter of 1.8 m (6 ft.) or greater;\na.3. With a diameter of 1.8 m (6 ft.) or greater;\n“Internal contactors” for the water-hydrogen sulphide exchange tray columns controlled by 1B229.a.\nb. “Internal contactors” for the water-hydrogen sulphide exchange tray columns controlled by 1B229.a.",
      "structure": {
        "identifier": "1B229",
        "heading": "1B229 Water-hydrogen sulphide exchange tray columns and “internal contactors”, as follows (see List of Items Controlled).",
        "label": "1B229 – 1B229 Water-hydrogen sulphide exchange tray columns and “internal contactors”, as follows (see List of Items Controlled).",
        "content": [
          {
            "type": "text",
            "text": "License Requirements"
          },
          {
            "type": "text",
            "text": "Reason for Control:"
          },
          {
            "type": "text",
            "text": "NP, AT"
          },
          {
            "type": "html",
            "tag": "TABLE",
            "html": "<TABLE border=\"1\" cellpadding=\"1\" cellspacing=\"1\" class=\"gpotbl_table\" frame=\"void\" width=\"100%\"><TR><TH class=\"gpotbl_colhed\" scope=\"col\">Control(s)\n</TH><TH class=\"gpotbl_colhed\" scope=\"col\">Country Chart (See Supp. No. 1 to part 738)\n</TH></TR><TR><TD align=\"left\" class=\"gpotbl_cell\" scope=\"row\">NP applies to entire entry (1B229)</TD><TD align=\"left\" class=\"gpotbl_cell\">NP Column 1\n</TD></TR><TR><TD align=\"left\" class=\"gpotbl_cell\" scope=\"row\">AT applies to entire entry (1B229)</TD><TD align=\"left\" class=\"gpotbl_cell\">AT Column 1</TD></TR></TABLE>",
            "text": "Control(s) Country Chart (See Supp. No. 1 to part 738) NP applies to entire entryNP Column 1 AT applies to entire entryAT Column 1",
            "id": null
          },
          {
            "type": "text",
            "text": "Control(s)"
          },
          {
            "type": "text",
            "text": "Country Chart (See Supp. No. 1 to part 738)"
          },
          {
            "type": "text",
            "text": "NP applies to entire entry"
          },
          {
            "type": "text",
            "text": "NP Column 1"
          },
          {
            "type": "text",
            "text": "AT applies to entire entry"
          },
          {
            "type": "text",
            "text": "AT Column 1"
          },
          {
            "type": "text",
            "text": "List Based License Exceptions (See Part 740 for a description of all license exceptions)"
          },
          {
            "type": "text",
            "text": "LVS:"
          },
          {
            "type": "text",
            "text": "N/A"
          },
          {
            "type": "text",
            "text": "GBS:"
          },
          {
            "type": "text",
            "text": "N/A"
          },
          {
            "type": "text",
            "text": "CIV:"
          },
          {
            "type": "text",
            "text": "N/A"
          },
          {
            "type": "text",
            "text": "List of Items Controlled"
          },
          {
            "type": "text",
            "text": "Related Controls:"
          },
          {
            "type": "text",
            "text": "(1) Equipment “specially designed” or prepared for the production of heavy water is subject to the export licensing authority of the Nuclear Regulatory Commission (see 10 CFR part 110). (2) See ECCNs 1E001 (“development” and “production”) and 1E201 (“use”) for technology for items controlled by this entry."
          },
          {
            "type": "text",
            "text": "Related Definitions:"
          },
          {
            "type": "text",
            "text": "The “internal contactors” controlled by 1B229.b are segmented trays that have an effective assembled diameter of 1.8 m (6 ft.) or greater, are designed to facilitate countercurrent contacting, and are constructed of stainless steels with a carbon content of 0.03% or less. These may be sieve trays, valve trays, bubble cap trays, or turbogrid trays."
          },
          {
            "type": "text",
            "text": "Items:"
          },
          {
            "type": "text",
            "text": "a. Water-hydrogen sulphide exchange tray columns, having all of the following characteristics:"
          }
        ],
        "children": [
          {
            "identifier": "1B229.a",
            "heading": null,
            "label": "1B229.a",
            "children": [
              {
                "identifier": "1B229.a.1",
                "heading": "Can operate at pressures of 2 MPa or greater;",
                "label": "1B229.a.1 – Can operate at pressures of 2 MPa or greater;",
                "content": [
                  {
                    "type": "html",
                    "tag": "P",
                    "html": "<P>a.1. Can operate at pressures of 2 MPa or greater;</P>",
                    "text": "a.1. Can operate at pressures of 2 MPa or greater;",
                    "id": null
                  }
                ],
                "isEccn": true,
                "boundToParent": true,
                "requireAllChildren": false
              },
              {
                "identifier": "1B229.a.2",
                "heading": "Constructed of carbon steel having an austenitic ASTM (or equivalent standard) grain size number of 5 or greater; and",
                "label": "1B229.a.2 – Constructed of carbon steel having an austenitic ASTM (or equivalent standard) grain size number of 5 or greater; and",
                "content": [
                  {
                    "type": "html",
                    "tag": "P",
                    "html": "<P>a.2. Constructed of carbon steel having an austenitic ASTM (or equivalent standard) grain size number of 5 or greater; <I>and</I></P>",
                    "text": "a.2. Constructed of carbon steel having an austenitic ASTM (or equivalent standard) grain size number of 5 or greater; and",
                    "id": null
                  }
                ],
                "isEccn": true,
                "boundToParent": true,
                "requireAllChildren": false
              },
              {
                "identifier": "1B229.a.3",
                "heading": "With a diameter of 1.8 m (6 ft.) or greater;",
                "label": "1B229.a.3 – With a diameter of 1.8 m (6 ft.) or greater;",
                "content": [
                  {
                    "type": "html",
                    "tag": "P",
                    "html": "<P>a.3. With a diameter of 1.8 m (6 ft.) or greater;</P>",
                    "text": "a.3. With a diameter of 1.8 m (6 ft.) or greater;",
                    "id": null
                  }
                ],
                "isEccn": true,
                "boundToParent": true,
                "requireAllChildren": false
              }
            ],
            "isEccn": true,
            "boundToParent": true,
            "requireAllChildren": false
          },
          {
            "identifier": "1B229.b",
            "heading": "“Internal contactors” for the water-hydrogen sulphide exchange tray columns controlled by 1B229.a.",
            "label": "1B229.b – “Internal contactors” for the water-hydrogen sulphide exchange tray columns controlled by 1B229.a.",
            "content": [
              {
                "type": "html",
                "tag": "P",
                "html": "<P>b. “Internal contactors” for the water-hydrogen sulphide exchange tray columns controlled by 1B229.a.</P>",
                "text": "b. “Internal contactors” for the water-hydrogen sulphide exchange tray columns controlled by 1B229.a.",
                "id": null
              }
            ],
            "isEccn": true,
            "boundToParent": true,
            "requireAllChildren": false
          }
        ],
        "isEccn": true,
        "boundToParent": false,
        "requireAllChildren": true
      }
    },
    {
      "version": "2020-03-09",
      "fetchedAt": "2025-10-02T20:33:33.960Z",
      "sourceUrl": "https://www.ecfr.gov/api/versioner/v1/full/2020-03-09/title-15?format=xml",
      "heading": "1B229 Water-hydrogen sulphide exchange tray columns and “internal contactors”, as follows (see List of Items Controlled).",
      "title": "Water-hydrogen sulphide exchange tray columns and “internal contactors”, as follows (see List of Items Controlled).",
      "category": "1",
      "group": "1B",
      "supplement": {
        "number": "1",
        "heading": "Supplement No. 1 to Part 774 - The Commerce Control List"
      },
      "breadcrumbs": [
        "List of Items Controlled"
      ],
      "ancestors": [],
      "text": "1B229 Water-hydrogen sulphide exchange tray columns and “internal contactors”, as follows (see List of Items Controlled).\nLicense Requirements\nReason for Control:\nNP, AT\nControl(s) Country Chart (See Supp. No. 1 to part 738) NP applies to entire entryNP Column 1 AT applies to entire entryAT Column 1\nControl(s)\nCountry Chart (See Supp. No. 1 to part 738)\nNP applies to entire entry\nNP Column 1\nAT applies to entire entry\nAT Column 1\nList Based License Exceptions (See Part 740 for a description of all license exceptions)\nLVS:\nN/A\nGBS:\nN/A\nCIV:\nN/A\nList of Items Controlled\nRelated Controls:\n(1) Equipment “specially designed” or prepared for the production of heavy water is subject to the export licensing authority of the Nuclear Regulatory Commission (see 10 CFR part 110). (2) See ECCNs 1E001 (“development” and “production”) and 1E201 (“use”) for technology for items controlled by this entry.\nRelated Definitions:\nThe “internal contactors” controlled by 1B229.b are segmented trays that have an effective assembled diameter of 1.8 m (6 ft.) or greater, are designed to facilitate countercurrent contacting, and are constructed of stainless steels with a carbon content of 0.03% or less. These may be sieve trays, valve trays, bubble cap trays, or turbogrid trays.\nItems:\na. Water-hydrogen sulphide exchange tray columns, having all of the following characteristics:\n1B229.a\nCan operate at pressures of 2 MPa or greater;\na.1. Can operate at pressures of 2 MPa or greater;\nConstructed of carbon steel having an austenitic ASTM (or equivalent standard) grain size number of 5 or greater; and\na.2. Constructed of carbon steel having an austenitic ASTM (or equivalent standard) grain size number of 5 or greater; and\nWith a diameter of 1.8 m (6 ft.) or greater;\na.3. With a diameter of 1.8 m (6 ft.) or greater;\n“Internal contactors” for the water-hydrogen sulphide exchange tray columns controlled by 1B229.a.\nb. “Internal contactors” for the water-hydrogen sulphide exchange tray columns controlled by 1B229.a.",
      "structure": {
        "identifier": "1B229",
        "heading": "1B229 Water-hydrogen sulphide exchange tray columns and “internal contactors”, as follows (see List of Items Controlled).",
        "label": "1B229 – 1B229 Water-hydrogen sulphide exchange tray columns and “internal contactors”, as follows (see List of Items Controlled).",
        "content": [
          {
            "type": "text",
            "text": "License Requirements"
          },
          {
            "type": "text",
            "text": "Reason for Control:"
          },
          {
            "type": "text",
            "text": "NP, AT"
          },
          {
            "type": "html",
            "tag": "TABLE",
            "html": "<TABLE border=\"1\" cellpadding=\"1\" cellspacing=\"1\" class=\"gpotbl_table\" frame=\"void\" width=\"100%\"><TR><TH class=\"gpotbl_colhed\" scope=\"col\">Control(s)\n</TH><TH class=\"gpotbl_colhed\" scope=\"col\">Country Chart (See Supp. No. 1 to part 738)\n</TH></TR><TR><TD align=\"left\" class=\"gpotbl_cell\" scope=\"row\">NP applies to entire entry (1B229)</TD><TD align=\"left\" class=\"gpotbl_cell\">NP Column 1\n</TD></TR><TR><TD align=\"left\" class=\"gpotbl_cell\" scope=\"row\">AT applies to entire entry (1B229)</TD><TD align=\"left\" class=\"gpotbl_cell\">AT Column 1</TD></TR></TABLE>",
            "text": "Control(s) Country Chart (See Supp. No. 1 to part 738) NP applies to entire entryNP Column 1 AT applies to entire entryAT Column 1",
            "id": null
          },
          {
            "type": "text",
            "text": "Control(s)"
          },
          {
            "type": "text",
            "text": "Country Chart (See Supp. No. 1 to part 738)"
          },
          {
            "type": "text",
            "text": "NP applies to entire entry"
          },
          {
            "type": "text",
            "text": "NP Column 1"
          },
          {
            "type": "text",
            "text": "AT applies to entire entry"
          },
          {
            "type": "text",
            "text": "AT Column 1"
          },
          {
            "type": "text",
            "text": "List Based License Exceptions (See Part 740 for a description of all license exceptions)"
          },
          {
            "type": "text",
            "text": "LVS:"
          },
          {
            "type": "text",
            "text": "N/A"
          },
          {
            "type": "text",
            "text": "GBS:"
          },
          {
            "type": "text",
            "text": "N/A"
          },
          {
            "type": "text",
            "text": "CIV:"
          },
          {
            "type": "text",
            "text": "N/A"
          },
          {
            "type": "text",
            "text": "List of Items Controlled"
          },
          {
            "type": "text",
            "text": "Related Controls:"
          },
          {
            "type": "text",
            "text": "(1) Equipment “specially designed” or prepared for the production of heavy water is subject to the export licensing authority of the Nuclear Regulatory Commission (see 10 CFR part 110). (2) See ECCNs 1E001 (“development” and “production”) and 1E201 (“use”) for technology for items controlled by this entry."
          },
          {
            "type": "text",
            "text": "Related Definitions:"
          },
          {
            "type": "text",
            "text": "The “internal contactors” controlled by 1B229.b are segmented trays that have an effective assembled diameter of 1.8 m (6 ft.) or greater, are designed to facilitate countercurrent contacting, and are constructed of stainless steels with a carbon content of 0.03% or less. These may be sieve trays, valve trays, bubble cap trays, or turbogrid trays."
          },
          {
            "type": "text",
            "text": "Items:"
          },
          {
            "type": "text",
            "text": "a. Water-hydrogen sulphide exchange tray columns, having all of the following characteristics:"
          }
        ],
        "children": [
          {
            "identifier": "1B229.a",
            "heading": null,
            "label": "1B229.a",
            "children": [
              {
                "identifier": "1B229.a.1",
                "heading": "Can operate at pressures of 2 MPa or greater;",
                "label": "1B229.a.1 – Can operate at pressures of 2 MPa or greater;",
                "content": [
                  {
                    "type": "html",
                    "tag": "P",
                    "html": "<P>a.1. Can operate at pressures of 2 MPa or greater;</P>",
                    "text": "a.1. Can operate at pressures of 2 MPa or greater;",
                    "id": null
                  }
                ],
                "isEccn": true,
                "boundToParent": true,
                "requireAllChildren": false
              },
              {
                "identifier": "1B229.a.2",
                "heading": "Constructed of carbon steel having an austenitic ASTM (or equivalent standard) grain size number of 5 or greater; and",
                "label": "1B229.a.2 – Constructed of carbon steel having an austenitic ASTM (or equivalent standard) grain size number of 5 or greater; and",
                "content": [
                  {
                    "type": "html",
                    "tag": "P",
                    "html": "<P>a.2. Constructed of carbon steel having an austenitic ASTM (or equivalent standard) grain size number of 5 or greater; <I>and</I></P>",
                    "text": "a.2. Constructed of carbon steel having an austenitic ASTM (or equivalent standard) grain size number of 5 or greater; and",
                    "id": null
                  }
                ],
                "isEccn": true,
                "boundToParent": true,
                "requireAllChildren": false
              },
              {
                "identifier": "1B229.a.3",
                "heading": "With a diameter of 1.8 m (6 ft.) or greater;",
                "label": "1B229.a.3 – With a diameter of 1.8 m (6 ft.) or greater;",
                "content": [
                  {
                    "type": "html",
                    "tag": "P",
                    "html": "<P>a.3. With a diameter of 1.8 m (6 ft.) or greater;</P>",
                    "text": "a.3. With a diameter of 1.8 m (6 ft.) or greater;",
                    "id": null
                  }
                ],
                "isEccn": true,
                "boundToParent": true,
                "requireAllChildren": false
              }
            ],
            "isEccn": true,
            "boundToParent": true,
            "requireAllChildren": false
          },
          {
            "identifier": "1B229.b",
            "heading": "“Internal contactors” for the water-hydrogen sulphide exchange tray columns controlled by 1B229.a.",
            "label": "1B229.b – “Internal contactors” for the water-hydrogen sulphide exchange tray columns controlled by 1B229.a.",
            "content": [
              {
                "type": "html",
                "tag": "P",
                "html": "<P>b. “Internal contactors” for the water-hydrogen sulphide exchange tray columns controlled by 1B229.a.</P>",
                "text": "b. “Internal contactors” for the water-hydrogen sulphide exchange tray columns controlled by 1B229.a.",
                "id": null
              }
            ],
            "isEccn": true,
            "boundToParent": true,
            "requireAllChildren": false
          }
        ],
        "isEccn": true,
        "boundToParent": false,
        "requireAllChildren": true
      }
    },
    {
      "version": "2020-06-17",
      "fetchedAt": "2025-10-02T20:33:34.354Z",
      "sourceUrl": "https://www.ecfr.gov/api/versioner/v1/full/2020-06-17/title-15?format=xml",
      "heading": "1B229 Water-hydrogen sulfide exchange tray columns and “internal contactors”, as follows (see List of Items Controlled).",
      "title": "Water-hydrogen sulfide exchange tray columns and “internal contactors”, as follows (see List of Items Controlled).",
      "category": "1",
      "group": "1B",
      "supplement": {
        "number": "1",
        "heading": "Supplement No. 1 to Part 774 - The Commerce Control List"
      },
      "breadcrumbs": [
        "List of Items Controlled"
      ],
      "ancestors": [],
      "text": "1B229 Water-hydrogen sulfide exchange tray columns and “internal contactors”, as follows (see List of Items Controlled).\nLicense Requirements\nReason for Control:\nNP, AT\nControl(s) Country Chart (See Supp. No. 1 to part 738) NP applies to entire entryNP Column 1 AT applies to entire entryAT Column 1\nControl(s)\nCountry Chart (See Supp. No. 1 to part 738)\nNP applies to entire entry\nNP Column 1\nAT applies to entire entry\nAT Column 1\nList Based License Exceptions (See Part 740 for a description of all license exceptions)\nLVS:\nN/A\nGBS:\nN/A\nCIV:\nN/A\nList of Items Controlled\nRelated Controls:\n(1) Equipment “specially designed” or prepared for the production of heavy water is subject to the export licensing authority of the Nuclear Regulatory Commission (see 10 CFR part 110). (2) See ECCNs 1E001 (“development” and “production”) and 1E201 (“use”) for technology for items controlled by this entry.\nRelated Definitions:\nThe “internal contactors” controlled by 1B229.b are segmented trays that have an effective assembled diameter of 1.8 m (6 ft.) or greater, are designed to facilitate countercurrent contacting, and are constructed of stainless steels with a carbon content of 0.03% or less. These may be sieve trays, valve trays, bubble cap trays, or turbogrid trays.\nItems:\na. Water-hydrogen sulfide exchange tray columns, having all of the following characteristics:\n1B229.a\nCan operate at pressures of 2 MPa or greater;\na.1. Can operate at pressures of 2 MPa or greater;\nConstructed of carbon steel having an austenitic ASTM (or equivalent standard) grain size number of 5 or greater; and\na.2. Constructed of carbon steel having an austenitic ASTM (or equivalent standard) grain size number of 5 or greater; and\nWith a diameter of 1.8 m (6 ft.) or greater;\na.3. With a diameter of 1.8 m (6 ft.) or greater;\n“Internal contactors” for the water-hydrogen sulfide exchange tray columns controlled by 1B229.a.\nb. “Internal contactors” for the water-hydrogen sulfide exchange tray columns controlled by 1B229.a.",
      "structure": {
        "identifier": "1B229",
        "heading": "1B229 Water-hydrogen sulfide exchange tray columns and “internal contactors”, as follows (see List of Items Controlled).",
        "label": "1B229 – 1B229 Water-hydrogen sulfide exchange tray columns and “internal contactors”, as follows (see List of Items Controlled).",
        "content": [
          {
            "type": "text",
            "text": "License Requirements"
          },
          {
            "type": "text",
            "text": "Reason for Control:"
          },
          {
            "type": "text",
            "text": "NP, AT"
          },
          {
            "type": "html",
            "tag": "TABLE",
            "html": "<TABLE border=\"1\" cellpadding=\"1\" cellspacing=\"1\" class=\"gpotbl_table\" frame=\"void\" width=\"100%\"><TR><TH class=\"gpotbl_colhed\" scope=\"col\">Control(s)\n</TH><TH class=\"gpotbl_colhed\" scope=\"col\">Country Chart (See Supp. No. 1 to part 738)\n</TH></TR><TR><TD align=\"left\" class=\"gpotbl_cell\" scope=\"row\">NP applies to entire entry (1B229)</TD><TD align=\"left\" class=\"gpotbl_cell\">NP Column 1\n</TD></TR><TR><TD align=\"left\" class=\"gpotbl_cell\" scope=\"row\">AT applies to entire entry (1B229)</TD><TD align=\"left\" class=\"gpotbl_cell\">AT Column 1</TD></TR></TABLE>",
            "text": "Control(s) Country Chart (See Supp. No. 1 to part 738) NP applies to entire entryNP Column 1 AT applies to entire entryAT Column 1",
            "id": null
          },
          {
            "type": "text",
            "text": "Control(s)"
          },
          {
            "type": "text",
            "text": "Country Chart (See Supp. No. 1 to part 738)"
          },
          {
            "type": "text",
            "text": "NP applies to entire entry"
          },
          {
            "type": "text",
            "text": "NP Column 1"
          },
          {
            "type": "text",
            "text": "AT applies to entire entry"
          },
          {
            "type": "text",
            "text": "AT Column 1"
          },
          {
            "type": "text",
            "text": "List Based License Exceptions (See Part 740 for a description of all license exceptions)"
          },
          {
            "type": "text",
            "text": "LVS:"
          },
          {
            "type": "text",
            "text": "N/A"
          },
          {
            "type": "text",
            "text": "GBS:"
          },
          {
            "type": "text",
            "text": "N/A"
          },
          {
            "type": "text",
            "text": "CIV:"
          },
          {
            "type": "text",
            "text": "N/A"
          },
          {
            "type": "text",
            "text": "List of Items Controlled"
          },
          {
            "type": "text",
            "text": "Related Controls:"
          },
          {
            "type": "text",
            "text": "(1) Equipment “specially designed” or prepared for the production of heavy water is subject to the export licensing authority of the Nuclear Regulatory Commission (see 10 CFR part 110). (2) See ECCNs 1E001 (“development” and “production”) and 1E201 (“use”) for technology for items controlled by this entry."
          },
          {
            "type": "text",
            "text": "Related Definitions:"
          },
          {
            "type": "text",
            "text": "The “internal contactors” controlled by 1B229.b are segmented trays that have an effective assembled diameter of 1.8 m (6 ft.) or greater, are designed to facilitate countercurrent contacting, and are constructed of stainless steels with a carbon content of 0.03% or less. These may be sieve trays, valve trays, bubble cap trays, or turbogrid trays."
          },
          {
            "type": "text",
            "text": "Items:"
          },
          {
            "type": "text",
            "text": "a. Water-hydrogen sulfide exchange tray columns, having all of the following characteristics:"
          }
        ],
        "children": [
          {
            "identifier": "1B229.a",
            "heading": null,
            "label": "1B229.a",
            "children": [
              {
                "identifier": "1B229.a.1",
                "heading": "Can operate at pressures of 2 MPa or greater;",
                "label": "1B229.a.1 – Can operate at pressures of 2 MPa or greater;",
                "content": [
                  {
                    "type": "html",
                    "tag": "P",
                    "html": "<P>a.1. Can operate at pressures of 2 MPa or greater;</P>",
                    "text": "a.1. Can operate at pressures of 2 MPa or greater;",
                    "id": null
                  }
                ],
                "isEccn": true,
                "boundToParent": true,
                "requireAllChildren": false
              },
              {
                "identifier": "1B229.a.2",
                "heading": "Constructed of carbon steel having an austenitic ASTM (or equivalent standard) grain size number of 5 or greater; and",
                "label": "1B229.a.2 – Constructed of carbon steel having an austenitic ASTM (or equivalent standard) grain size number of 5 or greater; and",
                "content": [
                  {
                    "type": "html",
                    "tag": "P",
                    "html": "<P>a.2. Constructed of carbon steel having an austenitic ASTM (or equivalent standard) grain size number of 5 or greater; <I>and</I></P>",
                    "text": "a.2. Constructed of carbon steel having an austenitic ASTM (or equivalent standard) grain size number of 5 or greater; and",
                    "id": null
                  }
                ],
                "isEccn": true,
                "boundToParent": true,
                "requireAllChildren": false
              },
              {
                "identifier": "1B229.a.3",
                "heading": "With a diameter of 1.8 m (6 ft.) or greater;",
                "label": "1B229.a.3 – With a diameter of 1.8 m (6 ft.) or greater;",
                "content": [
                  {
                    "type": "html",
                    "tag": "P",
                    "html": "<P>a.3. With a diameter of 1.8 m (6 ft.) or greater;</P>",
                    "text": "a.3. With a diameter of 1.8 m (6 ft.) or greater;",
                    "id": null
                  }
                ],
                "isEccn": true,
                "boundToParent": true,
                "requireAllChildren": false
              }
            ],
            "isEccn": true,
            "boundToParent": true,
            "requireAllChildren": false
          },
          {
            "identifier": "1B229.b",
            "heading": "“Internal contactors” for the water-hydrogen sulfide exchange tray columns controlled by 1B229.a.",
            "label": "1B229.b – “Internal contactors” for the water-hydrogen sulfide exchange tray columns controlled by 1B229.a.",
            "content": [
              {
                "type": "html",
                "tag": "P",
                "html": "<P>b. “Internal contactors” for the water-hydrogen sulfide exchange tray columns controlled by 1B229.a.</P>",
                "text": "b. “Internal contactors” for the water-hydrogen sulfide exchange tray columns controlled by 1B229.a.",
                "id": null
              }
            ],
            "isEccn": true,
            "boundToParent": true,
            "requireAllChildren": false
          }
        ],
        "isEccn": true,
        "boundToParent": false,
        "requireAllChildren": true
      }
    },
    {
      "version": "2020-06-29",
      "fetchedAt": "2025-10-02T20:33:34.750Z",
      "sourceUrl": "https://www.ecfr.gov/api/versioner/v1/full/2020-06-29/title-15?format=xml",
      "heading": "1B229 Water-hydrogen sulfide exchange tray columns and “internal contactors”, as follows (see List of Items Controlled).",
      "title": "Water-hydrogen sulfide exchange tray columns and “internal contactors”, as follows (see List of Items Controlled).",
      "category": "1",
      "group": "1B",
      "supplement": {
        "number": "1",
        "heading": "Supplement No. 1 to Part 774 - The Commerce Control List"
      },
      "breadcrumbs": [
        "List of Items Controlled"
      ],
      "ancestors": [],
      "text": "1B229 Water-hydrogen sulfide exchange tray columns and “internal contactors”, as follows (see List of Items Controlled).\nLicense Requirements\nReason for Control:\nNP, AT\nControl(s) Country Chart (See Supp. No. 1 to part 738) NP applies to entire entryNP Column 1 AT applies to entire entryAT Column 1\nControl(s)\nCountry Chart (See Supp. No. 1 to part 738)\nNP applies to entire entry\nNP Column 1\nAT applies to entire entry\nAT Column 1\nList Based License Exceptions (See Part 740 for a description of all license exceptions)\nLVS:\nN/A\nGBS:\nN/A\nList of Items Controlled\nRelated Controls:\n(1) Equipment “specially designed” or prepared for the production of heavy water is subject to the export licensing authority of the Nuclear Regulatory Commission (see 10 CFR part 110). (2) See ECCNs 1E001 (“development” and “production”) and 1E201 (“use”) for technology for items controlled by this entry.\nRelated Definitions:\nThe “internal contactors” controlled by 1B229.b are segmented trays that have an effective assembled diameter of 1.8 m (6 ft.) or greater, are designed to facilitate countercurrent contacting, and are constructed of stainless steels with a carbon content of 0.03% or less. These may be sieve trays, valve trays, bubble cap trays, or turbogrid trays.\nItems:\na. Water-hydrogen sulfide exchange tray columns, having all of the following characteristics:\n1B229.a\nCan operate at pressures of 2 MPa or greater;\na.1. Can operate at pressures of 2 MPa or greater;\nConstructed of carbon steel having an austenitic ASTM (or equivalent standard) grain size number of 5 or greater; and\na.2. Constructed of carbon steel having an austenitic ASTM (or equivalent standard) grain size number of 5 or greater; and\nWith a diameter of 1.8 m (6 ft.) or greater;\na.3. With a diameter of 1.8 m (6 ft.) or greater;\n“Internal contactors” for the water-hydrogen sulfide exchange tray columns controlled by 1B229.a.\nb. “Internal contactors” for the water-hydrogen sulfide exchange tray columns controlled by 1B229.a.",
      "structure": {
        "identifier": "1B229",
        "heading": "1B229 Water-hydrogen sulfide exchange tray columns and “internal contactors”, as follows (see List of Items Controlled).",
        "label": "1B229 – 1B229 Water-hydrogen sulfide exchange tray columns and “internal contactors”, as follows (see List of Items Controlled).",
        "content": [
          {
            "type": "text",
            "text": "License Requirements"
          },
          {
            "type": "text",
            "text": "Reason for Control:"
          },
          {
            "type": "text",
            "text": "NP, AT"
          },
          {
            "type": "html",
            "tag": "TABLE",
            "html": "<TABLE border=\"1\" cellpadding=\"1\" cellspacing=\"1\" class=\"gpotbl_table\" frame=\"void\" width=\"100%\"><TR><TH class=\"gpotbl_colhed\" scope=\"col\">Control(s)\n</TH><TH class=\"gpotbl_colhed\" scope=\"col\">Country Chart (See Supp. No. 1 to part 738)\n</TH></TR><TR><TD align=\"left\" class=\"gpotbl_cell\" scope=\"row\">NP applies to entire entry (1B229)</TD><TD align=\"left\" class=\"gpotbl_cell\">NP Column 1\n</TD></TR><TR><TD align=\"left\" class=\"gpotbl_cell\" scope=\"row\">AT applies to entire entry (1B229)</TD><TD align=\"left\" class=\"gpotbl_cell\">AT Column 1</TD></TR></TABLE>",
            "text": "Control(s) Country Chart (See Supp. No. 1 to part 738) NP applies to entire entryNP Column 1 AT applies to entire entryAT Column 1",
            "id": null
          },
          {
            "type": "text",
            "text": "Control(s)"
          },
          {
            "type": "text",
            "text": "Country Chart (See Supp. No. 1 to part 738)"
          },
          {
            "type": "text",
            "text": "NP applies to entire entry"
          },
          {
            "type": "text",
            "text": "NP Column 1"
          },
          {
            "type": "text",
            "text": "AT applies to entire entry"
          },
          {
            "type": "text",
            "text": "AT Column 1"
          },
          {
            "type": "text",
            "text": "List Based License Exceptions (See Part 740 for a description of all license exceptions)"
          },
          {
            "type": "text",
            "text": "LVS:"
          },
          {
            "type": "text",
            "text": "N/A"
          },
          {
            "type": "text",
            "text": "GBS:"
          },
          {
            "type": "text",
            "text": "N/A"
          },
          {
            "type": "text",
            "text": "List of Items Controlled"
          },
          {
            "type": "text",
            "text": "Related Controls:"
          },
          {
            "type": "text",
            "text": "(1) Equipment “specially designed” or prepared for the production of heavy water is subject to the export licensing authority of the Nuclear Regulatory Commission (see 10 CFR part 110). (2) See ECCNs 1E001 (“development” and “production”) and 1E201 (“use”) for technology for items controlled by this entry."
          },
          {
            "type": "text",
            "text": "Related Definitions:"
          },
          {
            "type": "text",
            "text": "The “internal contactors” controlled by 1B229.b are segmented trays that have an effective assembled diameter of 1.8 m (6 ft.) or greater, are designed to facilitate countercurrent contacting, and are constructed of stainless steels with a carbon content of 0.03% or less. These may be sieve trays, valve trays, bubble cap trays, or turbogrid trays."
          },
          {
            "type": "text",
            "text": "Items:"
          },
          {
            "type": "text",
            "text": "a. Water-hydrogen sulfide exchange tray columns, having all of the following characteristics:"
          }
        ],
        "children": [
          {
            "identifier": "1B229.a",
            "heading": null,
            "label": "1B229.a",
            "children": [
              {
                "identifier": "1B229.a.1",
                "heading": "Can operate at pressures of 2 MPa or greater;",
                "label": "1B229.a.1 – Can operate at pressures of 2 MPa or greater;",
                "content": [
                  {
                    "type": "html",
                    "tag": "P",
                    "html": "<P>a.1. Can operate at pressures of 2 MPa or greater;</P>",
                    "text": "a.1. Can operate at pressures of 2 MPa or greater;",
                    "id": null
                  }
                ],
                "isEccn": true,
                "boundToParent": true,
                "requireAllChildren": false
              },
              {
                "identifier": "1B229.a.2",
                "heading": "Constructed of carbon steel having an austenitic ASTM (or equivalent standard) grain size number of 5 or greater; and",
                "label": "1B229.a.2 – Constructed of carbon steel having an austenitic ASTM (or equivalent standard) grain size number of 5 or greater; and",
                "content": [
                  {
                    "type": "html",
                    "tag": "P",
                    "html": "<P>a.2. Constructed of carbon steel having an austenitic ASTM (or equivalent standard) grain size number of 5 or greater; <I>and</I></P>",
                    "text": "a.2. Constructed of carbon steel having an austenitic ASTM (or equivalent standard) grain size number of 5 or greater; and",
                    "id": null
                  }
                ],
                "isEccn": true,
                "boundToParent": true,
                "requireAllChildren": false
              },
              {
                "identifier": "1B229.a.3",
                "heading": "With a diameter of 1.8 m (6 ft.) or greater;",
                "label": "1B229.a.3 – With a diameter of 1.8 m (6 ft.) or greater;",
                "content": [
                  {
                    "type": "html",
                    "tag": "P",
                    "html": "<P>a.3. With a diameter of 1.8 m (6 ft.) or greater;</P>",
                    "text": "a.3. With a diameter of 1.8 m (6 ft.) or greater;",
                    "id": null
                  }
                ],
                "isEccn": true,
                "boundToParent": true,
                "requireAllChildren": false
              }
            ],
            "isEccn": true,
            "boundToParent": true,
            "requireAllChildren": false
          },
          {
            "identifier": "1B229.b",
            "heading": "“Internal contactors” for the water-hydrogen sulfide exchange tray columns controlled by 1B229.a.",
            "label": "1B229.b – “Internal contactors” for the water-hydrogen sulfide exchange tray columns controlled by 1B229.a.",
            "content": [
              {
                "type": "html",
                "tag": "P",
                "html": "<P>b. “Internal contactors” for the water-hydrogen sulfide exchange tray columns controlled by 1B229.a.</P>",
                "text": "b. “Internal contactors” for the water-hydrogen sulfide exchange tray columns controlled by 1B229.a.",
                "id": null
              }
            ],
            "isEccn": true,
            "boundToParent": true,
            "requireAllChildren": false
          }
        ],
        "isEccn": true,
        "boundToParent": false,
        "requireAllChildren": true
      }
    },
    {
      "version": "2020-09-11",
      "fetchedAt": "2025-10-02T20:33:35.161Z",
      "sourceUrl": "https://www.ecfr.gov/api/versioner/v1/full/2020-09-11/title-15?format=xml",
      "heading": "1B229 Water-hydrogen sulfide exchange tray columns and “internal contactors”, as follows (see List of Items Controlled).",
      "title": "Water-hydrogen sulfide exchange tray columns and “internal contactors”, as follows (see List of Items Controlled).",
      "category": "1",
      "group": "1B",
      "supplement": {
        "number": "1",
        "heading": "Supplement No. 1 to Part 774 - The Commerce Control List"
      },
      "breadcrumbs": [
        "List of Items Controlled"
      ],
      "ancestors": [],
      "text": "1B229 Water-hydrogen sulfide exchange tray columns and “internal contactors”, as follows (see List of Items Controlled).\nLicense Requirements\nReason for Control:\nNP, AT\nControl(s) Country Chart (See Supp. No. 1 to part 738) NP applies to entire entryNP Column 1 AT applies to entire entryAT Column 1\nControl(s)\nCountry Chart (See Supp. No. 1 to part 738)\nNP applies to entire entry\nNP Column 1\nAT applies to entire entry\nAT Column 1\nList Based License Exceptions (See Part 740 for a description of all license exceptions)\nLVS:\nN/A\nGBS:\nN/A\nList of Items Controlled\nRelated Controls:\n(1) Equipment “specially designed” or prepared for the production of heavy water is subject to the export licensing authority of the Nuclear Regulatory Commission (see 10 CFR part 110). (2) See ECCNs 1E001 (“development” and “production”) and 1E201 (“use”) for technology for items controlled by this entry.\nRelated Definitions:\nThe “internal contactors” controlled by 1B229.b are segmented trays that have an effective assembled diameter of 1.8 m (6 ft.) or greater, are designed to facilitate countercurrent contacting, and are constructed of stainless steels with a carbon content of 0.03% or less. These may be sieve trays, valve trays, bubble cap trays, or turbogrid trays.\nItems:\na. Water-hydrogen sulfide exchange tray columns, having all of the following characteristics:\n1B229.a\nCan operate at pressures of 2 MPa or greater;\na.1. Can operate at pressures of 2 MPa or greater;\nConstructed of carbon steel having an austenitic ASTM (or equivalent standard) grain size number of 5 or greater; and\na.2. Constructed of carbon steel having an austenitic ASTM (or equivalent standard) grain size number of 5 or greater; and\nWith a diameter of 1.8 m (6 ft.) or greater;\na.3. With a diameter of 1.8 m (6 ft.) or greater;\n“Internal contactors” for the water-hydrogen sulfide exchange tray columns controlled by 1B229.a.\nb. “Internal contactors” for the water-hydrogen sulfide exchange tray columns controlled by 1B229.a.",
      "structure": {
        "identifier": "1B229",
        "heading": "1B229 Water-hydrogen sulfide exchange tray columns and “internal contactors”, as follows (see List of Items Controlled).",
        "label": "1B229 – 1B229 Water-hydrogen sulfide exchange tray columns and “internal contactors”, as follows (see List of Items Controlled).",
        "content": [
          {
            "type": "text",
            "text": "License Requirements"
          },
          {
            "type": "text",
            "text": "Reason for Control:"
          },
          {
            "type": "text",
            "text": "NP, AT"
          },
          {
            "type": "html",
            "tag": "TABLE",
            "html": "<TABLE border=\"1\" cellpadding=\"1\" cellspacing=\"1\" class=\"gpotbl_table\" frame=\"void\" width=\"100%\"><TR><TH class=\"gpotbl_colhed\" scope=\"col\">Control(s)\n</TH><TH class=\"gpotbl_colhed\" scope=\"col\">Country Chart (See Supp. No. 1 to part 738)\n</TH></TR><TR><TD align=\"left\" class=\"gpotbl_cell\" scope=\"row\">NP applies to entire entry (1B229)</TD><TD align=\"left\" class=\"gpotbl_cell\">NP Column 1\n</TD></TR><TR><TD align=\"left\" class=\"gpotbl_cell\" scope=\"row\">AT applies to entire entry (1B229)</TD><TD align=\"left\" class=\"gpotbl_cell\">AT Column 1</TD></TR></TABLE>",
            "text": "Control(s) Country Chart (See Supp. No. 1 to part 738) NP applies to entire entryNP Column 1 AT applies to entire entryAT Column 1",
            "id": null
          },
          {
            "type": "text",
            "text": "Control(s)"
          },
          {
            "type": "text",
            "text": "Country Chart (See Supp. No. 1 to part 738)"
          },
          {
            "type": "text",
            "text": "NP applies to entire entry"
          },
          {
            "type": "text",
            "text": "NP Column 1"
          },
          {
            "type": "text",
            "text": "AT applies to entire entry"
          },
          {
            "type": "text",
            "text": "AT Column 1"
          },
          {
            "type": "text",
            "text": "List Based License Exceptions (See Part 740 for a description of all license exceptions)"
          },
          {
            "type": "text",
            "text": "LVS:"
          },
          {
            "type": "text",
            "text": "N/A"
          },
          {
            "type": "text",
            "text": "GBS:"
          },
          {
            "type": "text",
            "text": "N/A"
          },
          {
            "type": "text",
            "text": "List of Items Controlled"
          },
          {
            "type": "text",
            "text": "Related Controls:"
          },
          {
            "type": "text",
            "text": "(1) Equipment “specially designed” or prepared for the production of heavy water is subject to the export licensing authority of the Nuclear Regulatory Commission (see 10 CFR part 110). (2) See ECCNs 1E001 (“development” and “production”) and 1E201 (“use”) for technology for items controlled by this entry."
          },
          {
            "type": "text",
            "text": "Related Definitions:"
          },
          {
            "type": "text",
            "text": "The “internal contactors” controlled by 1B229.b are segmented trays that have an effective assembled diameter of 1.8 m (6 ft.) or greater, are designed to facilitate countercurrent contacting, and are constructed of stainless steels with a carbon content of 0.03% or less. These may be sieve trays, valve trays, bubble cap trays, or turbogrid trays."
          },
          {
            "type": "text",
            "text": "Items:"
          },
          {
            "type": "text",
            "text": "a. Water-hydrogen sulfide exchange tray columns, having all of the following characteristics:"
          }
        ],
        "children": [
          {
            "identifier": "1B229.a",
            "heading": null,
            "label": "1B229.a",
            "children": [
              {
                "identifier": "1B229.a.1",
                "heading": "Can operate at pressures of 2 MPa or greater;",
                "label": "1B229.a.1 – Can operate at pressures of 2 MPa or greater;",
                "content": [
                  {
                    "type": "html",
                    "tag": "P",
                    "html": "<P>a.1. Can operate at pressures of 2 MPa or greater;</P>",
                    "text": "a.1. Can operate at pressures of 2 MPa or greater;",
                    "id": null
                  }
                ],
                "isEccn": true,
                "boundToParent": true,
                "requireAllChildren": false
              },
              {
                "identifier": "1B229.a.2",
                "heading": "Constructed of carbon steel having an austenitic ASTM (or equivalent standard) grain size number of 5 or greater; and",
                "label": "1B229.a.2 – Constructed of carbon steel having an austenitic ASTM (or equivalent standard) grain size number of 5 or greater; and",
                "content": [
                  {
                    "type": "html",
                    "tag": "P",
                    "html": "<P>a.2. Constructed of carbon steel having an austenitic ASTM (or equivalent standard) grain size number of 5 or greater; <I>and</I></P>",
                    "text": "a.2. Constructed of carbon steel having an austenitic ASTM (or equivalent standard) grain size number of 5 or greater; and",
                    "id": null
                  }
                ],
                "isEccn": true,
                "boundToParent": true,
                "requireAllChildren": false
              },
              {
                "identifier": "1B229.a.3",
                "heading": "With a diameter of 1.8 m (6 ft.) or greater;",
                "label": "1B229.a.3 – With a diameter of 1.8 m (6 ft.) or greater;",
                "content": [
                  {
                    "type": "html",
                    "tag": "P",
                    "html": "<P>a.3. With a diameter of 1.8 m (6 ft.) or greater;</P>",
                    "text": "a.3. With a diameter of 1.8 m (6 ft.) or greater;",
                    "id": null
                  }
                ],
                "isEccn": true,
                "boundToParent": true,
                "requireAllChildren": false
              }
            ],
            "isEccn": true,
            "boundToParent": true,
            "requireAllChildren": false
          },
          {
            "identifier": "1B229.b",
            "heading": "“Internal contactors” for the water-hydrogen sulfide exchange tray columns controlled by 1B229.a.",
            "label": "1B229.b – “Internal contactors” for the water-hydrogen sulfide exchange tray columns controlled by 1B229.a.",
            "content": [
              {
                "type": "html",
                "tag": "P",
                "html": "<P>b. “Internal contactors” for the water-hydrogen sulfide exchange tray columns controlled by 1B229.a.</P>",
                "text": "b. “Internal contactors” for the water-hydrogen sulfide exchange tray columns controlled by 1B229.a.",
                "id": null
              }
            ],
            "isEccn": true,
            "boundToParent": true,
            "requireAllChildren": false
          }
        ],
        "isEccn": true,
        "boundToParent": false,
        "requireAllChildren": true
      }
    },
    {
      "version": "2020-10-05",
      "fetchedAt": "2025-10-02T20:33:35.641Z",
      "sourceUrl": "https://www.ecfr.gov/api/versioner/v1/full/2020-10-05/title-15?format=xml",
      "heading": "1B229 Water-hydrogen sulfide exchange tray columns and “internal contactors”, as follows (see List of Items Controlled).",
      "title": "Water-hydrogen sulfide exchange tray columns and “internal contactors”, as follows (see List of Items Controlled).",
      "category": "1",
      "group": "1B",
      "supplement": {
        "number": "1",
        "heading": "Supplement No. 1 to Part 774 - The Commerce Control List"
      },
      "breadcrumbs": [
        "List of Items Controlled"
      ],
      "ancestors": [],
      "text": "1B229 Water-hydrogen sulfide exchange tray columns and “internal contactors”, as follows (see List of Items Controlled).\nLicense Requirements\nReason for Control:\nNP, AT\nControl(s) Country Chart (See Supp. No. 1 to part 738) NP applies to entire entryNP Column 1 AT applies to entire entryAT Column 1\nControl(s)\nCountry Chart (See Supp. No. 1 to part 738)\nNP applies to entire entry\nNP Column 1\nAT applies to entire entry\nAT Column 1\nList Based License Exceptions (See Part 740 for a description of all license exceptions)\nLVS:\nN/A\nGBS:\nN/A\nList of Items Controlled\nRelated Controls:\n(1) Equipment “specially designed” or prepared for the production of heavy water is subject to the export licensing authority of the Nuclear Regulatory Commission (see 10 CFR part 110). (2) See ECCNs 1E001 (“development” and “production”) and 1E201 (“use”) for technology for items controlled by this entry.\nRelated Definitions:\nThe “internal contactors” controlled by 1B229.b are segmented trays that have an effective assembled diameter of 1.8 m (6 ft.) or greater, are designed to facilitate countercurrent contacting, and are constructed of stainless steels with a carbon content of 0.03% or less. These may be sieve trays, valve trays, bubble cap trays, or turbogrid trays.\nItems:\na. Water-hydrogen sulfide exchange tray columns, having all of the following characteristics:\n1B229.a\nCan operate at pressures of 2 MPa or greater;\na.1. Can operate at pressures of 2 MPa or greater;\nConstructed of carbon steel having an austenitic ASTM (or equivalent standard) grain size number of 5 or greater; and\na.2. Constructed of carbon steel having an austenitic ASTM (or equivalent standard) grain size number of 5 or greater; and\nWith a diameter of 1.8 m (6 ft.) or greater;\na.3. With a diameter of 1.8 m (6 ft.) or greater;\n“Internal contactors” for the water-hydrogen sulfide exchange tray columns controlled by 1B229.a.\nb. “Internal contactors” for the water-hydrogen sulfide exchange tray columns controlled by 1B229.a.",
      "structure": {
        "identifier": "1B229",
        "heading": "1B229 Water-hydrogen sulfide exchange tray columns and “internal contactors”, as follows (see List of Items Controlled).",
        "label": "1B229 – 1B229 Water-hydrogen sulfide exchange tray columns and “internal contactors”, as follows (see List of Items Controlled).",
        "content": [
          {
            "type": "text",
            "text": "License Requirements"
          },
          {
            "type": "text",
            "text": "Reason for Control:"
          },
          {
            "type": "text",
            "text": "NP, AT"
          },
          {
            "type": "html",
            "tag": "TABLE",
            "html": "<TABLE border=\"1\" cellpadding=\"1\" cellspacing=\"1\" class=\"gpotbl_table\" frame=\"void\" width=\"100%\"><TR><TH class=\"gpotbl_colhed\" scope=\"col\">Control(s)\n</TH><TH class=\"gpotbl_colhed\" scope=\"col\">Country Chart (See Supp. No. 1 to part 738)\n</TH></TR><TR><TD align=\"left\" class=\"gpotbl_cell\" scope=\"row\">NP applies to entire entry (1B229)</TD><TD align=\"left\" class=\"gpotbl_cell\">NP Column 1\n</TD></TR><TR><TD align=\"left\" class=\"gpotbl_cell\" scope=\"row\">AT applies to entire entry (1B229)</TD><TD align=\"left\" class=\"gpotbl_cell\">AT Column 1</TD></TR></TABLE>",
            "text": "Control(s) Country Chart (See Supp. No. 1 to part 738) NP applies to entire entryNP Column 1 AT applies to entire entryAT Column 1",
            "id": null
          },
          {
            "type": "text",
            "text": "Control(s)"
          },
          {
            "type": "text",
            "text": "Country Chart (See Supp. No. 1 to part 738)"
          },
          {
            "type": "text",
            "text": "NP applies to entire entry"
          },
          {
            "type": "text",
            "text": "NP Column 1"
          },
          {
            "type": "text",
            "text": "AT applies to entire entry"
          },
          {
            "type": "text",
            "text": "AT Column 1"
          },
          {
            "type": "text",
            "text": "List Based License Exceptions (See Part 740 for a description of all license exceptions)"
          },
          {
            "type": "text",
            "text": "LVS:"
          },
          {
            "type": "text",
            "text": "N/A"
          },
          {
            "type": "text",
            "text": "GBS:"
          },
          {
            "type": "text",
            "text": "N/A"
          },
          {
            "type": "text",
            "text": "List of Items Controlled"
          },
          {
            "type": "text",
            "text": "Related Controls:"
          },
          {
            "type": "text",
            "text": "(1) Equipment “specially designed” or prepared for the production of heavy water is subject to the export licensing authority of the Nuclear Regulatory Commission (see 10 CFR part 110). (2) See ECCNs 1E001 (“development” and “production”) and 1E201 (“use”) for technology for items controlled by this entry."
          },
          {
            "type": "text",
            "text": "Related Definitions:"
          },
          {
            "type": "text",
            "text": "The “internal contactors” controlled by 1B229.b are segmented trays that have an effective assembled diameter of 1.8 m (6 ft.) or greater, are designed to facilitate countercurrent contacting, and are constructed of stainless steels with a carbon content of 0.03% or less. These may be sieve trays, valve trays, bubble cap trays, or turbogrid trays."
          },
          {
            "type": "text",
            "text": "Items:"
          },
          {
            "type": "text",
            "text": "a. Water-hydrogen sulfide exchange tray columns, having all of the following characteristics:"
          }
        ],
        "children": [
          {
            "identifier": "1B229.a",
            "heading": null,
            "label": "1B229.a",
            "children": [
              {
                "identifier": "1B229.a.1",
                "heading": "Can operate at pressures of 2 MPa or greater;",
                "label": "1B229.a.1 – Can operate at pressures of 2 MPa or greater;",
                "content": [
                  {
                    "type": "html",
                    "tag": "P",
                    "html": "<P>a.1. Can operate at pressures of 2 MPa or greater;</P>",
                    "text": "a.1. Can operate at pressures of 2 MPa or greater;",
                    "id": null
                  }
                ],
                "isEccn": true,
                "boundToParent": true,
                "requireAllChildren": false
              },
              {
                "identifier": "1B229.a.2",
                "heading": "Constructed of carbon steel having an austenitic ASTM (or equivalent standard) grain size number of 5 or greater; and",
                "label": "1B229.a.2 – Constructed of carbon steel having an austenitic ASTM (or equivalent standard) grain size number of 5 or greater; and",
                "content": [
                  {
                    "type": "html",
                    "tag": "P",
                    "html": "<P>a.2. Constructed of carbon steel having an austenitic ASTM (or equivalent standard) grain size number of 5 or greater; <I>and</I></P>",
                    "text": "a.2. Constructed of carbon steel having an austenitic ASTM (or equivalent standard) grain size number of 5 or greater; and",
                    "id": null
                  }
                ],
                "isEccn": true,
                "boundToParent": true,
                "requireAllChildren": false
              },
              {
                "identifier": "1B229.a.3",
                "heading": "With a diameter of 1.8 m (6 ft.) or greater;",
                "label": "1B229.a.3 – With a diameter of 1.8 m (6 ft.) or greater;",
                "content": [
                  {
                    "type": "html",
                    "tag": "P",
                    "html": "<P>a.3. With a diameter of 1.8 m (6 ft.) or greater;</P>",
                    "text": "a.3. With a diameter of 1.8 m (6 ft.) or greater;",
                    "id": null
                  }
                ],
                "isEccn": true,
                "boundToParent": true,
                "requireAllChildren": false
              }
            ],
            "isEccn": true,
            "boundToParent": true,
            "requireAllChildren": false
          },
          {
            "identifier": "1B229.b",
            "heading": "“Internal contactors” for the water-hydrogen sulfide exchange tray columns controlled by 1B229.a.",
            "label": "1B229.b – “Internal contactors” for the water-hydrogen sulfide exchange tray columns controlled by 1B229.a.",
            "content": [
              {
                "type": "html",
                "tag": "P",
                "html": "<P>b. “Internal contactors” for the water-hydrogen sulfide exchange tray columns controlled by 1B229.a.</P>",
                "text": "b. “Internal contactors” for the water-hydrogen sulfide exchange tray columns controlled by 1B229.a.",
                "id": null
              }
            ],
            "isEccn": true,
            "boundToParent": true,
            "requireAllChildren": false
          }
        ],
        "isEccn": true,
        "boundToParent": false,
        "requireAllChildren": true
      }
    },
    {
      "version": "2020-10-06",
      "fetchedAt": "2025-10-02T20:33:36.026Z",
      "sourceUrl": "https://www.ecfr.gov/api/versioner/v1/full/2020-10-06/title-15?format=xml",
      "heading": "1B229 Water-hydrogen sulfide exchange tray columns and “internal contactors”, as follows (see List of Items Controlled).",
      "title": "Water-hydrogen sulfide exchange tray columns and “internal contactors”, as follows (see List of Items Controlled).",
      "category": "1",
      "group": "1B",
      "supplement": {
        "number": "1",
        "heading": "Supplement No. 1 to Part 774 - The Commerce Control List"
      },
      "breadcrumbs": [
        "List of Items Controlled"
      ],
      "ancestors": [],
      "text": "1B229 Water-hydrogen sulfide exchange tray columns and “internal contactors”, as follows (see List of Items Controlled).\nLicense Requirements\nReason for Control:\nNP, AT\nControl(s) Country Chart (See Supp. No. 1 to part 738) NP applies to entire entryNP Column 1 AT applies to entire entryAT Column 1\nControl(s)\nCountry Chart (See Supp. No. 1 to part 738)\nNP applies to entire entry\nNP Column 1\nAT applies to entire entry\nAT Column 1\nList Based License Exceptions (See Part 740 for a description of all license exceptions)\nLVS:\nN/A\nGBS:\nN/A\nList of Items Controlled\nRelated Controls:\n(1) Equipment “specially designed” or prepared for the production of heavy water is subject to the export licensing authority of the Nuclear Regulatory Commission (see 10 CFR part 110). (2) See ECCNs 1E001 (“development” and “production”) and 1E201 (“use”) for technology for items controlled by this entry.\nRelated Definitions:\nThe “internal contactors” controlled by 1B229.b are segmented trays that have an effective assembled diameter of 1.8 m (6 ft.) or greater, are designed to facilitate countercurrent contacting, and are constructed of stainless steels with a carbon content of 0.03% or less. These may be sieve trays, valve trays, bubble cap trays, or turbogrid trays.\nItems:\na. Water-hydrogen sulfide exchange tray columns, having all of the following characteristics:\n1B229.a\nCan operate at pressures of 2 MPa or greater;\na.1. Can operate at pressures of 2 MPa or greater;\nConstructed of carbon steel having an austenitic ASTM (or equivalent standard) grain size number of 5 or greater; and\na.2. Constructed of carbon steel having an austenitic ASTM (or equivalent standard) grain size number of 5 or greater; and\nWith a diameter of 1.8 m (6 ft.) or greater;\na.3. With a diameter of 1.8 m (6 ft.) or greater;\n“Internal contactors” for the water-hydrogen sulfide exchange tray columns controlled by 1B229.a.\nb. “Internal contactors” for the water-hydrogen sulfide exchange tray columns controlled by 1B229.a.",
      "structure": {
        "identifier": "1B229",
        "heading": "1B229 Water-hydrogen sulfide exchange tray columns and “internal contactors”, as follows (see List of Items Controlled).",
        "label": "1B229 – 1B229 Water-hydrogen sulfide exchange tray columns and “internal contactors”, as follows (see List of Items Controlled).",
        "content": [
          {
            "type": "text",
            "text": "License Requirements"
          },
          {
            "type": "text",
            "text": "Reason for Control:"
          },
          {
            "type": "text",
            "text": "NP, AT"
          },
          {
            "type": "html",
            "tag": "TABLE",
            "html": "<TABLE border=\"1\" cellpadding=\"1\" cellspacing=\"1\" class=\"gpotbl_table\" frame=\"void\" width=\"100%\"><TR><TH class=\"gpotbl_colhed\" scope=\"col\">Control(s)\n</TH><TH class=\"gpotbl_colhed\" scope=\"col\">Country Chart (See Supp. No. 1 to part 738)\n</TH></TR><TR><TD align=\"left\" class=\"gpotbl_cell\" scope=\"row\">NP applies to entire entry (1B229)</TD><TD align=\"left\" class=\"gpotbl_cell\">NP Column 1\n</TD></TR><TR><TD align=\"left\" class=\"gpotbl_cell\" scope=\"row\">AT applies to entire entry (1B229)</TD><TD align=\"left\" class=\"gpotbl_cell\">AT Column 1</TD></TR></TABLE>",
            "text": "Control(s) Country Chart (See Supp. No. 1 to part 738) NP applies to entire entryNP Column 1 AT applies to entire entryAT Column 1",
            "id": null
          },
          {
            "type": "text",
            "text": "Control(s)"
          },
          {
            "type": "text",
            "text": "Country Chart (See Supp. No. 1 to part 738)"
          },
          {
            "type": "text",
            "text": "NP applies to entire entry"
          },
          {
            "type": "text",
            "text": "NP Column 1"
          },
          {
            "type": "text",
            "text": "AT applies to entire entry"
          },
          {
            "type": "text",
            "text": "AT Column 1"
          },
          {
            "type": "text",
            "text": "List Based License Exceptions (See Part 740 for a description of all license exceptions)"
          },
          {
            "type": "text",
            "text": "LVS:"
          },
          {
            "type": "text",
            "text": "N/A"
          },
          {
            "type": "text",
            "text": "GBS:"
          },
          {
            "type": "text",
            "text": "N/A"
          },
          {
            "type": "text",
            "text": "List of Items Controlled"
          },
          {
            "type": "text",
            "text": "Related Controls:"
          },
          {
            "type": "text",
            "text": "(1) Equipment “specially designed” or prepared for the production of heavy water is subject to the export licensing authority of the Nuclear Regulatory Commission (see 10 CFR part 110). (2) See ECCNs 1E001 (“development” and “production”) and 1E201 (“use”) for technology for items controlled by this entry."
          },
          {
            "type": "text",
            "text": "Related Definitions:"
          },
          {
            "type": "text",
            "text": "The “internal contactors” controlled by 1B229.b are segmented trays that have an effective assembled diameter of 1.8 m (6 ft.) or greater, are designed to facilitate countercurrent contacting, and are constructed of stainless steels with a carbon content of 0.03% or less. These may be sieve trays, valve trays, bubble cap trays, or turbogrid trays."
          },
          {
            "type": "text",
            "text": "Items:"
          },
          {
            "type": "text",
            "text": "a. Water-hydrogen sulfide exchange tray columns, having all of the following characteristics:"
          }
        ],
        "children": [
          {
            "identifier": "1B229.a",
            "heading": null,
            "label": "1B229.a",
            "children": [
              {
                "identifier": "1B229.a.1",
                "heading": "Can operate at pressures of 2 MPa or greater;",
                "label": "1B229.a.1 – Can operate at pressures of 2 MPa or greater;",
                "content": [
                  {
                    "type": "html",
                    "tag": "P",
                    "html": "<P>a.1. Can operate at pressures of 2 MPa or greater;</P>",
                    "text": "a.1. Can operate at pressures of 2 MPa or greater;",
                    "id": null
                  }
                ],
                "isEccn": true,
                "boundToParent": true,
                "requireAllChildren": false
              },
              {
                "identifier": "1B229.a.2",
                "heading": "Constructed of carbon steel having an austenitic ASTM (or equivalent standard) grain size number of 5 or greater; and",
                "label": "1B229.a.2 – Constructed of carbon steel having an austenitic ASTM (or equivalent standard) grain size number of 5 or greater; and",
                "content": [
                  {
                    "type": "html",
                    "tag": "P",
                    "html": "<P>a.2. Constructed of carbon steel having an austenitic ASTM (or equivalent standard) grain size number of 5 or greater; <I>and</I></P>",
                    "text": "a.2. Constructed of carbon steel having an austenitic ASTM (or equivalent standard) grain size number of 5 or greater; and",
                    "id": null
                  }
                ],
                "isEccn": true,
                "boundToParent": true,
                "requireAllChildren": false
              },
              {
                "identifier": "1B229.a.3",
                "heading": "With a diameter of 1.8 m (6 ft.) or greater;",
                "label": "1B229.a.3 – With a diameter of 1.8 m (6 ft.) or greater;",
                "content": [
                  {
                    "type": "html",
                    "tag": "P",
                    "html": "<P>a.3. With a diameter of 1.8 m (6 ft.) or greater;</P>",
                    "text": "a.3. With a diameter of 1.8 m (6 ft.) or greater;",
                    "id": null
                  }
                ],
                "isEccn": true,
                "boundToParent": true,
                "requireAllChildren": false
              }
            ],
            "isEccn": true,
            "boundToParent": true,
            "requireAllChildren": false
          },
          {
            "identifier": "1B229.b",
            "heading": "“Internal contactors” for the water-hydrogen sulfide exchange tray columns controlled by 1B229.a.",
            "label": "1B229.b – “Internal contactors” for the water-hydrogen sulfide exchange tray columns controlled by 1B229.a.",
            "content": [
              {
                "type": "html",
                "tag": "P",
                "html": "<P>b. “Internal contactors” for the water-hydrogen sulfide exchange tray columns controlled by 1B229.a.</P>",
                "text": "b. “Internal contactors” for the water-hydrogen sulfide exchange tray columns controlled by 1B229.a.",
                "id": null
              }
            ],
            "isEccn": true,
            "boundToParent": true,
            "requireAllChildren": false
          }
        ],
        "isEccn": true,
        "boundToParent": false,
        "requireAllChildren": true
      }
    },
    {
      "version": "2020-12-04",
      "fetchedAt": "2025-10-02T20:33:36.431Z",
      "sourceUrl": "https://www.ecfr.gov/api/versioner/v1/full/2020-12-04/title-15?format=xml",
      "heading": "1B229 Water-hydrogen sulfide exchange tray columns and “internal contactors”, as follows (see List of Items Controlled).",
      "title": "Water-hydrogen sulfide exchange tray columns and “internal contactors”, as follows (see List of Items Controlled).",
      "category": "1",
      "group": "1B",
      "supplement": {
        "number": "1",
        "heading": "Supplement No. 1 to Part 774 - The Commerce Control List"
      },
      "breadcrumbs": [
        "List of Items Controlled"
      ],
      "ancestors": [],
      "text": "1B229 Water-hydrogen sulfide exchange tray columns and “internal contactors”, as follows (see List of Items Controlled).\nLicense Requirements\nReason for Control:\nNP, AT\nControl(s) Country Chart (See Supp. No. 1 to part 738) NP applies to entire entryNP Column 1 AT applies to entire entryAT Column 1\nControl(s)\nCountry Chart (See Supp. No. 1 to part 738)\nNP applies to entire entry\nNP Column 1\nAT applies to entire entry\nAT Column 1\nList Based License Exceptions (See Part 740 for a description of all license exceptions)\nLVS:\nN/A\nGBS:\nN/A\nList of Items Controlled\nRelated Controls:\n(1) Equipment “specially designed” or prepared for the production of heavy water is subject to the export licensing authority of the Nuclear Regulatory Commission (see 10 CFR part 110). (2) See ECCNs 1E001 (“development” and “production”) and 1E201 (“use”) for technology for items controlled by this entry.\nRelated Definitions:\nThe “internal contactors” controlled by 1B229.b are segmented trays that have an effective assembled diameter of 1.8 m (6 ft.) or greater, are designed to facilitate countercurrent contacting, and are constructed of stainless steels with a carbon content of 0.03% or less. These may be sieve trays, valve trays, bubble cap trays, or turbogrid trays.\nItems:\na. Water-hydrogen sulfide exchange tray columns, having all of the following characteristics:\n1B229.a\nCan operate at pressures of 2 MPa or greater;\na.1. Can operate at pressures of 2 MPa or greater;\nConstructed of carbon steel having an austenitic ASTM (or equivalent standard) grain size number of 5 or greater; and\na.2. Constructed of carbon steel having an austenitic ASTM (or equivalent standard) grain size number of 5 or greater; and\nWith a diameter of 1.8 m (6 ft.) or greater;\na.3. With a diameter of 1.8 m (6 ft.) or greater;\n“Internal contactors” for the water-hydrogen sulfide exchange tray columns controlled by 1B229.a.\nb. “Internal contactors” for the water-hydrogen sulfide exchange tray columns controlled by 1B229.a.",
      "structure": {
        "identifier": "1B229",
        "heading": "1B229 Water-hydrogen sulfide exchange tray columns and “internal contactors”, as follows (see List of Items Controlled).",
        "label": "1B229 – 1B229 Water-hydrogen sulfide exchange tray columns and “internal contactors”, as follows (see List of Items Controlled).",
        "content": [
          {
            "type": "text",
            "text": "License Requirements"
          },
          {
            "type": "text",
            "text": "Reason for Control:"
          },
          {
            "type": "text",
            "text": "NP, AT"
          },
          {
            "type": "html",
            "tag": "TABLE",
            "html": "<TABLE border=\"1\" cellpadding=\"1\" cellspacing=\"1\" class=\"gpotbl_table\" frame=\"void\" width=\"100%\"><TR><TH class=\"gpotbl_colhed\" scope=\"col\">Control(s)\n</TH><TH class=\"gpotbl_colhed\" scope=\"col\">Country Chart (See Supp. No. 1 to part 738)\n</TH></TR><TR><TD align=\"left\" class=\"gpotbl_cell\" scope=\"row\">NP applies to entire entry (1B229)</TD><TD align=\"left\" class=\"gpotbl_cell\">NP Column 1\n</TD></TR><TR><TD align=\"left\" class=\"gpotbl_cell\" scope=\"row\">AT applies to entire entry (1B229)</TD><TD align=\"left\" class=\"gpotbl_cell\">AT Column 1</TD></TR></TABLE>",
            "text": "Control(s) Country Chart (See Supp. No. 1 to part 738) NP applies to entire entryNP Column 1 AT applies to entire entryAT Column 1",
            "id": null
          },
          {
            "type": "text",
            "text": "Control(s)"
          },
          {
            "type": "text",
            "text": "Country Chart (See Supp. No. 1 to part 738)"
          },
          {
            "type": "text",
            "text": "NP applies to entire entry"
          },
          {
            "type": "text",
            "text": "NP Column 1"
          },
          {
            "type": "text",
            "text": "AT applies to entire entry"
          },
          {
            "type": "text",
            "text": "AT Column 1"
          },
          {
            "type": "text",
            "text": "List Based License Exceptions (See Part 740 for a description of all license exceptions)"
          },
          {
            "type": "text",
            "text": "LVS:"
          },
          {
            "type": "text",
            "text": "N/A"
          },
          {
            "type": "text",
            "text": "GBS:"
          },
          {
            "type": "text",
            "text": "N/A"
          },
          {
            "type": "text",
            "text": "List of Items Controlled"
          },
          {
            "type": "text",
            "text": "Related Controls:"
          },
          {
            "type": "text",
            "text": "(1) Equipment “specially designed” or prepared for the production of heavy water is subject to the export licensing authority of the Nuclear Regulatory Commission (see 10 CFR part 110). (2) See ECCNs 1E001 (“development” and “production”) and 1E201 (“use”) for technology for items controlled by this entry."
          },
          {
            "type": "text",
            "text": "Related Definitions:"
          },
          {
            "type": "text",
            "text": "The “internal contactors” controlled by 1B229.b are segmented trays that have an effective assembled diameter of 1.8 m (6 ft.) or greater, are designed to facilitate countercurrent contacting, and are constructed of stainless steels with a carbon content of 0.03% or less. These may be sieve trays, valve trays, bubble cap trays, or turbogrid trays."
          },
          {
            "type": "text",
            "text": "Items:"
          },
          {
            "type": "text",
            "text": "a. Water-hydrogen sulfide exchange tray columns, having all of the following characteristics:"
          }
        ],
        "children": [
          {
            "identifier": "1B229.a",
            "heading": null,
            "label": "1B229.a",
            "children": [
              {
                "identifier": "1B229.a.1",
                "heading": "Can operate at pressures of 2 MPa or greater;",
                "label": "1B229.a.1 – Can operate at pressures of 2 MPa or greater;",
                "content": [
                  {
                    "type": "html",
                    "tag": "P",
                    "html": "<P>a.1. Can operate at pressures of 2 MPa or greater;</P>",
                    "text": "a.1. Can operate at pressures of 2 MPa or greater;",
                    "id": null
                  }
                ],
                "isEccn": true,
                "boundToParent": true,
                "requireAllChildren": false
              },
              {
                "identifier": "1B229.a.2",
                "heading": "Constructed of carbon steel having an austenitic ASTM (or equivalent standard) grain size number of 5 or greater; and",
                "label": "1B229.a.2 – Constructed of carbon steel having an austenitic ASTM (or equivalent standard) grain size number of 5 or greater; and",
                "content": [
                  {
                    "type": "html",
                    "tag": "P",
                    "html": "<P>a.2. Constructed of carbon steel having an austenitic ASTM (or equivalent standard) grain size number of 5 or greater; <I>and</I></P>",
                    "text": "a.2. Constructed of carbon steel having an austenitic ASTM (or equivalent standard) grain size number of 5 or greater; and",
                    "id": null
                  }
                ],
                "isEccn": true,
                "boundToParent": true,
                "requireAllChildren": false
              },
              {
                "identifier": "1B229.a.3",
                "heading": "With a diameter of 1.8 m (6 ft.) or greater;",
                "label": "1B229.a.3 – With a diameter of 1.8 m (6 ft.) or greater;",
                "content": [
                  {
                    "type": "html",
                    "tag": "P",
                    "html": "<P>a.3. With a diameter of 1.8 m (6 ft.) or greater;</P>",
                    "text": "a.3. With a diameter of 1.8 m (6 ft.) or greater;",
                    "id": null
                  }
                ],
                "isEccn": true,
                "boundToParent": true,
                "requireAllChildren": false
              }
            ],
            "isEccn": true,
            "boundToParent": true,
            "requireAllChildren": false
          },
          {
            "identifier": "1B229.b",
            "heading": "“Internal contactors” for the water-hydrogen sulfide exchange tray columns controlled by 1B229.a.",
            "label": "1B229.b – “Internal contactors” for the water-hydrogen sulfide exchange tray columns controlled by 1B229.a.",
            "content": [
              {
                "type": "html",
                "tag": "P",
                "html": "<P>b. “Internal contactors” for the water-hydrogen sulfide exchange tray columns controlled by 1B229.a.</P>",
                "text": "b. “Internal contactors” for the water-hydrogen sulfide exchange tray columns controlled by 1B229.a.",
                "id": null
              }
            ],
            "isEccn": true,
            "boundToParent": true,
            "requireAllChildren": false
          }
        ],
        "isEccn": true,
        "boundToParent": false,
        "requireAllChildren": true
      }
    },
    {
      "version": "2021-01-06",
      "fetchedAt": "2025-10-02T20:33:36.829Z",
      "sourceUrl": "https://www.ecfr.gov/api/versioner/v1/full/2021-01-06/title-15?format=xml",
      "heading": "1B229 Water-hydrogen sulfide exchange tray columns and “internal contactors”, as follows (see List of Items Controlled).",
      "title": "Water-hydrogen sulfide exchange tray columns and “internal contactors”, as follows (see List of Items Controlled).",
      "category": "1",
      "group": "1B",
      "supplement": {
        "number": "1",
        "heading": "Supplement No. 1 to Part 774 - The Commerce Control List"
      },
      "breadcrumbs": [
        "List of Items Controlled"
      ],
      "ancestors": [],
      "text": "1B229 Water-hydrogen sulfide exchange tray columns and “internal contactors”, as follows (see List of Items Controlled).\nLicense Requirements\nReason for Control:\nNP, AT\nControl(s) Country Chart (See Supp. No. 1 to part 738) NP applies to entire entryNP Column 1 AT applies to entire entryAT Column 1\nControl(s)\nCountry Chart (See Supp. No. 1 to part 738)\nNP applies to entire entry\nNP Column 1\nAT applies to entire entry\nAT Column 1\nList Based License Exceptions (See Part 740 for a description of all license exceptions)\nLVS:\nN/A\nGBS:\nN/A\nList of Items Controlled\nRelated Controls:\n(1) Equipment “specially designed” or prepared for the production of heavy water is subject to the export licensing authority of the Nuclear Regulatory Commission (see 10 CFR part 110). (2) See ECCNs 1E001 (“development” and “production”) and 1E201 (“use”) for technology for items controlled by this entry.\nRelated Definitions:\nThe “internal contactors” controlled by 1B229.b are segmented trays that have an effective assembled diameter of 1.8 m (6 ft.) or greater, are designed to facilitate countercurrent contacting, and are constructed of stainless steels with a carbon content of 0.03% or less. These may be sieve trays, valve trays, bubble cap trays, or turbogrid trays.\nItems:\na. Water-hydrogen sulfide exchange tray columns, having all of the following characteristics:\n1B229.a\nCan operate at pressures of 2 MPa or greater;\na.1. Can operate at pressures of 2 MPa or greater;\nConstructed of carbon steel having an austenitic ASTM (or equivalent standard) grain size number of 5 or greater; and\na.2. Constructed of carbon steel having an austenitic ASTM (or equivalent standard) grain size number of 5 or greater; and\nWith a diameter of 1.8 m (6 ft.) or greater;\na.3. With a diameter of 1.8 m (6 ft.) or greater;\n“Internal contactors” for the water-hydrogen sulfide exchange tray columns controlled by 1B229.a.\nb. “Internal contactors” for the water-hydrogen sulfide exchange tray columns controlled by 1B229.a.",
      "structure": {
        "identifier": "1B229",
        "heading": "1B229 Water-hydrogen sulfide exchange tray columns and “internal contactors”, as follows (see List of Items Controlled).",
        "label": "1B229 – 1B229 Water-hydrogen sulfide exchange tray columns and “internal contactors”, as follows (see List of Items Controlled).",
        "content": [
          {
            "type": "text",
            "text": "License Requirements"
          },
          {
            "type": "text",
            "text": "Reason for Control:"
          },
          {
            "type": "text",
            "text": "NP, AT"
          },
          {
            "type": "html",
            "tag": "TABLE",
            "html": "<TABLE border=\"1\" cellpadding=\"1\" cellspacing=\"1\" class=\"gpotbl_table\" frame=\"void\" width=\"100%\"><TR><TH class=\"gpotbl_colhed\" scope=\"col\">Control(s)\n</TH><TH class=\"gpotbl_colhed\" scope=\"col\">Country Chart (See Supp. No. 1 to part 738)\n</TH></TR><TR><TD align=\"left\" class=\"gpotbl_cell\" scope=\"row\">NP applies to entire entry (1B229)</TD><TD align=\"left\" class=\"gpotbl_cell\">NP Column 1\n</TD></TR><TR><TD align=\"left\" class=\"gpotbl_cell\" scope=\"row\">AT applies to entire entry (1B229)</TD><TD align=\"left\" class=\"gpotbl_cell\">AT Column 1</TD></TR></TABLE>",
            "text": "Control(s) Country Chart (See Supp. No. 1 to part 738) NP applies to entire entryNP Column 1 AT applies to entire entryAT Column 1",
            "id": null
          },
          {
            "type": "text",
            "text": "Control(s)"
          },
          {
            "type": "text",
            "text": "Country Chart (See Supp. No. 1 to part 738)"
          },
          {
            "type": "text",
            "text": "NP applies to entire entry"
          },
          {
            "type": "text",
            "text": "NP Column 1"
          },
          {
            "type": "text",
            "text": "AT applies to entire entry"
          },
          {
            "type": "text",
            "text": "AT Column 1"
          },
          {
            "type": "text",
            "text": "List Based License Exceptions (See Part 740 for a description of all license exceptions)"
          },
          {
            "type": "text",
            "text": "LVS:"
          },
          {
            "type": "text",
            "text": "N/A"
          },
          {
            "type": "text",
            "text": "GBS:"
          },
          {
            "type": "text",
            "text": "N/A"
          },
          {
            "type": "text",
            "text": "List of Items Controlled"
          },
          {
            "type": "text",
            "text": "Related Controls:"
          },
          {
            "type": "text",
            "text": "(1) Equipment “specially designed” or prepared for the production of heavy water is subject to the export licensing authority of the Nuclear Regulatory Commission (see 10 CFR part 110). (2) See ECCNs 1E001 (“development” and “production”) and 1E201 (“use”) for technology for items controlled by this entry."
          },
          {
            "type": "text",
            "text": "Related Definitions:"
          },
          {
            "type": "text",
            "text": "The “internal contactors” controlled by 1B229.b are segmented trays that have an effective assembled diameter of 1.8 m (6 ft.) or greater, are designed to facilitate countercurrent contacting, and are constructed of stainless steels with a carbon content of 0.03% or less. These may be sieve trays, valve trays, bubble cap trays, or turbogrid trays."
          },
          {
            "type": "text",
            "text": "Items:"
          },
          {
            "type": "text",
            "text": "a. Water-hydrogen sulfide exchange tray columns, having all of the following characteristics:"
          }
        ],
        "children": [
          {
            "identifier": "1B229.a",
            "heading": null,
            "label": "1B229.a",
            "children": [
              {
                "identifier": "1B229.a.1",
                "heading": "Can operate at pressures of 2 MPa or greater;",
                "label": "1B229.a.1 – Can operate at pressures of 2 MPa or greater;",
                "content": [
                  {
                    "type": "html",
                    "tag": "P",
                    "html": "<P>a.1. Can operate at pressures of 2 MPa or greater;</P>",
                    "text": "a.1. Can operate at pressures of 2 MPa or greater;",
                    "id": null
                  }
                ],
                "isEccn": true,
                "boundToParent": true,
                "requireAllChildren": false
              },
              {
                "identifier": "1B229.a.2",
                "heading": "Constructed of carbon steel having an austenitic ASTM (or equivalent standard) grain size number of 5 or greater; and",
                "label": "1B229.a.2 – Constructed of carbon steel having an austenitic ASTM (or equivalent standard) grain size number of 5 or greater; and",
                "content": [
                  {
                    "type": "html",
                    "tag": "P",
                    "html": "<P>a.2. Constructed of carbon steel having an austenitic ASTM (or equivalent standard) grain size number of 5 or greater; <I>and</I></P>",
                    "text": "a.2. Constructed of carbon steel having an austenitic ASTM (or equivalent standard) grain size number of 5 or greater; and",
                    "id": null
                  }
                ],
                "isEccn": true,
                "boundToParent": true,
                "requireAllChildren": false
              },
              {
                "identifier": "1B229.a.3",
                "heading": "With a diameter of 1.8 m (6 ft.) or greater;",
                "label": "1B229.a.3 – With a diameter of 1.8 m (6 ft.) or greater;",
                "content": [
                  {
                    "type": "html",
                    "tag": "P",
                    "html": "<P>a.3. With a diameter of 1.8 m (6 ft.) or greater;</P>",
                    "text": "a.3. With a diameter of 1.8 m (6 ft.) or greater;",
                    "id": null
                  }
                ],
                "isEccn": true,
                "boundToParent": true,
                "requireAllChildren": false
              }
            ],
            "isEccn": true,
            "boundToParent": true,
            "requireAllChildren": false
          },
          {
            "identifier": "1B229.b",
            "heading": "“Internal contactors” for the water-hydrogen sulfide exchange tray columns controlled by 1B229.a.",
            "label": "1B229.b – “Internal contactors” for the water-hydrogen sulfide exchange tray columns controlled by 1B229.a.",
            "content": [
              {
                "type": "html",
                "tag": "P",
                "html": "<P>b. “Internal contactors” for the water-hydrogen sulfide exchange tray columns controlled by 1B229.a.</P>",
                "text": "b. “Internal contactors” for the water-hydrogen sulfide exchange tray columns controlled by 1B229.a.",
                "id": null
              }
            ],
            "isEccn": true,
            "boundToParent": true,
            "requireAllChildren": false
          }
        ],
        "isEccn": true,
        "boundToParent": false,
        "requireAllChildren": true
      }
    },
    {
      "version": "2021-01-07",
      "fetchedAt": "2025-10-02T20:33:37.217Z",
      "sourceUrl": "https://www.ecfr.gov/api/versioner/v1/full/2021-01-07/title-15?format=xml",
      "heading": "1B229 Water-hydrogen sulfide exchange tray columns and “internal contactors”, as follows (see List of Items Controlled).",
      "title": "Water-hydrogen sulfide exchange tray columns and “internal contactors”, as follows (see List of Items Controlled).",
      "category": "1",
      "group": "1B",
      "supplement": {
        "number": "1",
        "heading": "Supplement No. 1 to Part 774 - The Commerce Control List"
      },
      "breadcrumbs": [
        "List of Items Controlled"
      ],
      "ancestors": [],
      "text": "1B229 Water-hydrogen sulfide exchange tray columns and “internal contactors”, as follows (see List of Items Controlled).\nLicense Requirements\nReason for Control:\nNP, AT\nControl(s) Country Chart (See Supp. No. 1 to part 738) NP applies to entire entryNP Column 1 AT applies to entire entryAT Column 1\nControl(s)\nCountry Chart (See Supp. No. 1 to part 738)\nNP applies to entire entry\nNP Column 1\nAT applies to entire entry\nAT Column 1\nList Based License Exceptions (See Part 740 for a description of all license exceptions)\nLVS:\nN/A\nGBS:\nN/A\nList of Items Controlled\nRelated Controls:\n(1) Equipment “specially designed” or prepared for the production of heavy water is subject to the export licensing authority of the Nuclear Regulatory Commission (see 10 CFR part 110). (2) See ECCNs 1E001 (“development” and “production”) and 1E201 (“use”) for technology for items controlled by this entry.\nRelated Definitions:\nThe “internal contactors” controlled by 1B229.b are segmented trays that have an effective assembled diameter of 1.8 m (6 ft.) or greater, are designed to facilitate countercurrent contacting, and are constructed of stainless steels with a carbon content of 0.03% or less. These may be sieve trays, valve trays, bubble cap trays, or turbogrid trays.\nItems:\na. Water-hydrogen sulfide exchange tray columns, having all of the following characteristics:\n1B229.a\nCan operate at pressures of 2 MPa or greater;\na.1. Can operate at pressures of 2 MPa or greater;\nConstructed of carbon steel having an austenitic ASTM (or equivalent standard) grain size number of 5 or greater; and\na.2. Constructed of carbon steel having an austenitic ASTM (or equivalent standard) grain size number of 5 or greater; and\nWith a diameter of 1.8 m (6 ft.) or greater;\na.3. With a diameter of 1.8 m (6 ft.) or greater;\n“Internal contactors” for the water-hydrogen sulfide exchange tray columns controlled by 1B229.a.\nb. “Internal contactors” for the water-hydrogen sulfide exchange tray columns controlled by 1B229.a.",
      "structure": {
        "identifier": "1B229",
        "heading": "1B229 Water-hydrogen sulfide exchange tray columns and “internal contactors”, as follows (see List of Items Controlled).",
        "label": "1B229 – 1B229 Water-hydrogen sulfide exchange tray columns and “internal contactors”, as follows (see List of Items Controlled).",
        "content": [
          {
            "type": "text",
            "text": "License Requirements"
          },
          {
            "type": "text",
            "text": "Reason for Control:"
          },
          {
            "type": "text",
            "text": "NP, AT"
          },
          {
            "type": "html",
            "tag": "TABLE",
            "html": "<TABLE border=\"1\" cellpadding=\"1\" cellspacing=\"1\" class=\"gpotbl_table\" frame=\"void\" width=\"100%\"><TR><TH class=\"gpotbl_colhed\" scope=\"col\">Control(s)\n</TH><TH class=\"gpotbl_colhed\" scope=\"col\">Country Chart (See Supp. No. 1 to part 738)\n</TH></TR><TR><TD align=\"left\" class=\"gpotbl_cell\" scope=\"row\">NP applies to entire entry (1B229)</TD><TD align=\"left\" class=\"gpotbl_cell\">NP Column 1\n</TD></TR><TR><TD align=\"left\" class=\"gpotbl_cell\" scope=\"row\">AT applies to entire entry (1B229)</TD><TD align=\"left\" class=\"gpotbl_cell\">AT Column 1</TD></TR></TABLE>",
            "text": "Control(s) Country Chart (See Supp. No. 1 to part 738) NP applies to entire entryNP Column 1 AT applies to entire entryAT Column 1",
            "id": null
          },
          {
            "type": "text",
            "text": "Control(s)"
          },
          {
            "type": "text",
            "text": "Country Chart (See Supp. No. 1 to part 738)"
          },
          {
            "type": "text",
            "text": "NP applies to entire entry"
          },
          {
            "type": "text",
            "text": "NP Column 1"
          },
          {
            "type": "text",
            "text": "AT applies to entire entry"
          },
          {
            "type": "text",
            "text": "AT Column 1"
          },
          {
            "type": "text",
            "text": "List Based License Exceptions (See Part 740 for a description of all license exceptions)"
          },
          {
            "type": "text",
            "text": "LVS:"
          },
          {
            "type": "text",
            "text": "N/A"
          },
          {
            "type": "text",
            "text": "GBS:"
          },
          {
            "type": "text",
            "text": "N/A"
          },
          {
            "type": "text",
            "text": "List of Items Controlled"
          },
          {
            "type": "text",
            "text": "Related Controls:"
          },
          {
            "type": "text",
            "text": "(1) Equipment “specially designed” or prepared for the production of heavy water is subject to the export licensing authority of the Nuclear Regulatory Commission (see 10 CFR part 110). (2) See ECCNs 1E001 (“development” and “production”) and 1E201 (“use”) for technology for items controlled by this entry."
          },
          {
            "type": "text",
            "text": "Related Definitions:"
          },
          {
            "type": "text",
            "text": "The “internal contactors” controlled by 1B229.b are segmented trays that have an effective assembled diameter of 1.8 m (6 ft.) or greater, are designed to facilitate countercurrent contacting, and are constructed of stainless steels with a carbon content of 0.03% or less. These may be sieve trays, valve trays, bubble cap trays, or turbogrid trays."
          },
          {
            "type": "text",
            "text": "Items:"
          },
          {
            "type": "text",
            "text": "a. Water-hydrogen sulfide exchange tray columns, having all of the following characteristics:"
          }
        ],
        "children": [
          {
            "identifier": "1B229.a",
            "heading": null,
            "label": "1B229.a",
            "children": [
              {
                "identifier": "1B229.a.1",
                "heading": "Can operate at pressures of 2 MPa or greater;",
                "label": "1B229.a.1 – Can operate at pressures of 2 MPa or greater;",
                "content": [
                  {
                    "type": "html",
                    "tag": "P",
                    "html": "<P>a.1. Can operate at pressures of 2 MPa or greater;</P>",
                    "text": "a.1. Can operate at pressures of 2 MPa or greater;",
                    "id": null
                  }
                ],
                "isEccn": true,
                "boundToParent": true,
                "requireAllChildren": false
              },
              {
                "identifier": "1B229.a.2",
                "heading": "Constructed of carbon steel having an austenitic ASTM (or equivalent standard) grain size number of 5 or greater; and",
                "label": "1B229.a.2 – Constructed of carbon steel having an austenitic ASTM (or equivalent standard) grain size number of 5 or greater; and",
                "content": [
                  {
                    "type": "html",
                    "tag": "P",
                    "html": "<P>a.2. Constructed of carbon steel having an austenitic ASTM (or equivalent standard) grain size number of 5 or greater; <I>and</I></P>",
                    "text": "a.2. Constructed of carbon steel having an austenitic ASTM (or equivalent standard) grain size number of 5 or greater; and",
                    "id": null
                  }
                ],
                "isEccn": true,
                "boundToParent": true,
                "requireAllChildren": false
              },
              {
                "identifier": "1B229.a.3",
                "heading": "With a diameter of 1.8 m (6 ft.) or greater;",
                "label": "1B229.a.3 – With a diameter of 1.8 m (6 ft.) or greater;",
                "content": [
                  {
                    "type": "html",
                    "tag": "P",
                    "html": "<P>a.3. With a diameter of 1.8 m (6 ft.) or greater;</P>",
                    "text": "a.3. With a diameter of 1.8 m (6 ft.) or greater;",
                    "id": null
                  }
                ],
                "isEccn": true,
                "boundToParent": true,
                "requireAllChildren": false
              }
            ],
            "isEccn": true,
            "boundToParent": true,
            "requireAllChildren": false
          },
          {
            "identifier": "1B229.b",
            "heading": "“Internal contactors” for the water-hydrogen sulfide exchange tray columns controlled by 1B229.a.",
            "label": "1B229.b – “Internal contactors” for the water-hydrogen sulfide exchange tray columns controlled by 1B229.a.",
            "content": [
              {
                "type": "html",
                "tag": "P",
                "html": "<P>b. “Internal contactors” for the water-hydrogen sulfide exchange tray columns controlled by 1B229.a.</P>",
                "text": "b. “Internal contactors” for the water-hydrogen sulfide exchange tray columns controlled by 1B229.a.",
                "id": null
              }
            ],
            "isEccn": true,
            "boundToParent": true,
            "requireAllChildren": false
          }
        ],
        "isEccn": true,
        "boundToParent": false,
        "requireAllChildren": true
      }
    },
    {
      "version": "2021-01-14",
      "fetchedAt": "2025-10-02T20:33:37.609Z",
      "sourceUrl": "https://www.ecfr.gov/api/versioner/v1/full/2021-01-14/title-15?format=xml",
      "heading": "1B229 Water-hydrogen sulfide exchange tray columns and “internal contactors”, as follows (see List of Items Controlled).",
      "title": "Water-hydrogen sulfide exchange tray columns and “internal contactors”, as follows (see List of Items Controlled).",
      "category": "1",
      "group": "1B",
      "supplement": {
        "number": "1",
        "heading": "Supplement No. 1 to Part 774 - The Commerce Control List"
      },
      "breadcrumbs": [
        "List of Items Controlled"
      ],
      "ancestors": [],
      "text": "1B229 Water-hydrogen sulfide exchange tray columns and “internal contactors”, as follows (see List of Items Controlled).\nLicense Requirements\nReason for Control:\nNP, AT\nControl(s) Country Chart (See Supp. No. 1 to part 738) NP applies to entire entryNP Column 1 AT applies to entire entryAT Column 1\nControl(s)\nCountry Chart (See Supp. No. 1 to part 738)\nNP applies to entire entry\nNP Column 1\nAT applies to entire entry\nAT Column 1\nList Based License Exceptions (See Part 740 for a description of all license exceptions)\nLVS:\nN/A\nGBS:\nN/A\nList of Items Controlled\nRelated Controls:\n(1) Equipment “specially designed” or prepared for the production of heavy water is subject to the export licensing authority of the Nuclear Regulatory Commission (see 10 CFR part 110). (2) See ECCNs 1E001 (“development” and “production”) and 1E201 (“use”) for technology for items controlled by this entry.\nRelated Definitions:\nThe “internal contactors” controlled by 1B229.b are segmented trays that have an effective assembled diameter of 1.8 m (6 ft.) or greater, are designed to facilitate countercurrent contacting, and are constructed of stainless steels with a carbon content of 0.03% or less. These may be sieve trays, valve trays, bubble cap trays, or turbogrid trays.\nItems:\na. Water-hydrogen sulfide exchange tray columns, having all of the following characteristics:\n1B229.a\nCan operate at pressures of 2 MPa or greater;\na.1. Can operate at pressures of 2 MPa or greater;\nConstructed of carbon steel having an austenitic ASTM (or equivalent standard) grain size number of 5 or greater; and\na.2. Constructed of carbon steel having an austenitic ASTM (or equivalent standard) grain size number of 5 or greater; and\nWith a diameter of 1.8 m (6 ft.) or greater;\na.3. With a diameter of 1.8 m (6 ft.) or greater;\n“Internal contactors” for the water-hydrogen sulfide exchange tray columns controlled by 1B229.a.\nb. “Internal contactors” for the water-hydrogen sulfide exchange tray columns controlled by 1B229.a.",
      "structure": {
        "identifier": "1B229",
        "heading": "1B229 Water-hydrogen sulfide exchange tray columns and “internal contactors”, as follows (see List of Items Controlled).",
        "label": "1B229 – 1B229 Water-hydrogen sulfide exchange tray columns and “internal contactors”, as follows (see List of Items Controlled).",
        "content": [
          {
            "type": "text",
            "text": "License Requirements"
          },
          {
            "type": "text",
            "text": "Reason for Control:"
          },
          {
            "type": "text",
            "text": "NP, AT"
          },
          {
            "type": "html",
            "tag": "TABLE",
            "html": "<TABLE border=\"1\" cellpadding=\"1\" cellspacing=\"1\" class=\"gpotbl_table\" frame=\"void\" width=\"100%\"><TR><TH class=\"gpotbl_colhed\" scope=\"col\">Control(s)\n</TH><TH class=\"gpotbl_colhed\" scope=\"col\">Country Chart (See Supp. No. 1 to part 738)\n</TH></TR><TR><TD align=\"left\" class=\"gpotbl_cell\" scope=\"row\">NP applies to entire entry (1B229)</TD><TD align=\"left\" class=\"gpotbl_cell\">NP Column 1\n</TD></TR><TR><TD align=\"left\" class=\"gpotbl_cell\" scope=\"row\">AT applies to entire entry (1B229)</TD><TD align=\"left\" class=\"gpotbl_cell\">AT Column 1</TD></TR></TABLE>",
            "text": "Control(s) Country Chart (See Supp. No. 1 to part 738) NP applies to entire entryNP Column 1 AT applies to entire entryAT Column 1",
            "id": null
          },
          {
            "type": "text",
            "text": "Control(s)"
          },
          {
            "type": "text",
            "text": "Country Chart (See Supp. No. 1 to part 738)"
          },
          {
            "type": "text",
            "text": "NP applies to entire entry"
          },
          {
            "type": "text",
            "text": "NP Column 1"
          },
          {
            "type": "text",
            "text": "AT applies to entire entry"
          },
          {
            "type": "text",
            "text": "AT Column 1"
          },
          {
            "type": "text",
            "text": "List Based License Exceptions (See Part 740 for a description of all license exceptions)"
          },
          {
            "type": "text",
            "text": "LVS:"
          },
          {
            "type": "text",
            "text": "N/A"
          },
          {
            "type": "text",
            "text": "GBS:"
          },
          {
            "type": "text",
            "text": "N/A"
          },
          {
            "type": "text",
            "text": "List of Items Controlled"
          },
          {
            "type": "text",
            "text": "Related Controls:"
          },
          {
            "type": "text",
            "text": "(1) Equipment “specially designed” or prepared for the production of heavy water is subject to the export licensing authority of the Nuclear Regulatory Commission (see 10 CFR part 110). (2) See ECCNs 1E001 (“development” and “production”) and 1E201 (“use”) for technology for items controlled by this entry."
          },
          {
            "type": "text",
            "text": "Related Definitions:"
          },
          {
            "type": "text",
            "text": "The “internal contactors” controlled by 1B229.b are segmented trays that have an effective assembled diameter of 1.8 m (6 ft.) or greater, are designed to facilitate countercurrent contacting, and are constructed of stainless steels with a carbon content of 0.03% or less. These may be sieve trays, valve trays, bubble cap trays, or turbogrid trays."
          },
          {
            "type": "text",
            "text": "Items:"
          },
          {
            "type": "text",
            "text": "a. Water-hydrogen sulfide exchange tray columns, having all of the following characteristics:"
          }
        ],
        "children": [
          {
            "identifier": "1B229.a",
            "heading": null,
            "label": "1B229.a",
            "children": [
              {
                "identifier": "1B229.a.1",
                "heading": "Can operate at pressures of 2 MPa or greater;",
                "label": "1B229.a.1 – Can operate at pressures of 2 MPa or greater;",
                "content": [
                  {
                    "type": "html",
                    "tag": "P",
                    "html": "<P>a.1. Can operate at pressures of 2 MPa or greater;</P>",
                    "text": "a.1. Can operate at pressures of 2 MPa or greater;",
                    "id": null
                  }
                ],
                "isEccn": true,
                "boundToParent": true,
                "requireAllChildren": false
              },
              {
                "identifier": "1B229.a.2",
                "heading": "Constructed of carbon steel having an austenitic ASTM (or equivalent standard) grain size number of 5 or greater; and",
                "label": "1B229.a.2 – Constructed of carbon steel having an austenitic ASTM (or equivalent standard) grain size number of 5 or greater; and",
                "content": [
                  {
                    "type": "html",
                    "tag": "P",
                    "html": "<P>a.2. Constructed of carbon steel having an austenitic ASTM (or equivalent standard) grain size number of 5 or greater; <I>and</I></P>",
                    "text": "a.2. Constructed of carbon steel having an austenitic ASTM (or equivalent standard) grain size number of 5 or greater; and",
                    "id": null
                  }
                ],
                "isEccn": true,
                "boundToParent": true,
                "requireAllChildren": false
              },
              {
                "identifier": "1B229.a.3",
                "heading": "With a diameter of 1.8 m (6 ft.) or greater;",
                "label": "1B229.a.3 – With a diameter of 1.8 m (6 ft.) or greater;",
                "content": [
                  {
                    "type": "html",
                    "tag": "P",
                    "html": "<P>a.3. With a diameter of 1.8 m (6 ft.) or greater;</P>",
                    "text": "a.3. With a diameter of 1.8 m (6 ft.) or greater;",
                    "id": null
                  }
                ],
                "isEccn": true,
                "boundToParent": true,
                "requireAllChildren": false
              }
            ],
            "isEccn": true,
            "boundToParent": true,
            "requireAllChildren": false
          },
          {
            "identifier": "1B229.b",
            "heading": "“Internal contactors” for the water-hydrogen sulfide exchange tray columns controlled by 1B229.a.",
            "label": "1B229.b – “Internal contactors” for the water-hydrogen sulfide exchange tray columns controlled by 1B229.a.",
            "content": [
              {
                "type": "html",
                "tag": "P",
                "html": "<P>b. “Internal contactors” for the water-hydrogen sulfide exchange tray columns controlled by 1B229.a.</P>",
                "text": "b. “Internal contactors” for the water-hydrogen sulfide exchange tray columns controlled by 1B229.a.",
                "id": null
              }
            ],
            "isEccn": true,
            "boundToParent": true,
            "requireAllChildren": false
          }
        ],
        "isEccn": true,
        "boundToParent": false,
        "requireAllChildren": true
      }
    },
    {
      "version": "2021-03-29",
      "fetchedAt": "2025-10-02T20:33:37.994Z",
      "sourceUrl": "https://www.ecfr.gov/api/versioner/v1/full/2021-03-29/title-15?format=xml",
      "heading": "1B229 Water-hydrogen sulfide exchange tray columns and “internal contactors”, as follows (see List of Items Controlled).",
      "title": "Water-hydrogen sulfide exchange tray columns and “internal contactors”, as follows (see List of Items Controlled).",
      "category": "1",
      "group": "1B",
      "supplement": {
        "number": "1",
        "heading": "Supplement No. 1 to Part 774 - The Commerce Control List"
      },
      "breadcrumbs": [
        "List of Items Controlled"
      ],
      "ancestors": [],
      "text": "1B229 Water-hydrogen sulfide exchange tray columns and “internal contactors”, as follows (see List of Items Controlled).\nLicense Requirements\nReason for Control:\nNP, AT\nControl(s) Country Chart (See Supp. No. 1 to part 738) NP applies to entire entryNP Column 1 AT applies to entire entryAT Column 1\nControl(s)\nCountry Chart (See Supp. No. 1 to part 738)\nNP applies to entire entry\nNP Column 1\nAT applies to entire entry\nAT Column 1\nList Based License Exceptions (See Part 740 for a description of all license exceptions)\nLVS:\nN/A\nGBS:\nN/A\nList of Items Controlled\nRelated Controls:\n(1) Equipment “specially designed” or prepared for the production of heavy water is subject to the export licensing authority of the Nuclear Regulatory Commission (see 10 CFR part 110). (2) See ECCNs 1E001 (“development” and “production”) and 1E201 (“use”) for technology for items controlled by this entry.\nRelated Definitions:\nThe “internal contactors” controlled by 1B229.b are segmented trays that have an effective assembled diameter of 1.8 m (6 ft.) or greater, are designed to facilitate countercurrent contacting, and are constructed of stainless steels with a carbon content of 0.03% or less. These may be sieve trays, valve trays, bubble cap trays, or turbogrid trays.\nItems:\na. Water-hydrogen sulfide exchange tray columns, having all of the following characteristics:\n1B229.a\nCan operate at pressures of 2 MPa or greater;\na.1. Can operate at pressures of 2 MPa or greater;\nConstructed of carbon steel having an austenitic ASTM (or equivalent standard) grain size number of 5 or greater; and\na.2. Constructed of carbon steel having an austenitic ASTM (or equivalent standard) grain size number of 5 or greater; and\nWith a diameter of 1.8 m (6 ft.) or greater;\na.3. With a diameter of 1.8 m (6 ft.) or greater;\n“Internal contactors” for the water-hydrogen sulfide exchange tray columns controlled by 1B229.a.\nb. “Internal contactors” for the water-hydrogen sulfide exchange tray columns controlled by 1B229.a.",
      "structure": {
        "identifier": "1B229",
        "heading": "1B229 Water-hydrogen sulfide exchange tray columns and “internal contactors”, as follows (see List of Items Controlled).",
        "label": "1B229 – 1B229 Water-hydrogen sulfide exchange tray columns and “internal contactors”, as follows (see List of Items Controlled).",
        "content": [
          {
            "type": "text",
            "text": "License Requirements"
          },
          {
            "type": "text",
            "text": "Reason for Control:"
          },
          {
            "type": "text",
            "text": "NP, AT"
          },
          {
            "type": "html",
            "tag": "TABLE",
            "html": "<TABLE border=\"1\" cellpadding=\"1\" cellspacing=\"1\" class=\"gpotbl_table\" frame=\"void\" width=\"100%\"><TR><TH class=\"gpotbl_colhed\" scope=\"col\">Control(s)\n</TH><TH class=\"gpotbl_colhed\" scope=\"col\">Country Chart (See Supp. No. 1 to part 738)\n</TH></TR><TR><TD align=\"left\" class=\"gpotbl_cell\" scope=\"row\">NP applies to entire entry (1B229)</TD><TD align=\"left\" class=\"gpotbl_cell\">NP Column 1\n</TD></TR><TR><TD align=\"left\" class=\"gpotbl_cell\" scope=\"row\">AT applies to entire entry (1B229)</TD><TD align=\"left\" class=\"gpotbl_cell\">AT Column 1</TD></TR></TABLE>",
            "text": "Control(s) Country Chart (See Supp. No. 1 to part 738) NP applies to entire entryNP Column 1 AT applies to entire entryAT Column 1",
            "id": null
          },
          {
            "type": "text",
            "text": "Control(s)"
          },
          {
            "type": "text",
            "text": "Country Chart (See Supp. No. 1 to part 738)"
          },
          {
            "type": "text",
            "text": "NP applies to entire entry"
          },
          {
            "type": "text",
            "text": "NP Column 1"
          },
          {
            "type": "text",
            "text": "AT applies to entire entry"
          },
          {
            "type": "text",
            "text": "AT Column 1"
          },
          {
            "type": "text",
            "text": "List Based License Exceptions (See Part 740 for a description of all license exceptions)"
          },
          {
            "type": "text",
            "text": "LVS:"
          },
          {
            "type": "text",
            "text": "N/A"
          },
          {
            "type": "text",
            "text": "GBS:"
          },
          {
            "type": "text",
            "text": "N/A"
          },
          {
            "type": "text",
            "text": "List of Items Controlled"
          },
          {
            "type": "text",
            "text": "Related Controls:"
          },
          {
            "type": "text",
            "text": "(1) Equipment “specially designed” or prepared for the production of heavy water is subject to the export licensing authority of the Nuclear Regulatory Commission (see 10 CFR part 110). (2) See ECCNs 1E001 (“development” and “production”) and 1E201 (“use”) for technology for items controlled by this entry."
          },
          {
            "type": "text",
            "text": "Related Definitions:"
          },
          {
            "type": "text",
            "text": "The “internal contactors” controlled by 1B229.b are segmented trays that have an effective assembled diameter of 1.8 m (6 ft.) or greater, are designed to facilitate countercurrent contacting, and are constructed of stainless steels with a carbon content of 0.03% or less. These may be sieve trays, valve trays, bubble cap trays, or turbogrid trays."
          },
          {
            "type": "text",
            "text": "Items:"
          },
          {
            "type": "text",
            "text": "a. Water-hydrogen sulfide exchange tray columns, having all of the following characteristics:"
          }
        ],
        "children": [
          {
            "identifier": "1B229.a",
            "heading": null,
            "label": "1B229.a",
            "children": [
              {
                "identifier": "1B229.a.1",
                "heading": "Can operate at pressures of 2 MPa or greater;",
                "label": "1B229.a.1 – Can operate at pressures of 2 MPa or greater;",
                "content": [
                  {
                    "type": "html",
                    "tag": "P",
                    "html": "<P>a.1. Can operate at pressures of 2 MPa or greater;</P>",
                    "text": "a.1. Can operate at pressures of 2 MPa or greater;",
                    "id": null
                  }
                ],
                "isEccn": true,
                "boundToParent": true,
                "requireAllChildren": false
              },
              {
                "identifier": "1B229.a.2",
                "heading": "Constructed of carbon steel having an austenitic ASTM (or equivalent standard) grain size number of 5 or greater; and",
                "label": "1B229.a.2 – Constructed of carbon steel having an austenitic ASTM (or equivalent standard) grain size number of 5 or greater; and",
                "content": [
                  {
                    "type": "html",
                    "tag": "P",
                    "html": "<P>a.2. Constructed of carbon steel having an austenitic ASTM (or equivalent standard) grain size number of 5 or greater; <I>and</I></P>",
                    "text": "a.2. Constructed of carbon steel having an austenitic ASTM (or equivalent standard) grain size number of 5 or greater; and",
                    "id": null
                  }
                ],
                "isEccn": true,
                "boundToParent": true,
                "requireAllChildren": false
              },
              {
                "identifier": "1B229.a.3",
                "heading": "With a diameter of 1.8 m (6 ft.) or greater;",
                "label": "1B229.a.3 – With a diameter of 1.8 m (6 ft.) or greater;",
                "content": [
                  {
                    "type": "html",
                    "tag": "P",
                    "html": "<P>a.3. With a diameter of 1.8 m (6 ft.) or greater;</P>",
                    "text": "a.3. With a diameter of 1.8 m (6 ft.) or greater;",
                    "id": null
                  }
                ],
                "isEccn": true,
                "boundToParent": true,
                "requireAllChildren": false
              }
            ],
            "isEccn": true,
            "boundToParent": true,
            "requireAllChildren": false
          },
          {
            "identifier": "1B229.b",
            "heading": "“Internal contactors” for the water-hydrogen sulfide exchange tray columns controlled by 1B229.a.",
            "label": "1B229.b – “Internal contactors” for the water-hydrogen sulfide exchange tray columns controlled by 1B229.a.",
            "content": [
              {
                "type": "html",
                "tag": "P",
                "html": "<P>b. “Internal contactors” for the water-hydrogen sulfide exchange tray columns controlled by 1B229.a.</P>",
                "text": "b. “Internal contactors” for the water-hydrogen sulfide exchange tray columns controlled by 1B229.a.",
                "id": null
              }
            ],
            "isEccn": true,
            "boundToParent": true,
            "requireAllChildren": false
          }
        ],
        "isEccn": true,
        "boundToParent": false,
        "requireAllChildren": true
      }
    },
    {
      "version": "2021-09-20",
      "fetchedAt": "2025-10-02T20:33:38.383Z",
      "sourceUrl": "https://www.ecfr.gov/api/versioner/v1/full/2021-09-20/title-15?format=xml",
      "heading": "1B229 Water-hydrogen sulfide exchange tray columns and “internal contactors”, as follows (see List of Items Controlled).",
      "title": "Water-hydrogen sulfide exchange tray columns and “internal contactors”, as follows (see List of Items Controlled).",
      "category": "1",
      "group": "1B",
      "supplement": {
        "number": "1",
        "heading": "Supplement No. 1 to Part 774 - The Commerce Control List"
      },
      "breadcrumbs": [
        "List of Items Controlled"
      ],
      "ancestors": [],
      "text": "1B229 Water-hydrogen sulfide exchange tray columns and “internal contactors”, as follows (see List of Items Controlled).\nLicense Requirements\nReason for Control:\nNP, AT\nControl(s) Country Chart (See Supp. No. 1 to part 738) NP applies to entire entryNP Column 1 AT applies to entire entryAT Column 1\nControl(s)\nCountry Chart (See Supp. No. 1 to part 738)\nNP applies to entire entry\nNP Column 1\nAT applies to entire entry\nAT Column 1\nList Based License Exceptions (See Part 740 for a description of all license exceptions)\nLVS:\nN/A\nGBS:\nN/A\nList of Items Controlled\nRelated Controls:\n(1) Equipment “specially designed” or prepared for the production of heavy water is subject to the export licensing authority of the Nuclear Regulatory Commission (see 10 CFR part 110). (2) See ECCNs 1E001 (“development” and “production”) and 1E201 (“use”) for technology for items controlled by this entry.\nRelated Definitions:\nThe “internal contactors” controlled by 1B229.b are segmented trays that have an effective assembled diameter of 1.8 m (6 ft.) or greater, are designed to facilitate countercurrent contacting, and are constructed of stainless steels with a carbon content of 0.03% or less. These may be sieve trays, valve trays, bubble cap trays, or turbogrid trays.\nItems:\na. Water-hydrogen sulfide exchange tray columns, having all of the following characteristics:\n1B229.a\nCan operate at pressures of 2 MPa or greater;\na.1. Can operate at pressures of 2 MPa or greater;\nConstructed of carbon steel having an austenitic ASTM (or equivalent standard) grain size number of 5 or greater; and\na.2. Constructed of carbon steel having an austenitic ASTM (or equivalent standard) grain size number of 5 or greater; and\nWith a diameter of 1.8 m (6 ft.) or greater;\na.3. With a diameter of 1.8 m (6 ft.) or greater;\n“Internal contactors” for the water-hydrogen sulfide exchange tray columns controlled by 1B229.a.\nb. “Internal contactors” for the water-hydrogen sulfide exchange tray columns controlled by 1B229.a.",
      "structure": {
        "identifier": "1B229",
        "heading": "1B229 Water-hydrogen sulfide exchange tray columns and “internal contactors”, as follows (see List of Items Controlled).",
        "label": "1B229 – 1B229 Water-hydrogen sulfide exchange tray columns and “internal contactors”, as follows (see List of Items Controlled).",
        "content": [
          {
            "type": "text",
            "text": "License Requirements"
          },
          {
            "type": "text",
            "text": "Reason for Control:"
          },
          {
            "type": "text",
            "text": "NP, AT"
          },
          {
            "type": "html",
            "tag": "TABLE",
            "html": "<TABLE border=\"1\" cellpadding=\"1\" cellspacing=\"1\" class=\"gpotbl_table\" frame=\"void\" width=\"100%\"><TR><TH class=\"gpotbl_colhed\" scope=\"col\">Control(s)\n</TH><TH class=\"gpotbl_colhed\" scope=\"col\">Country Chart (See Supp. No. 1 to part 738)\n</TH></TR><TR><TD align=\"left\" class=\"gpotbl_cell\" scope=\"row\">NP applies to entire entry (1B229)</TD><TD align=\"left\" class=\"gpotbl_cell\">NP Column 1\n</TD></TR><TR><TD align=\"left\" class=\"gpotbl_cell\" scope=\"row\">AT applies to entire entry (1B229)</TD><TD align=\"left\" class=\"gpotbl_cell\">AT Column 1</TD></TR></TABLE>",
            "text": "Control(s) Country Chart (See Supp. No. 1 to part 738) NP applies to entire entryNP Column 1 AT applies to entire entryAT Column 1",
            "id": null
          },
          {
            "type": "text",
            "text": "Control(s)"
          },
          {
            "type": "text",
            "text": "Country Chart (See Supp. No. 1 to part 738)"
          },
          {
            "type": "text",
            "text": "NP applies to entire entry"
          },
          {
            "type": "text",
            "text": "NP Column 1"
          },
          {
            "type": "text",
            "text": "AT applies to entire entry"
          },
          {
            "type": "text",
            "text": "AT Column 1"
          },
          {
            "type": "text",
            "text": "List Based License Exceptions (See Part 740 for a description of all license exceptions)"
          },
          {
            "type": "text",
            "text": "LVS:"
          },
          {
            "type": "text",
            "text": "N/A"
          },
          {
            "type": "text",
            "text": "GBS:"
          },
          {
            "type": "text",
            "text": "N/A"
          },
          {
            "type": "text",
            "text": "List of Items Controlled"
          },
          {
            "type": "text",
            "text": "Related Controls:"
          },
          {
            "type": "text",
            "text": "(1) Equipment “specially designed” or prepared for the production of heavy water is subject to the export licensing authority of the Nuclear Regulatory Commission (see 10 CFR part 110). (2) See ECCNs 1E001 (“development” and “production”) and 1E201 (“use”) for technology for items controlled by this entry."
          },
          {
            "type": "text",
            "text": "Related Definitions:"
          },
          {
            "type": "text",
            "text": "The “internal contactors” controlled by 1B229.b are segmented trays that have an effective assembled diameter of 1.8 m (6 ft.) or greater, are designed to facilitate countercurrent contacting, and are constructed of stainless steels with a carbon content of 0.03% or less. These may be sieve trays, valve trays, bubble cap trays, or turbogrid trays."
          },
          {
            "type": "text",
            "text": "Items:"
          },
          {
            "type": "text",
            "text": "a. Water-hydrogen sulfide exchange tray columns, having all of the following characteristics:"
          }
        ],
        "children": [
          {
            "identifier": "1B229.a",
            "heading": null,
            "label": "1B229.a",
            "children": [
              {
                "identifier": "1B229.a.1",
                "heading": "Can operate at pressures of 2 MPa or greater;",
                "label": "1B229.a.1 – Can operate at pressures of 2 MPa or greater;",
                "content": [
                  {
                    "type": "html",
                    "tag": "P",
                    "html": "<P>a.1. Can operate at pressures of 2 MPa or greater;</P>",
                    "text": "a.1. Can operate at pressures of 2 MPa or greater;",
                    "id": null
                  }
                ],
                "isEccn": true,
                "boundToParent": true,
                "requireAllChildren": false
              },
              {
                "identifier": "1B229.a.2",
                "heading": "Constructed of carbon steel having an austenitic ASTM (or equivalent standard) grain size number of 5 or greater; and",
                "label": "1B229.a.2 – Constructed of carbon steel having an austenitic ASTM (or equivalent standard) grain size number of 5 or greater; and",
                "content": [
                  {
                    "type": "html",
                    "tag": "P",
                    "html": "<P>a.2. Constructed of carbon steel having an austenitic ASTM (or equivalent standard) grain size number of 5 or greater; <I>and</I></P>",
                    "text": "a.2. Constructed of carbon steel having an austenitic ASTM (or equivalent standard) grain size number of 5 or greater; and",
                    "id": null
                  }
                ],
                "isEccn": true,
                "boundToParent": true,
                "requireAllChildren": false
              },
              {
                "identifier": "1B229.a.3",
                "heading": "With a diameter of 1.8 m (6 ft.) or greater;",
                "label": "1B229.a.3 – With a diameter of 1.8 m (6 ft.) or greater;",
                "content": [
                  {
                    "type": "html",
                    "tag": "P",
                    "html": "<P>a.3. With a diameter of 1.8 m (6 ft.) or greater;</P>",
                    "text": "a.3. With a diameter of 1.8 m (6 ft.) or greater;",
                    "id": null
                  }
                ],
                "isEccn": true,
                "boundToParent": true,
                "requireAllChildren": false
              }
            ],
            "isEccn": true,
            "boundToParent": true,
            "requireAllChildren": false
          },
          {
            "identifier": "1B229.b",
            "heading": "“Internal contactors” for the water-hydrogen sulfide exchange tray columns controlled by 1B229.a.",
            "label": "1B229.b – “Internal contactors” for the water-hydrogen sulfide exchange tray columns controlled by 1B229.a.",
            "content": [
              {
                "type": "html",
                "tag": "P",
                "html": "<P>b. “Internal contactors” for the water-hydrogen sulfide exchange tray columns controlled by 1B229.a.</P>",
                "text": "b. “Internal contactors” for the water-hydrogen sulfide exchange tray columns controlled by 1B229.a.",
                "id": null
              }
            ],
            "isEccn": true,
            "boundToParent": true,
            "requireAllChildren": false
          }
        ],
        "isEccn": true,
        "boundToParent": false,
        "requireAllChildren": true
      }
    },
    {
      "version": "2021-10-05",
      "fetchedAt": "2025-10-02T20:33:38.778Z",
      "sourceUrl": "https://www.ecfr.gov/api/versioner/v1/full/2021-10-05/title-15?format=xml",
      "heading": "1B229 Water-hydrogen sulfide exchange tray columns and “internal contactors”, as follows (see List of Items Controlled).",
      "title": "Water-hydrogen sulfide exchange tray columns and “internal contactors”, as follows (see List of Items Controlled).",
      "category": "1",
      "group": "1B",
      "supplement": {
        "number": "1",
        "heading": "Supplement No. 1 to Part 774 - The Commerce Control List"
      },
      "breadcrumbs": [
        "List of Items Controlled"
      ],
      "ancestors": [],
      "text": "1B229 Water-hydrogen sulfide exchange tray columns and “internal contactors”, as follows (see List of Items Controlled).\nLicense Requirements\nReason for Control:\nNP, AT\nControl(s) Country Chart (See Supp. No. 1 to part 738) NP applies to entire entryNP Column 1 AT applies to entire entryAT Column 1\nControl(s)\nCountry Chart (See Supp. No. 1 to part 738)\nNP applies to entire entry\nNP Column 1\nAT applies to entire entry\nAT Column 1\nList Based License Exceptions (See Part 740 for a description of all license exceptions)\nLVS:\nN/A\nGBS:\nN/A\nList of Items Controlled\nRelated Controls:\n(1) Equipment “specially designed” or prepared for the production of heavy water is subject to the export licensing authority of the Nuclear Regulatory Commission (see 10 CFR part 110). (2) See ECCNs 1E001 (“development” and “production”) and 1E201 (“use”) for technology for items controlled by this entry.\nRelated Definitions:\nThe “internal contactors” controlled by 1B229.b are segmented trays that have an effective assembled diameter of 1.8 m (6 ft.) or greater, are designed to facilitate countercurrent contacting, and are constructed of stainless steels with a carbon content of 0.03% or less. These may be sieve trays, valve trays, bubble cap trays, or turbogrid trays.\nItems:\na. Water-hydrogen sulfide exchange tray columns, having all of the following characteristics:\n1B229.a\nCan operate at pressures of 2 MPa or greater;\na.1. Can operate at pressures of 2 MPa or greater;\nConstructed of carbon steel having an austenitic ASTM (or equivalent standard) grain size number of 5 or greater; and\na.2. Constructed of carbon steel having an austenitic ASTM (or equivalent standard) grain size number of 5 or greater; and\nWith a diameter of 1.8 m (6 ft.) or greater;\na.3. With a diameter of 1.8 m (6 ft.) or greater;\n“Internal contactors” for the water-hydrogen sulfide exchange tray columns controlled by 1B229.a.\nb. “Internal contactors” for the water-hydrogen sulfide exchange tray columns controlled by 1B229.a.",
      "structure": {
        "identifier": "1B229",
        "heading": "1B229 Water-hydrogen sulfide exchange tray columns and “internal contactors”, as follows (see List of Items Controlled).",
        "label": "1B229 – 1B229 Water-hydrogen sulfide exchange tray columns and “internal contactors”, as follows (see List of Items Controlled).",
        "content": [
          {
            "type": "text",
            "text": "License Requirements"
          },
          {
            "type": "text",
            "text": "Reason for Control:"
          },
          {
            "type": "text",
            "text": "NP, AT"
          },
          {
            "type": "html",
            "tag": "TABLE",
            "html": "<TABLE border=\"1\" cellpadding=\"1\" cellspacing=\"1\" class=\"gpotbl_table\" frame=\"void\" width=\"100%\"><TR><TH class=\"gpotbl_colhed\" scope=\"col\">Control(s)\n</TH><TH class=\"gpotbl_colhed\" scope=\"col\">Country Chart (See Supp. No. 1 to part 738)\n</TH></TR><TR><TD align=\"left\" class=\"gpotbl_cell\" scope=\"row\">NP applies to entire entry (1B229)</TD><TD align=\"left\" class=\"gpotbl_cell\">NP Column 1\n</TD></TR><TR><TD align=\"left\" class=\"gpotbl_cell\" scope=\"row\">AT applies to entire entry (1B229)</TD><TD align=\"left\" class=\"gpotbl_cell\">AT Column 1</TD></TR></TABLE>",
            "text": "Control(s) Country Chart (See Supp. No. 1 to part 738) NP applies to entire entryNP Column 1 AT applies to entire entryAT Column 1",
            "id": null
          },
          {
            "type": "text",
            "text": "Control(s)"
          },
          {
            "type": "text",
            "text": "Country Chart (See Supp. No. 1 to part 738)"
          },
          {
            "type": "text",
            "text": "NP applies to entire entry"
          },
          {
            "type": "text",
            "text": "NP Column 1"
          },
          {
            "type": "text",
            "text": "AT applies to entire entry"
          },
          {
            "type": "text",
            "text": "AT Column 1"
          },
          {
            "type": "text",
            "text": "List Based License Exceptions (See Part 740 for a description of all license exceptions)"
          },
          {
            "type": "text",
            "text": "LVS:"
          },
          {
            "type": "text",
            "text": "N/A"
          },
          {
            "type": "text",
            "text": "GBS:"
          },
          {
            "type": "text",
            "text": "N/A"
          },
          {
            "type": "text",
            "text": "List of Items Controlled"
          },
          {
            "type": "text",
            "text": "Related Controls:"
          },
          {
            "type": "text",
            "text": "(1) Equipment “specially designed” or prepared for the production of heavy water is subject to the export licensing authority of the Nuclear Regulatory Commission (see 10 CFR part 110). (2) See ECCNs 1E001 (“development” and “production”) and 1E201 (“use”) for technology for items controlled by this entry."
          },
          {
            "type": "text",
            "text": "Related Definitions:"
          },
          {
            "type": "text",
            "text": "The “internal contactors” controlled by 1B229.b are segmented trays that have an effective assembled diameter of 1.8 m (6 ft.) or greater, are designed to facilitate countercurrent contacting, and are constructed of stainless steels with a carbon content of 0.03% or less. These may be sieve trays, valve trays, bubble cap trays, or turbogrid trays."
          },
          {
            "type": "text",
            "text": "Items:"
          },
          {
            "type": "text",
            "text": "a. Water-hydrogen sulfide exchange tray columns, having all of the following characteristics:"
          }
        ],
        "children": [
          {
            "identifier": "1B229.a",
            "heading": null,
            "label": "1B229.a",
            "children": [
              {
                "identifier": "1B229.a.1",
                "heading": "Can operate at pressures of 2 MPa or greater;",
                "label": "1B229.a.1 – Can operate at pressures of 2 MPa or greater;",
                "content": [
                  {
                    "type": "html",
                    "tag": "P",
                    "html": "<P>a.1. Can operate at pressures of 2 MPa or greater;</P>",
                    "text": "a.1. Can operate at pressures of 2 MPa or greater;",
                    "id": null
                  }
                ],
                "isEccn": true,
                "boundToParent": true,
                "requireAllChildren": false
              },
              {
                "identifier": "1B229.a.2",
                "heading": "Constructed of carbon steel having an austenitic ASTM (or equivalent standard) grain size number of 5 or greater; and",
                "label": "1B229.a.2 – Constructed of carbon steel having an austenitic ASTM (or equivalent standard) grain size number of 5 or greater; and",
                "content": [
                  {
                    "type": "html",
                    "tag": "P",
                    "html": "<P>a.2. Constructed of carbon steel having an austenitic ASTM (or equivalent standard) grain size number of 5 or greater; <I>and</I></P>",
                    "text": "a.2. Constructed of carbon steel having an austenitic ASTM (or equivalent standard) grain size number of 5 or greater; and",
                    "id": null
                  }
                ],
                "isEccn": true,
                "boundToParent": true,
                "requireAllChildren": false
              },
              {
                "identifier": "1B229.a.3",
                "heading": "With a diameter of 1.8 m (6 ft.) or greater;",
                "label": "1B229.a.3 – With a diameter of 1.8 m (6 ft.) or greater;",
                "content": [
                  {
                    "type": "html",
                    "tag": "P",
                    "html": "<P>a.3. With a diameter of 1.8 m (6 ft.) or greater;</P>",
                    "text": "a.3. With a diameter of 1.8 m (6 ft.) or greater;",
                    "id": null
                  }
                ],
                "isEccn": true,
                "boundToParent": true,
                "requireAllChildren": false
              }
            ],
            "isEccn": true,
            "boundToParent": true,
            "requireAllChildren": false
          },
          {
            "identifier": "1B229.b",
            "heading": "“Internal contactors” for the water-hydrogen sulfide exchange tray columns controlled by 1B229.a.",
            "label": "1B229.b – “Internal contactors” for the water-hydrogen sulfide exchange tray columns controlled by 1B229.a.",
            "content": [
              {
                "type": "html",
                "tag": "P",
                "html": "<P>b. “Internal contactors” for the water-hydrogen sulfide exchange tray columns controlled by 1B229.a.</P>",
                "text": "b. “Internal contactors” for the water-hydrogen sulfide exchange tray columns controlled by 1B229.a.",
                "id": null
              }
            ],
            "isEccn": true,
            "boundToParent": true,
            "requireAllChildren": false
          }
        ],
        "isEccn": true,
        "boundToParent": false,
        "requireAllChildren": true
      }
    },
    {
      "version": "2021-12-06",
      "fetchedAt": "2025-10-02T20:33:39.172Z",
      "sourceUrl": "https://www.ecfr.gov/api/versioner/v1/full/2021-12-06/title-15?format=xml",
      "heading": "1B229 Water-hydrogen sulfide exchange tray columns and “internal contactors”, as follows (see List of Items Controlled).",
      "title": "Water-hydrogen sulfide exchange tray columns and “internal contactors”, as follows (see List of Items Controlled).",
      "category": "1",
      "group": "1B",
      "supplement": {
        "number": "1",
        "heading": "Supplement No. 1 to Part 774 - The Commerce Control List"
      },
      "breadcrumbs": [
        "List of Items Controlled"
      ],
      "ancestors": [],
      "text": "1B229 Water-hydrogen sulfide exchange tray columns and “internal contactors”, as follows (see List of Items Controlled).\nLicense Requirements\nReason for Control:\nNP, AT\nControl(s) Country Chart (See Supp. No. 1 to part 738) NP applies to entire entryNP Column 1 AT applies to entire entryAT Column 1\nControl(s)\nCountry Chart (See Supp. No. 1 to part 738)\nNP applies to entire entry\nNP Column 1\nAT applies to entire entry\nAT Column 1\nList Based License Exceptions (See Part 740 for a description of all license exceptions)\nLVS:\nN/A\nGBS:\nN/A\nList of Items Controlled\nRelated Controls:\n(1) Equipment “specially designed” or prepared for the production of heavy water is subject to the export licensing authority of the Nuclear Regulatory Commission (see 10 CFR part 110). (2) See ECCNs 1E001 (“development” and “production”) and 1E201 (“use”) for technology for items controlled by this entry.\nRelated Definitions:\nThe “internal contactors” controlled by 1B229.b are segmented trays that have an effective assembled diameter of 1.8 m (6 ft.) or greater, are designed to facilitate countercurrent contacting, and are constructed of stainless steels with a carbon content of 0.03% or less. These may be sieve trays, valve trays, bubble cap trays, or turbogrid trays.\nItems:\na. Water-hydrogen sulfide exchange tray columns, having all of the following characteristics:\n1B229.a\nCan operate at pressures of 2 MPa or greater;\na.1. Can operate at pressures of 2 MPa or greater;\nConstructed of carbon steel having an austenitic ASTM (or equivalent standard) grain size number of 5 or greater; and\na.2. Constructed of carbon steel having an austenitic ASTM (or equivalent standard) grain size number of 5 or greater; and\nWith a diameter of 1.8 m (6 ft.) or greater;\na.3. With a diameter of 1.8 m (6 ft.) or greater;\n“Internal contactors” for the water-hydrogen sulfide exchange tray columns controlled by 1B229.a.\nb. “Internal contactors” for the water-hydrogen sulfide exchange tray columns controlled by 1B229.a.",
      "structure": {
        "identifier": "1B229",
        "heading": "1B229 Water-hydrogen sulfide exchange tray columns and “internal contactors”, as follows (see List of Items Controlled).",
        "label": "1B229 – 1B229 Water-hydrogen sulfide exchange tray columns and “internal contactors”, as follows (see List of Items Controlled).",
        "content": [
          {
            "type": "text",
            "text": "License Requirements"
          },
          {
            "type": "text",
            "text": "Reason for Control:"
          },
          {
            "type": "text",
            "text": "NP, AT"
          },
          {
            "type": "html",
            "tag": "TABLE",
            "html": "<TABLE border=\"1\" cellpadding=\"1\" cellspacing=\"1\" class=\"gpotbl_table\" frame=\"void\" width=\"100%\"><TR><TH class=\"gpotbl_colhed\" scope=\"col\">Control(s)\n</TH><TH class=\"gpotbl_colhed\" scope=\"col\">Country Chart (See Supp. No. 1 to part 738)\n</TH></TR><TR><TD align=\"left\" class=\"gpotbl_cell\" scope=\"row\">NP applies to entire entry (1B229)</TD><TD align=\"left\" class=\"gpotbl_cell\">NP Column 1\n</TD></TR><TR><TD align=\"left\" class=\"gpotbl_cell\" scope=\"row\">AT applies to entire entry (1B229)</TD><TD align=\"left\" class=\"gpotbl_cell\">AT Column 1</TD></TR></TABLE>",
            "text": "Control(s) Country Chart (See Supp. No. 1 to part 738) NP applies to entire entryNP Column 1 AT applies to entire entryAT Column 1",
            "id": null
          },
          {
            "type": "text",
            "text": "Control(s)"
          },
          {
            "type": "text",
            "text": "Country Chart (See Supp. No. 1 to part 738)"
          },
          {
            "type": "text",
            "text": "NP applies to entire entry"
          },
          {
            "type": "text",
            "text": "NP Column 1"
          },
          {
            "type": "text",
            "text": "AT applies to entire entry"
          },
          {
            "type": "text",
            "text": "AT Column 1"
          },
          {
            "type": "text",
            "text": "List Based License Exceptions (See Part 740 for a description of all license exceptions)"
          },
          {
            "type": "text",
            "text": "LVS:"
          },
          {
            "type": "text",
            "text": "N/A"
          },
          {
            "type": "text",
            "text": "GBS:"
          },
          {
            "type": "text",
            "text": "N/A"
          },
          {
            "type": "text",
            "text": "List of Items Controlled"
          },
          {
            "type": "text",
            "text": "Related Controls:"
          },
          {
            "type": "text",
            "text": "(1) Equipment “specially designed” or prepared for the production of heavy water is subject to the export licensing authority of the Nuclear Regulatory Commission (see 10 CFR part 110). (2) See ECCNs 1E001 (“development” and “production”) and 1E201 (“use”) for technology for items controlled by this entry."
          },
          {
            "type": "text",
            "text": "Related Definitions:"
          },
          {
            "type": "text",
            "text": "The “internal contactors” controlled by 1B229.b are segmented trays that have an effective assembled diameter of 1.8 m (6 ft.) or greater, are designed to facilitate countercurrent contacting, and are constructed of stainless steels with a carbon content of 0.03% or less. These may be sieve trays, valve trays, bubble cap trays, or turbogrid trays."
          },
          {
            "type": "text",
            "text": "Items:"
          },
          {
            "type": "text",
            "text": "a. Water-hydrogen sulfide exchange tray columns, having all of the following characteristics:"
          }
        ],
        "children": [
          {
            "identifier": "1B229.a",
            "heading": null,
            "label": "1B229.a",
            "children": [
              {
                "identifier": "1B229.a.1",
                "heading": "Can operate at pressures of 2 MPa or greater;",
                "label": "1B229.a.1 – Can operate at pressures of 2 MPa or greater;",
                "content": [
                  {
                    "type": "html",
                    "tag": "P",
                    "html": "<P>a.1. Can operate at pressures of 2 MPa or greater;</P>",
                    "text": "a.1. Can operate at pressures of 2 MPa or greater;",
                    "id": null
                  }
                ],
                "isEccn": true,
                "boundToParent": true,
                "requireAllChildren": false
              },
              {
                "identifier": "1B229.a.2",
                "heading": "Constructed of carbon steel having an austenitic ASTM (or equivalent standard) grain size number of 5 or greater; and",
                "label": "1B229.a.2 – Constructed of carbon steel having an austenitic ASTM (or equivalent standard) grain size number of 5 or greater; and",
                "content": [
                  {
                    "type": "html",
                    "tag": "P",
                    "html": "<P>a.2. Constructed of carbon steel having an austenitic ASTM (or equivalent standard) grain size number of 5 or greater; <I>and</I></P>",
                    "text": "a.2. Constructed of carbon steel having an austenitic ASTM (or equivalent standard) grain size number of 5 or greater; and",
                    "id": null
                  }
                ],
                "isEccn": true,
                "boundToParent": true,
                "requireAllChildren": false
              },
              {
                "identifier": "1B229.a.3",
                "heading": "With a diameter of 1.8 m (6 ft.) or greater;",
                "label": "1B229.a.3 – With a diameter of 1.8 m (6 ft.) or greater;",
                "content": [
                  {
                    "type": "html",
                    "tag": "P",
                    "html": "<P>a.3. With a diameter of 1.8 m (6 ft.) or greater;</P>",
                    "text": "a.3. With a diameter of 1.8 m (6 ft.) or greater;",
                    "id": null
                  }
                ],
                "isEccn": true,
                "boundToParent": true,
                "requireAllChildren": false
              }
            ],
            "isEccn": true,
            "boundToParent": true,
            "requireAllChildren": false
          },
          {
            "identifier": "1B229.b",
            "heading": "“Internal contactors” for the water-hydrogen sulfide exchange tray columns controlled by 1B229.a.",
            "label": "1B229.b – “Internal contactors” for the water-hydrogen sulfide exchange tray columns controlled by 1B229.a.",
            "content": [
              {
                "type": "html",
                "tag": "P",
                "html": "<P>b. “Internal contactors” for the water-hydrogen sulfide exchange tray columns controlled by 1B229.a.</P>",
                "text": "b. “Internal contactors” for the water-hydrogen sulfide exchange tray columns controlled by 1B229.a.",
                "id": null
              }
            ],
            "isEccn": true,
            "boundToParent": true,
            "requireAllChildren": false
          }
        ],
        "isEccn": true,
        "boundToParent": false,
        "requireAllChildren": true
      }
    },
    {
      "version": "2022-01-06",
      "fetchedAt": "2025-10-02T20:33:39.613Z",
      "sourceUrl": "https://www.ecfr.gov/api/versioner/v1/full/2022-01-06/title-15?format=xml",
      "heading": "1B229 Water-hydrogen sulfide exchange tray columns and “internal contactors”, as follows (see List of Items Controlled).",
      "title": "Water-hydrogen sulfide exchange tray columns and “internal contactors”, as follows (see List of Items Controlled).",
      "category": "1",
      "group": "1B",
      "supplement": {
        "number": "1",
        "heading": "Supplement No. 1 to Part 774 - The Commerce Control List"
      },
      "breadcrumbs": [
        "List of Items Controlled"
      ],
      "ancestors": [],
      "text": "1B229 Water-hydrogen sulfide exchange tray columns and “internal contactors”, as follows (see List of Items Controlled).\nLicense Requirements\nReason for Control:\nNP, AT\nControl(s) Country Chart (See Supp. No. 1 to part 738) NP applies to entire entryNP Column 1 AT applies to entire entryAT Column 1\nControl(s)\nCountry Chart (See Supp. No. 1 to part 738)\nNP applies to entire entry\nNP Column 1\nAT applies to entire entry\nAT Column 1\nList Based License Exceptions (See Part 740 for a description of all license exceptions)\nLVS:\nN/A\nGBS:\nN/A\nList of Items Controlled\nRelated Controls:\n(1) Equipment “specially designed” or prepared for the production of heavy water is subject to the export licensing authority of the Nuclear Regulatory Commission (see 10 CFR part 110). (2) See ECCNs 1E001 (“development” and “production”) and 1E201 (“use”) for technology for items controlled by this entry.\nRelated Definitions:\nThe “internal contactors” controlled by 1B229.b are segmented trays that have an effective assembled diameter of 1.8 m (6 ft.) or greater, are designed to facilitate countercurrent contacting, and are constructed of stainless steels with a carbon content of 0.03% or less. These may be sieve trays, valve trays, bubble cap trays, or turbogrid trays.\nItems:\na. Water-hydrogen sulfide exchange tray columns, having all of the following characteristics:\n1B229.a\nCan operate at pressures of 2 MPa or greater;\na.1. Can operate at pressures of 2 MPa or greater;\nConstructed of carbon steel having an austenitic ASTM (or equivalent standard) grain size number of 5 or greater; and\na.2. Constructed of carbon steel having an austenitic ASTM (or equivalent standard) grain size number of 5 or greater; and\nWith a diameter of 1.8 m (6 ft.) or greater;\na.3. With a diameter of 1.8 m (6 ft.) or greater;\n“Internal contactors” for the water-hydrogen sulfide exchange tray columns controlled by 1B229.a.\nb. “Internal contactors” for the water-hydrogen sulfide exchange tray columns controlled by 1B229.a.",
      "structure": {
        "identifier": "1B229",
        "heading": "1B229 Water-hydrogen sulfide exchange tray columns and “internal contactors”, as follows (see List of Items Controlled).",
        "label": "1B229 – 1B229 Water-hydrogen sulfide exchange tray columns and “internal contactors”, as follows (see List of Items Controlled).",
        "content": [
          {
            "type": "text",
            "text": "License Requirements"
          },
          {
            "type": "text",
            "text": "Reason for Control:"
          },
          {
            "type": "text",
            "text": "NP, AT"
          },
          {
            "type": "html",
            "tag": "TABLE",
            "html": "<TABLE border=\"1\" cellpadding=\"1\" cellspacing=\"1\" class=\"gpotbl_table\" frame=\"void\" width=\"100%\"><TR><TH class=\"gpotbl_colhed\" scope=\"col\">Control(s)\n</TH><TH class=\"gpotbl_colhed\" scope=\"col\">Country Chart (See Supp. No. 1 to part 738)\n</TH></TR><TR><TD align=\"left\" class=\"gpotbl_cell\" scope=\"row\">NP applies to entire entry (1B229)</TD><TD align=\"left\" class=\"gpotbl_cell\">NP Column 1\n</TD></TR><TR><TD align=\"left\" class=\"gpotbl_cell\" scope=\"row\">AT applies to entire entry (1B229)</TD><TD align=\"left\" class=\"gpotbl_cell\">AT Column 1</TD></TR></TABLE>",
            "text": "Control(s) Country Chart (See Supp. No. 1 to part 738) NP applies to entire entryNP Column 1 AT applies to entire entryAT Column 1",
            "id": null
          },
          {
            "type": "text",
            "text": "Control(s)"
          },
          {
            "type": "text",
            "text": "Country Chart (See Supp. No. 1 to part 738)"
          },
          {
            "type": "text",
            "text": "NP applies to entire entry"
          },
          {
            "type": "text",
            "text": "NP Column 1"
          },
          {
            "type": "text",
            "text": "AT applies to entire entry"
          },
          {
            "type": "text",
            "text": "AT Column 1"
          },
          {
            "type": "text",
            "text": "List Based License Exceptions (See Part 740 for a description of all license exceptions)"
          },
          {
            "type": "text",
            "text": "LVS:"
          },
          {
            "type": "text",
            "text": "N/A"
          },
          {
            "type": "text",
            "text": "GBS:"
          },
          {
            "type": "text",
            "text": "N/A"
          },
          {
            "type": "text",
            "text": "List of Items Controlled"
          },
          {
            "type": "text",
            "text": "Related Controls:"
          },
          {
            "type": "text",
            "text": "(1) Equipment “specially designed” or prepared for the production of heavy water is subject to the export licensing authority of the Nuclear Regulatory Commission (see 10 CFR part 110). (2) See ECCNs 1E001 (“development” and “production”) and 1E201 (“use”) for technology for items controlled by this entry."
          },
          {
            "type": "text",
            "text": "Related Definitions:"
          },
          {
            "type": "text",
            "text": "The “internal contactors” controlled by 1B229.b are segmented trays that have an effective assembled diameter of 1.8 m (6 ft.) or greater, are designed to facilitate countercurrent contacting, and are constructed of stainless steels with a carbon content of 0.03% or less. These may be sieve trays, valve trays, bubble cap trays, or turbogrid trays."
          },
          {
            "type": "text",
            "text": "Items:"
          },
          {
            "type": "text",
            "text": "a. Water-hydrogen sulfide exchange tray columns, having all of the following characteristics:"
          }
        ],
        "children": [
          {
            "identifier": "1B229.a",
            "heading": null,
            "label": "1B229.a",
            "children": [
              {
                "identifier": "1B229.a.1",
                "heading": "Can operate at pressures of 2 MPa or greater;",
                "label": "1B229.a.1 – Can operate at pressures of 2 MPa or greater;",
                "content": [
                  {
                    "type": "html",
                    "tag": "P",
                    "html": "<P>a.1. Can operate at pressures of 2 MPa or greater;</P>",
                    "text": "a.1. Can operate at pressures of 2 MPa or greater;",
                    "id": null
                  }
                ],
                "isEccn": true,
                "boundToParent": true,
                "requireAllChildren": false
              },
              {
                "identifier": "1B229.a.2",
                "heading": "Constructed of carbon steel having an austenitic ASTM (or equivalent standard) grain size number of 5 or greater; and",
                "label": "1B229.a.2 – Constructed of carbon steel having an austenitic ASTM (or equivalent standard) grain size number of 5 or greater; and",
                "content": [
                  {
                    "type": "html",
                    "tag": "P",
                    "html": "<P>a.2. Constructed of carbon steel having an austenitic ASTM (or equivalent standard) grain size number of 5 or greater; <I>and</I></P>",
                    "text": "a.2. Constructed of carbon steel having an austenitic ASTM (or equivalent standard) grain size number of 5 or greater; and",
                    "id": null
                  }
                ],
                "isEccn": true,
                "boundToParent": true,
                "requireAllChildren": false
              },
              {
                "identifier": "1B229.a.3",
                "heading": "With a diameter of 1.8 m (6 ft.) or greater;",
                "label": "1B229.a.3 – With a diameter of 1.8 m (6 ft.) or greater;",
                "content": [
                  {
                    "type": "html",
                    "tag": "P",
                    "html": "<P>a.3. With a diameter of 1.8 m (6 ft.) or greater;</P>",
                    "text": "a.3. With a diameter of 1.8 m (6 ft.) or greater;",
                    "id": null
                  }
                ],
                "isEccn": true,
                "boundToParent": true,
                "requireAllChildren": false
              }
            ],
            "isEccn": true,
            "boundToParent": true,
            "requireAllChildren": false
          },
          {
            "identifier": "1B229.b",
            "heading": "“Internal contactors” for the water-hydrogen sulfide exchange tray columns controlled by 1B229.a.",
            "label": "1B229.b – “Internal contactors” for the water-hydrogen sulfide exchange tray columns controlled by 1B229.a.",
            "content": [
              {
                "type": "html",
                "tag": "P",
                "html": "<P>b. “Internal contactors” for the water-hydrogen sulfide exchange tray columns controlled by 1B229.a.</P>",
                "text": "b. “Internal contactors” for the water-hydrogen sulfide exchange tray columns controlled by 1B229.a.",
                "id": null
              }
            ],
            "isEccn": true,
            "boundToParent": true,
            "requireAllChildren": false
          }
        ],
        "isEccn": true,
        "boundToParent": false,
        "requireAllChildren": true
      }
    },
    {
      "version": "2022-01-19",
      "fetchedAt": "2025-10-02T20:33:40.017Z",
      "sourceUrl": "https://www.ecfr.gov/api/versioner/v1/full/2022-01-19/title-15?format=xml",
      "heading": "1B229 Water-hydrogen sulfide exchange tray columns and “internal contactors”, as follows (see List of Items Controlled).",
      "title": "Water-hydrogen sulfide exchange tray columns and “internal contactors”, as follows (see List of Items Controlled).",
      "category": "1",
      "group": "1B",
      "supplement": {
        "number": "1",
        "heading": "Supplement No. 1 to Part 774 - The Commerce Control List"
      },
      "breadcrumbs": [
        "List of Items Controlled"
      ],
      "ancestors": [],
      "text": "1B229 Water-hydrogen sulfide exchange tray columns and “internal contactors”, as follows (see List of Items Controlled).\nLicense Requirements\nReason for Control:\nNP, AT\nControl(s) Country Chart (See Supp. No. 1 to part 738) NP applies to entire entryNP Column 1 AT applies to entire entryAT Column 1\nControl(s)\nCountry Chart (See Supp. No. 1 to part 738)\nNP applies to entire entry\nNP Column 1\nAT applies to entire entry\nAT Column 1\nList Based License Exceptions (See Part 740 for a description of all license exceptions)\nLVS:\nN/A\nGBS:\nN/A\nList of Items Controlled\nRelated Controls:\n(1) Equipment “specially designed” or prepared for the production of heavy water is subject to the export licensing authority of the Nuclear Regulatory Commission (see 10 CFR part 110). (2) See ECCNs 1E001 (“development” and “production”) and 1E201 (“use”) for technology for items controlled by this entry.\nRelated Definitions:\nThe “internal contactors” controlled by 1B229.b are segmented trays that have an effective assembled diameter of 1.8 m (6 ft.) or greater, are designed to facilitate countercurrent contacting, and are constructed of stainless steels with a carbon content of 0.03% or less. These may be sieve trays, valve trays, bubble cap trays, or turbogrid trays.\nItems:\na. Water-hydrogen sulfide exchange tray columns, having all of the following characteristics:\n1B229.a\nCan operate at pressures of 2 MPa or greater;\na.1. Can operate at pressures of 2 MPa or greater;\nConstructed of carbon steel having an austenitic ASTM (or equivalent standard) grain size number of 5 or greater; and\na.2. Constructed of carbon steel having an austenitic ASTM (or equivalent standard) grain size number of 5 or greater; and\nWith a diameter of 1.8 m (6 ft.) or greater;\na.3. With a diameter of 1.8 m (6 ft.) or greater;\n“Internal contactors” for the water-hydrogen sulfide exchange tray columns controlled by 1B229.a.\nb. “Internal contactors” for the water-hydrogen sulfide exchange tray columns controlled by 1B229.a.",
      "structure": {
        "identifier": "1B229",
        "heading": "1B229 Water-hydrogen sulfide exchange tray columns and “internal contactors”, as follows (see List of Items Controlled).",
        "label": "1B229 – 1B229 Water-hydrogen sulfide exchange tray columns and “internal contactors”, as follows (see List of Items Controlled).",
        "content": [
          {
            "type": "text",
            "text": "License Requirements"
          },
          {
            "type": "text",
            "text": "Reason for Control:"
          },
          {
            "type": "text",
            "text": "NP, AT"
          },
          {
            "type": "html",
            "tag": "TABLE",
            "html": "<TABLE border=\"1\" cellpadding=\"1\" cellspacing=\"1\" class=\"gpotbl_table\" frame=\"void\" width=\"100%\"><TR><TH class=\"gpotbl_colhed\" scope=\"col\">Control(s)\n</TH><TH class=\"gpotbl_colhed\" scope=\"col\">Country Chart (See Supp. No. 1 to part 738)\n</TH></TR><TR><TD align=\"left\" class=\"gpotbl_cell\" scope=\"row\">NP applies to entire entry (1B229)</TD><TD align=\"left\" class=\"gpotbl_cell\">NP Column 1\n</TD></TR><TR><TD align=\"left\" class=\"gpotbl_cell\" scope=\"row\">AT applies to entire entry (1B229)</TD><TD align=\"left\" class=\"gpotbl_cell\">AT Column 1</TD></TR></TABLE>",
            "text": "Control(s) Country Chart (See Supp. No. 1 to part 738) NP applies to entire entryNP Column 1 AT applies to entire entryAT Column 1",
            "id": null
          },
          {
            "type": "text",
            "text": "Control(s)"
          },
          {
            "type": "text",
            "text": "Country Chart (See Supp. No. 1 to part 738)"
          },
          {
            "type": "text",
            "text": "NP applies to entire entry"
          },
          {
            "type": "text",
            "text": "NP Column 1"
          },
          {
            "type": "text",
            "text": "AT applies to entire entry"
          },
          {
            "type": "text",
            "text": "AT Column 1"
          },
          {
            "type": "text",
            "text": "List Based License Exceptions (See Part 740 for a description of all license exceptions)"
          },
          {
            "type": "text",
            "text": "LVS:"
          },
          {
            "type": "text",
            "text": "N/A"
          },
          {
            "type": "text",
            "text": "GBS:"
          },
          {
            "type": "text",
            "text": "N/A"
          },
          {
            "type": "text",
            "text": "List of Items Controlled"
          },
          {
            "type": "text",
            "text": "Related Controls:"
          },
          {
            "type": "text",
            "text": "(1) Equipment “specially designed” or prepared for the production of heavy water is subject to the export licensing authority of the Nuclear Regulatory Commission (see 10 CFR part 110). (2) See ECCNs 1E001 (“development” and “production”) and 1E201 (“use”) for technology for items controlled by this entry."
          },
          {
            "type": "text",
            "text": "Related Definitions:"
          },
          {
            "type": "text",
            "text": "The “internal contactors” controlled by 1B229.b are segmented trays that have an effective assembled diameter of 1.8 m (6 ft.) or greater, are designed to facilitate countercurrent contacting, and are constructed of stainless steels with a carbon content of 0.03% or less. These may be sieve trays, valve trays, bubble cap trays, or turbogrid trays."
          },
          {
            "type": "text",
            "text": "Items:"
          },
          {
            "type": "text",
            "text": "a. Water-hydrogen sulfide exchange tray columns, having all of the following characteristics:"
          }
        ],
        "children": [
          {
            "identifier": "1B229.a",
            "heading": null,
            "label": "1B229.a",
            "children": [
              {
                "identifier": "1B229.a.1",
                "heading": "Can operate at pressures of 2 MPa or greater;",
                "label": "1B229.a.1 – Can operate at pressures of 2 MPa or greater;",
                "content": [
                  {
                    "type": "html",
                    "tag": "P",
                    "html": "<P>a.1. Can operate at pressures of 2 MPa or greater;</P>",
                    "text": "a.1. Can operate at pressures of 2 MPa or greater;",
                    "id": null
                  }
                ],
                "isEccn": true,
                "boundToParent": true,
                "requireAllChildren": false
              },
              {
                "identifier": "1B229.a.2",
                "heading": "Constructed of carbon steel having an austenitic ASTM (or equivalent standard) grain size number of 5 or greater; and",
                "label": "1B229.a.2 – Constructed of carbon steel having an austenitic ASTM (or equivalent standard) grain size number of 5 or greater; and",
                "content": [
                  {
                    "type": "html",
                    "tag": "P",
                    "html": "<P>a.2. Constructed of carbon steel having an austenitic ASTM (or equivalent standard) grain size number of 5 or greater; <I>and</I></P>",
                    "text": "a.2. Constructed of carbon steel having an austenitic ASTM (or equivalent standard) grain size number of 5 or greater; and",
                    "id": null
                  }
                ],
                "isEccn": true,
                "boundToParent": true,
                "requireAllChildren": false
              },
              {
                "identifier": "1B229.a.3",
                "heading": "With a diameter of 1.8 m (6 ft.) or greater;",
                "label": "1B229.a.3 – With a diameter of 1.8 m (6 ft.) or greater;",
                "content": [
                  {
                    "type": "html",
                    "tag": "P",
                    "html": "<P>a.3. With a diameter of 1.8 m (6 ft.) or greater;</P>",
                    "text": "a.3. With a diameter of 1.8 m (6 ft.) or greater;",
                    "id": null
                  }
                ],
                "isEccn": true,
                "boundToParent": true,
                "requireAllChildren": false
              }
            ],
            "isEccn": true,
            "boundToParent": true,
            "requireAllChildren": false
          },
          {
            "identifier": "1B229.b",
            "heading": "“Internal contactors” for the water-hydrogen sulfide exchange tray columns controlled by 1B229.a.",
            "label": "1B229.b – “Internal contactors” for the water-hydrogen sulfide exchange tray columns controlled by 1B229.a.",
            "content": [
              {
                "type": "html",
                "tag": "P",
                "html": "<P>b. “Internal contactors” for the water-hydrogen sulfide exchange tray columns controlled by 1B229.a.</P>",
                "text": "b. “Internal contactors” for the water-hydrogen sulfide exchange tray columns controlled by 1B229.a.",
                "id": null
              }
            ],
            "isEccn": true,
            "boundToParent": true,
            "requireAllChildren": false
          }
        ],
        "isEccn": true,
        "boundToParent": false,
        "requireAllChildren": true
      }
    },
    {
      "version": "2022-02-03",
      "fetchedAt": "2025-10-02T20:33:40.404Z",
      "sourceUrl": "https://www.ecfr.gov/api/versioner/v1/full/2022-02-03/title-15?format=xml",
      "heading": "1B229 Water-hydrogen sulfide exchange tray columns and “internal contactors”, as follows (see List of Items Controlled).",
      "title": "Water-hydrogen sulfide exchange tray columns and “internal contactors”, as follows (see List of Items Controlled).",
      "category": "1",
      "group": "1B",
      "supplement": {
        "number": "1",
        "heading": "Supplement No. 1 to Part 774 - The Commerce Control List"
      },
      "breadcrumbs": [
        "List of Items Controlled"
      ],
      "ancestors": [],
      "text": "1B229 Water-hydrogen sulfide exchange tray columns and “internal contactors”, as follows (see List of Items Controlled).\nLicense Requirements\nReason for Control:\nNP, AT\nControl(s) Country Chart (See Supp. No. 1 to part 738) NP applies to entire entryNP Column 1 AT applies to entire entryAT Column 1\nControl(s)\nCountry Chart (See Supp. No. 1 to part 738)\nNP applies to entire entry\nNP Column 1\nAT applies to entire entry\nAT Column 1\nList Based License Exceptions (See Part 740 for a description of all license exceptions)\nLVS:\nN/A\nGBS:\nN/A\nList of Items Controlled\nRelated Controls:\n(1) Equipment “specially designed” or prepared for the production of heavy water is subject to the export licensing authority of the Nuclear Regulatory Commission (see 10 CFR part 110). (2) See ECCNs 1E001 (“development” and “production”) and 1E201 (“use”) for technology for items controlled by this entry.\nRelated Definitions:\nThe “internal contactors” controlled by 1B229.b are segmented trays that have an effective assembled diameter of 1.8 m (6 ft.) or greater, are designed to facilitate countercurrent contacting, and are constructed of stainless steels with a carbon content of 0.03% or less. These may be sieve trays, valve trays, bubble cap trays, or turbogrid trays.\nItems:\na. Water-hydrogen sulfide exchange tray columns, having all of the following characteristics:\n1B229.a\nCan operate at pressures of 2 MPa or greater;\na.1. Can operate at pressures of 2 MPa or greater;\nConstructed of carbon steel having an austenitic ASTM (or equivalent standard) grain size number of 5 or greater; and\na.2. Constructed of carbon steel having an austenitic ASTM (or equivalent standard) grain size number of 5 or greater; and\nWith a diameter of 1.8 m (6 ft.) or greater;\na.3. With a diameter of 1.8 m (6 ft.) or greater;\n“Internal contactors” for the water-hydrogen sulfide exchange tray columns controlled by 1B229.a.\nb. “Internal contactors” for the water-hydrogen sulfide exchange tray columns controlled by 1B229.a.",
      "structure": {
        "identifier": "1B229",
        "heading": "1B229 Water-hydrogen sulfide exchange tray columns and “internal contactors”, as follows (see List of Items Controlled).",
        "label": "1B229 – 1B229 Water-hydrogen sulfide exchange tray columns and “internal contactors”, as follows (see List of Items Controlled).",
        "content": [
          {
            "type": "text",
            "text": "License Requirements"
          },
          {
            "type": "text",
            "text": "Reason for Control:"
          },
          {
            "type": "text",
            "text": "NP, AT"
          },
          {
            "type": "html",
            "tag": "TABLE",
            "html": "<TABLE border=\"1\" cellpadding=\"1\" cellspacing=\"1\" class=\"gpotbl_table\" frame=\"void\" width=\"100%\"><TR><TH class=\"gpotbl_colhed\" scope=\"col\">Control(s)\n</TH><TH class=\"gpotbl_colhed\" scope=\"col\">Country Chart (See Supp. No. 1 to part 738)\n</TH></TR><TR><TD align=\"left\" class=\"gpotbl_cell\" scope=\"row\">NP applies to entire entry (1B229)</TD><TD align=\"left\" class=\"gpotbl_cell\">NP Column 1\n</TD></TR><TR><TD align=\"left\" class=\"gpotbl_cell\" scope=\"row\">AT applies to entire entry (1B229)</TD><TD align=\"left\" class=\"gpotbl_cell\">AT Column 1</TD></TR></TABLE>",
            "text": "Control(s) Country Chart (See Supp. No. 1 to part 738) NP applies to entire entryNP Column 1 AT applies to entire entryAT Column 1",
            "id": null
          },
          {
            "type": "text",
            "text": "Control(s)"
          },
          {
            "type": "text",
            "text": "Country Chart (See Supp. No. 1 to part 738)"
          },
          {
            "type": "text",
            "text": "NP applies to entire entry"
          },
          {
            "type": "text",
            "text": "NP Column 1"
          },
          {
            "type": "text",
            "text": "AT applies to entire entry"
          },
          {
            "type": "text",
            "text": "AT Column 1"
          },
          {
            "type": "text",
            "text": "List Based License Exceptions (See Part 740 for a description of all license exceptions)"
          },
          {
            "type": "text",
            "text": "LVS:"
          },
          {
            "type": "text",
            "text": "N/A"
          },
          {
            "type": "text",
            "text": "GBS:"
          },
          {
            "type": "text",
            "text": "N/A"
          },
          {
            "type": "text",
            "text": "List of Items Controlled"
          },
          {
            "type": "text",
            "text": "Related Controls:"
          },
          {
            "type": "text",
            "text": "(1) Equipment “specially designed” or prepared for the production of heavy water is subject to the export licensing authority of the Nuclear Regulatory Commission (see 10 CFR part 110). (2) See ECCNs 1E001 (“development” and “production”) and 1E201 (“use”) for technology for items controlled by this entry."
          },
          {
            "type": "text",
            "text": "Related Definitions:"
          },
          {
            "type": "text",
            "text": "The “internal contactors” controlled by 1B229.b are segmented trays that have an effective assembled diameter of 1.8 m (6 ft.) or greater, are designed to facilitate countercurrent contacting, and are constructed of stainless steels with a carbon content of 0.03% or less. These may be sieve trays, valve trays, bubble cap trays, or turbogrid trays."
          },
          {
            "type": "text",
            "text": "Items:"
          },
          {
            "type": "text",
            "text": "a. Water-hydrogen sulfide exchange tray columns, having all of the following characteristics:"
          }
        ],
        "children": [
          {
            "identifier": "1B229.a",
            "heading": null,
            "label": "1B229.a",
            "children": [
              {
                "identifier": "1B229.a.1",
                "heading": "Can operate at pressures of 2 MPa or greater;",
                "label": "1B229.a.1 – Can operate at pressures of 2 MPa or greater;",
                "content": [
                  {
                    "type": "html",
                    "tag": "P",
                    "html": "<P>a.1. Can operate at pressures of 2 MPa or greater;</P>",
                    "text": "a.1. Can operate at pressures of 2 MPa or greater;",
                    "id": null
                  }
                ],
                "isEccn": true,
                "boundToParent": true,
                "requireAllChildren": false
              },
              {
                "identifier": "1B229.a.2",
                "heading": "Constructed of carbon steel having an austenitic ASTM (or equivalent standard) grain size number of 5 or greater; and",
                "label": "1B229.a.2 – Constructed of carbon steel having an austenitic ASTM (or equivalent standard) grain size number of 5 or greater; and",
                "content": [
                  {
                    "type": "html",
                    "tag": "P",
                    "html": "<P>a.2. Constructed of carbon steel having an austenitic ASTM (or equivalent standard) grain size number of 5 or greater; <I>and</I></P>",
                    "text": "a.2. Constructed of carbon steel having an austenitic ASTM (or equivalent standard) grain size number of 5 or greater; and",
                    "id": null
                  }
                ],
                "isEccn": true,
                "boundToParent": true,
                "requireAllChildren": false
              },
              {
                "identifier": "1B229.a.3",
                "heading": "With a diameter of 1.8 m (6 ft.) or greater;",
                "label": "1B229.a.3 – With a diameter of 1.8 m (6 ft.) or greater;",
                "content": [
                  {
                    "type": "html",
                    "tag": "P",
                    "html": "<P>a.3. With a diameter of 1.8 m (6 ft.) or greater;</P>",
                    "text": "a.3. With a diameter of 1.8 m (6 ft.) or greater;",
                    "id": null
                  }
                ],
                "isEccn": true,
                "boundToParent": true,
                "requireAllChildren": false
              }
            ],
            "isEccn": true,
            "boundToParent": true,
            "requireAllChildren": false
          },
          {
            "identifier": "1B229.b",
            "heading": "“Internal contactors” for the water-hydrogen sulfide exchange tray columns controlled by 1B229.a.",
            "label": "1B229.b – “Internal contactors” for the water-hydrogen sulfide exchange tray columns controlled by 1B229.a.",
            "content": [
              {
                "type": "html",
                "tag": "P",
                "html": "<P>b. “Internal contactors” for the water-hydrogen sulfide exchange tray columns controlled by 1B229.a.</P>",
                "text": "b. “Internal contactors” for the water-hydrogen sulfide exchange tray columns controlled by 1B229.a.",
                "id": null
              }
            ],
            "isEccn": true,
            "boundToParent": true,
            "requireAllChildren": false
          }
        ],
        "isEccn": true,
        "boundToParent": false,
        "requireAllChildren": true
      }
    },
    {
      "version": "2022-05-26",
      "fetchedAt": "2025-10-02T20:33:40.828Z",
      "sourceUrl": "https://www.ecfr.gov/api/versioner/v1/full/2022-05-26/title-15?format=xml",
      "heading": "1B229 Water-hydrogen sulfide exchange tray columns and “internal contactors”, as follows (see List of Items Controlled).",
      "title": "Water-hydrogen sulfide exchange tray columns and “internal contactors”, as follows (see List of Items Controlled).",
      "category": "1",
      "group": "1B",
      "supplement": {
        "number": "1",
        "heading": "Supplement No. 1 to Part 774 - The Commerce Control List"
      },
      "breadcrumbs": [
        "B. “Test”, “Inspection” and “Production Equipment”"
      ],
      "ancestors": [],
      "text": "1B229 Water-hydrogen sulfide exchange tray columns and “internal contactors”, as follows (see List of Items Controlled).\nLicense Requirements\nReason for Control:\nNP, AT\nControl(s) Country Chart (See Supp. No. 1 to part 738) NP applies to entire entryNP Column 1 AT applies to entire entryAT Column 1\nControl(s)\nCountry Chart (See Supp. No. 1 to part 738)\nNP applies to entire entry\nNP Column 1\nAT applies to entire entry\nAT Column 1\nList Based License Exceptions (See Part 740 for a description of all license exceptions)\nLVS:\nN/A\nGBS:\nN/A\nList of Items Controlled\nRelated Controls:\n(1) Equipment “specially designed” or prepared for the production of heavy water is subject to the export licensing authority of the Nuclear Regulatory Commission (see 10 CFR part 110). (2) See ECCNs 1E001 (“development” and “production”) and 1E201 (“use”) for technology for items controlled by this entry.\nRelated Definitions:\nThe “internal contactors” controlled by 1B229.b are segmented trays that have an effective assembled diameter of 1.8 m (6 ft.) or greater, are designed to facilitate countercurrent contacting, and are constructed of stainless steels with a carbon content of 0.03% or less. These may be sieve trays, valve trays, bubble cap trays, or turbogrid trays.\nItems:\na. Water-hydrogen sulfide exchange tray columns, having all of the following characteristics:\n1B229.a\nCan operate at pressures of 2 MPa or greater;\na.1. Can operate at pressures of 2 MPa or greater;\nConstructed of carbon steel having an austenitic ASTM (or equivalent standard) grain size number of 5 or greater; and\na.2. Constructed of carbon steel having an austenitic ASTM (or equivalent standard) grain size number of 5 or greater; and\nWith a diameter of 1.8 m (6 ft.) or greater;\na.3. With a diameter of 1.8 m (6 ft.) or greater;\n“Internal contactors” for the water-hydrogen sulfide exchange tray columns controlled by 1B229.a.\nb. “Internal contactors” for the water-hydrogen sulfide exchange tray columns controlled by 1B229.a.",
      "structure": {
        "identifier": "1B229",
        "heading": "1B229 Water-hydrogen sulfide exchange tray columns and “internal contactors”, as follows (see List of Items Controlled).",
        "label": "1B229 – 1B229 Water-hydrogen sulfide exchange tray columns and “internal contactors”, as follows (see List of Items Controlled).",
        "content": [
          {
            "type": "text",
            "text": "License Requirements"
          },
          {
            "type": "text",
            "text": "Reason for Control:"
          },
          {
            "type": "text",
            "text": "NP, AT"
          },
          {
            "type": "html",
            "tag": "TABLE",
            "html": "<TABLE border=\"1\" cellpadding=\"1\" cellspacing=\"1\" class=\"gpotbl_table\" frame=\"void\" width=\"100%\"><TR><TH class=\"gpotbl_colhed\" scope=\"col\">Control(s)\n</TH><TH class=\"gpotbl_colhed\" scope=\"col\">Country Chart (See Supp. No. 1 to part 738)\n</TH></TR><TR><TD align=\"left\" class=\"gpotbl_cell\" scope=\"row\">NP applies to entire entry (1B229)</TD><TD align=\"left\" class=\"gpotbl_cell\">NP Column 1\n</TD></TR><TR><TD align=\"left\" class=\"gpotbl_cell\" scope=\"row\">AT applies to entire entry (1B229)</TD><TD align=\"left\" class=\"gpotbl_cell\">AT Column 1</TD></TR></TABLE>",
            "text": "Control(s) Country Chart (See Supp. No. 1 to part 738) NP applies to entire entryNP Column 1 AT applies to entire entryAT Column 1",
            "id": null
          },
          {
            "type": "text",
            "text": "Control(s)"
          },
          {
            "type": "text",
            "text": "Country Chart (See Supp. No. 1 to part 738)"
          },
          {
            "type": "text",
            "text": "NP applies to entire entry"
          },
          {
            "type": "text",
            "text": "NP Column 1"
          },
          {
            "type": "text",
            "text": "AT applies to entire entry"
          },
          {
            "type": "text",
            "text": "AT Column 1"
          },
          {
            "type": "text",
            "text": "List Based License Exceptions (See Part 740 for a description of all license exceptions)"
          },
          {
            "type": "text",
            "text": "LVS:"
          },
          {
            "type": "text",
            "text": "N/A"
          },
          {
            "type": "text",
            "text": "GBS:"
          },
          {
            "type": "text",
            "text": "N/A"
          },
          {
            "type": "text",
            "text": "List of Items Controlled"
          },
          {
            "type": "text",
            "text": "Related Controls:"
          },
          {
            "type": "text",
            "text": "(1) Equipment “specially designed” or prepared for the production of heavy water is subject to the export licensing authority of the Nuclear Regulatory Commission (see 10 CFR part 110). (2) See ECCNs 1E001 (“development” and “production”) and 1E201 (“use”) for technology for items controlled by this entry."
          },
          {
            "type": "text",
            "text": "Related Definitions:"
          },
          {
            "type": "text",
            "text": "The “internal contactors” controlled by 1B229.b are segmented trays that have an effective assembled diameter of 1.8 m (6 ft.) or greater, are designed to facilitate countercurrent contacting, and are constructed of stainless steels with a carbon content of 0.03% or less. These may be sieve trays, valve trays, bubble cap trays, or turbogrid trays."
          },
          {
            "type": "text",
            "text": "Items:"
          },
          {
            "type": "text",
            "text": "a. Water-hydrogen sulfide exchange tray columns, having all of the following characteristics:"
          }
        ],
        "children": [
          {
            "identifier": "1B229.a",
            "heading": null,
            "label": "1B229.a",
            "children": [
              {
                "identifier": "1B229.a.1",
                "heading": "Can operate at pressures of 2 MPa or greater;",
                "label": "1B229.a.1 – Can operate at pressures of 2 MPa or greater;",
                "content": [
                  {
                    "type": "html",
                    "tag": "P",
                    "html": "<P>a.1. Can operate at pressures of 2 MPa or greater;</P>",
                    "text": "a.1. Can operate at pressures of 2 MPa or greater;",
                    "id": null
                  }
                ],
                "isEccn": true,
                "boundToParent": true,
                "requireAllChildren": false
              },
              {
                "identifier": "1B229.a.2",
                "heading": "Constructed of carbon steel having an austenitic ASTM (or equivalent standard) grain size number of 5 or greater; and",
                "label": "1B229.a.2 – Constructed of carbon steel having an austenitic ASTM (or equivalent standard) grain size number of 5 or greater; and",
                "content": [
                  {
                    "type": "html",
                    "tag": "P",
                    "html": "<P>a.2. Constructed of carbon steel having an austenitic ASTM (or equivalent standard) grain size number of 5 or greater; <I>and</I></P>",
                    "text": "a.2. Constructed of carbon steel having an austenitic ASTM (or equivalent standard) grain size number of 5 or greater; and",
                    "id": null
                  }
                ],
                "isEccn": true,
                "boundToParent": true,
                "requireAllChildren": false
              },
              {
                "identifier": "1B229.a.3",
                "heading": "With a diameter of 1.8 m (6 ft.) or greater;",
                "label": "1B229.a.3 – With a diameter of 1.8 m (6 ft.) or greater;",
                "content": [
                  {
                    "type": "html",
                    "tag": "P",
                    "html": "<P>a.3. With a diameter of 1.8 m (6 ft.) or greater;</P>",
                    "text": "a.3. With a diameter of 1.8 m (6 ft.) or greater;",
                    "id": null
                  }
                ],
                "isEccn": true,
                "boundToParent": true,
                "requireAllChildren": false
              }
            ],
            "isEccn": true,
            "boundToParent": true,
            "requireAllChildren": false
          },
          {
            "identifier": "1B229.b",
            "heading": "“Internal contactors” for the water-hydrogen sulfide exchange tray columns controlled by 1B229.a.",
            "label": "1B229.b – “Internal contactors” for the water-hydrogen sulfide exchange tray columns controlled by 1B229.a.",
            "content": [
              {
                "type": "html",
                "tag": "P",
                "html": "<P>b. “Internal contactors” for the water-hydrogen sulfide exchange tray columns controlled by 1B229.a.</P>",
                "text": "b. “Internal contactors” for the water-hydrogen sulfide exchange tray columns controlled by 1B229.a.",
                "id": null
              }
            ],
            "isEccn": true,
            "boundToParent": true,
            "requireAllChildren": false
          }
        ],
        "isEccn": true,
        "boundToParent": false,
        "requireAllChildren": true
      }
    },
    {
      "version": "2022-08-15",
      "fetchedAt": "2025-10-02T20:33:41.210Z",
      "sourceUrl": "https://www.ecfr.gov/api/versioner/v1/full/2022-08-15/title-15?format=xml",
      "heading": "1B229 Water-hydrogen sulfide exchange tray columns and “internal contactors”, as follows (see List of Items Controlled).",
      "title": "Water-hydrogen sulfide exchange tray columns and “internal contactors”, as follows (see List of Items Controlled).",
      "category": "1",
      "group": "1B",
      "supplement": {
        "number": "1",
        "heading": "Supplement No. 1 to Part 774 - The Commerce Control List"
      },
      "breadcrumbs": [
        "B. “Test”, “Inspection” and “Production Equipment”"
      ],
      "ancestors": [],
      "text": "1B229 Water-hydrogen sulfide exchange tray columns and “internal contactors”, as follows (see List of Items Controlled).\nLicense Requirements\nReason for Control:\nNP, AT\nControl(s) Country Chart (See Supp. No. 1 to part 738) NP applies to entire entryNP Column 1 AT applies to entire entryAT Column 1\nControl(s)\nCountry Chart (See Supp. No. 1 to part 738)\nNP applies to entire entry\nNP Column 1\nAT applies to entire entry\nAT Column 1\nList Based License Exceptions (See Part 740 for a description of all license exceptions)\nLVS:\nN/A\nGBS:\nN/A\nList of Items Controlled\nRelated Controls:\n(1) Equipment “specially designed” or prepared for the production of heavy water is subject to the export licensing authority of the Nuclear Regulatory Commission (see 10 CFR part 110). (2) See ECCNs 1E001 (“development” and “production”) and 1E201 (“use”) for technology for items controlled by this entry.\nRelated Definitions:\nThe “internal contactors” controlled by 1B229.b are segmented trays that have an effective assembled diameter of 1.8 m (6 ft.) or greater, are designed to facilitate countercurrent contacting, and are constructed of stainless steels with a carbon content of 0.03% or less. These may be sieve trays, valve trays, bubble cap trays, or turbogrid trays.\nItems:\na. Water-hydrogen sulfide exchange tray columns, having all of the following characteristics:\n1B229.a\nCan operate at pressures of 2 MPa or greater;\na.1. Can operate at pressures of 2 MPa or greater;\nConstructed of carbon steel having an austenitic ASTM (or equivalent standard) grain size number of 5 or greater; and\na.2. Constructed of carbon steel having an austenitic ASTM (or equivalent standard) grain size number of 5 or greater; and\nWith a diameter of 1.8 m (6 ft.) or greater;\na.3. With a diameter of 1.8 m (6 ft.) or greater;\n“Internal contactors” for the water-hydrogen sulfide exchange tray columns controlled by 1B229.a.\nb. “Internal contactors” for the water-hydrogen sulfide exchange tray columns controlled by 1B229.a.",
      "structure": {
        "identifier": "1B229",
        "heading": "1B229 Water-hydrogen sulfide exchange tray columns and “internal contactors”, as follows (see List of Items Controlled).",
        "label": "1B229 – 1B229 Water-hydrogen sulfide exchange tray columns and “internal contactors”, as follows (see List of Items Controlled).",
        "content": [
          {
            "type": "text",
            "text": "License Requirements"
          },
          {
            "type": "text",
            "text": "Reason for Control:"
          },
          {
            "type": "text",
            "text": "NP, AT"
          },
          {
            "type": "html",
            "tag": "TABLE",
            "html": "<TABLE border=\"1\" cellpadding=\"1\" cellspacing=\"1\" class=\"gpotbl_table\" frame=\"void\" width=\"100%\"><TR><TH class=\"gpotbl_colhed\" scope=\"col\">Control(s)\n</TH><TH class=\"gpotbl_colhed\" scope=\"col\">Country Chart (See Supp. No. 1 to part 738)\n</TH></TR><TR><TD align=\"left\" class=\"gpotbl_cell\" scope=\"row\">NP applies to entire entry (1B229)</TD><TD align=\"left\" class=\"gpotbl_cell\">NP Column 1\n</TD></TR><TR><TD align=\"left\" class=\"gpotbl_cell\" scope=\"row\">AT applies to entire entry (1B229)</TD><TD align=\"left\" class=\"gpotbl_cell\">AT Column 1</TD></TR></TABLE>",
            "text": "Control(s) Country Chart (See Supp. No. 1 to part 738) NP applies to entire entryNP Column 1 AT applies to entire entryAT Column 1",
            "id": null
          },
          {
            "type": "text",
            "text": "Control(s)"
          },
          {
            "type": "text",
            "text": "Country Chart (See Supp. No. 1 to part 738)"
          },
          {
            "type": "text",
            "text": "NP applies to entire entry"
          },
          {
            "type": "text",
            "text": "NP Column 1"
          },
          {
            "type": "text",
            "text": "AT applies to entire entry"
          },
          {
            "type": "text",
            "text": "AT Column 1"
          },
          {
            "type": "text",
            "text": "List Based License Exceptions (See Part 740 for a description of all license exceptions)"
          },
          {
            "type": "text",
            "text": "LVS:"
          },
          {
            "type": "text",
            "text": "N/A"
          },
          {
            "type": "text",
            "text": "GBS:"
          },
          {
            "type": "text",
            "text": "N/A"
          },
          {
            "type": "text",
            "text": "List of Items Controlled"
          },
          {
            "type": "text",
            "text": "Related Controls:"
          },
          {
            "type": "text",
            "text": "(1) Equipment “specially designed” or prepared for the production of heavy water is subject to the export licensing authority of the Nuclear Regulatory Commission (see 10 CFR part 110). (2) See ECCNs 1E001 (“development” and “production”) and 1E201 (“use”) for technology for items controlled by this entry."
          },
          {
            "type": "text",
            "text": "Related Definitions:"
          },
          {
            "type": "text",
            "text": "The “internal contactors” controlled by 1B229.b are segmented trays that have an effective assembled diameter of 1.8 m (6 ft.) or greater, are designed to facilitate countercurrent contacting, and are constructed of stainless steels with a carbon content of 0.03% or less. These may be sieve trays, valve trays, bubble cap trays, or turbogrid trays."
          },
          {
            "type": "text",
            "text": "Items:"
          },
          {
            "type": "text",
            "text": "a. Water-hydrogen sulfide exchange tray columns, having all of the following characteristics:"
          }
        ],
        "children": [
          {
            "identifier": "1B229.a",
            "heading": null,
            "label": "1B229.a",
            "children": [
              {
                "identifier": "1B229.a.1",
                "heading": "Can operate at pressures of 2 MPa or greater;",
                "label": "1B229.a.1 – Can operate at pressures of 2 MPa or greater;",
                "content": [
                  {
                    "type": "html",
                    "tag": "P",
                    "html": "<P>a.1. Can operate at pressures of 2 MPa or greater;</P>",
                    "text": "a.1. Can operate at pressures of 2 MPa or greater;",
                    "id": null
                  }
                ],
                "isEccn": true,
                "boundToParent": true,
                "requireAllChildren": false
              },
              {
                "identifier": "1B229.a.2",
                "heading": "Constructed of carbon steel having an austenitic ASTM (or equivalent standard) grain size number of 5 or greater; and",
                "label": "1B229.a.2 – Constructed of carbon steel having an austenitic ASTM (or equivalent standard) grain size number of 5 or greater; and",
                "content": [
                  {
                    "type": "html",
                    "tag": "P",
                    "html": "<P>a.2. Constructed of carbon steel having an austenitic ASTM (or equivalent standard) grain size number of 5 or greater; <I>and</I></P>",
                    "text": "a.2. Constructed of carbon steel having an austenitic ASTM (or equivalent standard) grain size number of 5 or greater; and",
                    "id": null
                  }
                ],
                "isEccn": true,
                "boundToParent": true,
                "requireAllChildren": false
              },
              {
                "identifier": "1B229.a.3",
                "heading": "With a diameter of 1.8 m (6 ft.) or greater;",
                "label": "1B229.a.3 – With a diameter of 1.8 m (6 ft.) or greater;",
                "content": [
                  {
                    "type": "html",
                    "tag": "P",
                    "html": "<P>a.3. With a diameter of 1.8 m (6 ft.) or greater;</P>",
                    "text": "a.3. With a diameter of 1.8 m (6 ft.) or greater;",
                    "id": null
                  }
                ],
                "isEccn": true,
                "boundToParent": true,
                "requireAllChildren": false
              }
            ],
            "isEccn": true,
            "boundToParent": true,
            "requireAllChildren": false
          },
          {
            "identifier": "1B229.b",
            "heading": "“Internal contactors” for the water-hydrogen sulfide exchange tray columns controlled by 1B229.a.",
            "label": "1B229.b – “Internal contactors” for the water-hydrogen sulfide exchange tray columns controlled by 1B229.a.",
            "content": [
              {
                "type": "html",
                "tag": "P",
                "html": "<P>b. “Internal contactors” for the water-hydrogen sulfide exchange tray columns controlled by 1B229.a.</P>",
                "text": "b. “Internal contactors” for the water-hydrogen sulfide exchange tray columns controlled by 1B229.a.",
                "id": null
              }
            ],
            "isEccn": true,
            "boundToParent": true,
            "requireAllChildren": false
          }
        ],
        "isEccn": true,
        "boundToParent": false,
        "requireAllChildren": true
      }
    },
    {
      "version": "2022-10-07",
      "fetchedAt": "2025-10-02T20:33:41.595Z",
      "sourceUrl": "https://www.ecfr.gov/api/versioner/v1/full/2022-10-07/title-15?format=xml",
      "heading": "1B229 Water-hydrogen sulfide exchange tray columns and “internal contactors”, as follows (see List of Items Controlled).",
      "title": "Water-hydrogen sulfide exchange tray columns and “internal contactors”, as follows (see List of Items Controlled).",
      "category": "1",
      "group": "1B",
      "supplement": {
        "number": "1",
        "heading": "Supplement No. 1 to Part 774 - The Commerce Control List"
      },
      "breadcrumbs": [
        "B. “Test”, “Inspection” and “Production Equipment”"
      ],
      "ancestors": [],
      "text": "1B229 Water-hydrogen sulfide exchange tray columns and “internal contactors”, as follows (see List of Items Controlled).\nLicense Requirements\nReason for Control:\nNP, AT\nControl(s) Country Chart (See Supp. No. 1 to part 738) NP applies to entire entryNP Column 1 AT applies to entire entryAT Column 1\nControl(s)\nCountry Chart (See Supp. No. 1 to part 738)\nNP applies to entire entry\nNP Column 1\nAT applies to entire entry\nAT Column 1\nList Based License Exceptions (See Part 740 for a description of all license exceptions)\nLVS:\nN/A\nGBS:\nN/A\nList of Items Controlled\nRelated Controls:\n(1) Equipment “specially designed” or prepared for the production of heavy water is subject to the export licensing authority of the Nuclear Regulatory Commission (see 10 CFR part 110). (2) See ECCNs 1E001 (“development” and “production”) and 1E201 (“use”) for technology for items controlled by this entry.\nRelated Definitions:\nThe “internal contactors” controlled by 1B229.b are segmented trays that have an effective assembled diameter of 1.8 m (6 ft.) or greater, are designed to facilitate countercurrent contacting, and are constructed of stainless steels with a carbon content of 0.03% or less. These may be sieve trays, valve trays, bubble cap trays, or turbogrid trays.\nItems:\na. Water-hydrogen sulfide exchange tray columns, having all of the following characteristics:\n1B229.a\nCan operate at pressures of 2 MPa or greater;\na.1. Can operate at pressures of 2 MPa or greater;\nConstructed of carbon steel having an austenitic ASTM (or equivalent standard) grain size number of 5 or greater; and\na.2. Constructed of carbon steel having an austenitic ASTM (or equivalent standard) grain size number of 5 or greater; and\nWith a diameter of 1.8 m (6 ft.) or greater;\na.3. With a diameter of 1.8 m (6 ft.) or greater;\n“Internal contactors” for the water-hydrogen sulfide exchange tray columns controlled by 1B229.a.\nb. “Internal contactors” for the water-hydrogen sulfide exchange tray columns controlled by 1B229.a.",
      "structure": {
        "identifier": "1B229",
        "heading": "1B229 Water-hydrogen sulfide exchange tray columns and “internal contactors”, as follows (see List of Items Controlled).",
        "label": "1B229 – 1B229 Water-hydrogen sulfide exchange tray columns and “internal contactors”, as follows (see List of Items Controlled).",
        "content": [
          {
            "type": "text",
            "text": "License Requirements"
          },
          {
            "type": "text",
            "text": "Reason for Control:"
          },
          {
            "type": "text",
            "text": "NP, AT"
          },
          {
            "type": "html",
            "tag": "TABLE",
            "html": "<TABLE border=\"1\" cellpadding=\"1\" cellspacing=\"1\" class=\"gpotbl_table\" frame=\"void\" width=\"100%\"><TR><TH class=\"gpotbl_colhed\" scope=\"col\">Control(s)\n</TH><TH class=\"gpotbl_colhed\" scope=\"col\">Country Chart (See Supp. No. 1 to part 738)\n</TH></TR><TR><TD align=\"left\" class=\"gpotbl_cell\" scope=\"row\">NP applies to entire entry (1B229)</TD><TD align=\"left\" class=\"gpotbl_cell\">NP Column 1\n</TD></TR><TR><TD align=\"left\" class=\"gpotbl_cell\" scope=\"row\">AT applies to entire entry (1B229)</TD><TD align=\"left\" class=\"gpotbl_cell\">AT Column 1</TD></TR></TABLE>",
            "text": "Control(s) Country Chart (See Supp. No. 1 to part 738) NP applies to entire entryNP Column 1 AT applies to entire entryAT Column 1",
            "id": null
          },
          {
            "type": "text",
            "text": "Control(s)"
          },
          {
            "type": "text",
            "text": "Country Chart (See Supp. No. 1 to part 738)"
          },
          {
            "type": "text",
            "text": "NP applies to entire entry"
          },
          {
            "type": "text",
            "text": "NP Column 1"
          },
          {
            "type": "text",
            "text": "AT applies to entire entry"
          },
          {
            "type": "text",
            "text": "AT Column 1"
          },
          {
            "type": "text",
            "text": "List Based License Exceptions (See Part 740 for a description of all license exceptions)"
          },
          {
            "type": "text",
            "text": "LVS:"
          },
          {
            "type": "text",
            "text": "N/A"
          },
          {
            "type": "text",
            "text": "GBS:"
          },
          {
            "type": "text",
            "text": "N/A"
          },
          {
            "type": "text",
            "text": "List of Items Controlled"
          },
          {
            "type": "text",
            "text": "Related Controls:"
          },
          {
            "type": "text",
            "text": "(1) Equipment “specially designed” or prepared for the production of heavy water is subject to the export licensing authority of the Nuclear Regulatory Commission (see 10 CFR part 110). (2) See ECCNs 1E001 (“development” and “production”) and 1E201 (“use”) for technology for items controlled by this entry."
          },
          {
            "type": "text",
            "text": "Related Definitions:"
          },
          {
            "type": "text",
            "text": "The “internal contactors” controlled by 1B229.b are segmented trays that have an effective assembled diameter of 1.8 m (6 ft.) or greater, are designed to facilitate countercurrent contacting, and are constructed of stainless steels with a carbon content of 0.03% or less. These may be sieve trays, valve trays, bubble cap trays, or turbogrid trays."
          },
          {
            "type": "text",
            "text": "Items:"
          },
          {
            "type": "text",
            "text": "a. Water-hydrogen sulfide exchange tray columns, having all of the following characteristics:"
          }
        ],
        "children": [
          {
            "identifier": "1B229.a",
            "heading": null,
            "label": "1B229.a",
            "children": [
              {
                "identifier": "1B229.a.1",
                "heading": "Can operate at pressures of 2 MPa or greater;",
                "label": "1B229.a.1 – Can operate at pressures of 2 MPa or greater;",
                "content": [
                  {
                    "type": "html",
                    "tag": "P",
                    "html": "<P>a.1. Can operate at pressures of 2 MPa or greater;</P>",
                    "text": "a.1. Can operate at pressures of 2 MPa or greater;",
                    "id": null
                  }
                ],
                "isEccn": true,
                "boundToParent": true,
                "requireAllChildren": false
              },
              {
                "identifier": "1B229.a.2",
                "heading": "Constructed of carbon steel having an austenitic ASTM (or equivalent standard) grain size number of 5 or greater; and",
                "label": "1B229.a.2 – Constructed of carbon steel having an austenitic ASTM (or equivalent standard) grain size number of 5 or greater; and",
                "content": [
                  {
                    "type": "html",
                    "tag": "P",
                    "html": "<P>a.2. Constructed of carbon steel having an austenitic ASTM (or equivalent standard) grain size number of 5 or greater; <I>and</I></P>",
                    "text": "a.2. Constructed of carbon steel having an austenitic ASTM (or equivalent standard) grain size number of 5 or greater; and",
                    "id": null
                  }
                ],
                "isEccn": true,
                "boundToParent": true,
                "requireAllChildren": false
              },
              {
                "identifier": "1B229.a.3",
                "heading": "With a diameter of 1.8 m (6 ft.) or greater;",
                "label": "1B229.a.3 – With a diameter of 1.8 m (6 ft.) or greater;",
                "content": [
                  {
                    "type": "html",
                    "tag": "P",
                    "html": "<P>a.3. With a diameter of 1.8 m (6 ft.) or greater;</P>",
                    "text": "a.3. With a diameter of 1.8 m (6 ft.) or greater;",
                    "id": null
                  }
                ],
                "isEccn": true,
                "boundToParent": true,
                "requireAllChildren": false
              }
            ],
            "isEccn": true,
            "boundToParent": true,
            "requireAllChildren": false
          },
          {
            "identifier": "1B229.b",
            "heading": "“Internal contactors” for the water-hydrogen sulfide exchange tray columns controlled by 1B229.a.",
            "label": "1B229.b – “Internal contactors” for the water-hydrogen sulfide exchange tray columns controlled by 1B229.a.",
            "content": [
              {
                "type": "html",
                "tag": "P",
                "html": "<P>b. “Internal contactors” for the water-hydrogen sulfide exchange tray columns controlled by 1B229.a.</P>",
                "text": "b. “Internal contactors” for the water-hydrogen sulfide exchange tray columns controlled by 1B229.a.",
                "id": null
              }
            ],
            "isEccn": true,
            "boundToParent": true,
            "requireAllChildren": false
          }
        ],
        "isEccn": true,
        "boundToParent": false,
        "requireAllChildren": true
      }
    },
    {
      "version": "2023-01-17",
      "fetchedAt": "2025-10-02T20:33:41.990Z",
      "sourceUrl": "https://www.ecfr.gov/api/versioner/v1/full/2023-01-17/title-15?format=xml",
      "heading": "1B229 Water-hydrogen sulfide exchange tray columns and “internal contactors”, as follows (see List of Items Controlled).",
      "title": "Water-hydrogen sulfide exchange tray columns and “internal contactors”, as follows (see List of Items Controlled).",
      "category": "1",
      "group": "1B",
      "supplement": {
        "number": "1",
        "heading": "Supplement No. 1 to Part 774 - The Commerce Control List"
      },
      "breadcrumbs": [
        "B. “Test”, “Inspection” and “Production Equipment”"
      ],
      "ancestors": [],
      "text": "1B229 Water-hydrogen sulfide exchange tray columns and “internal contactors”, as follows (see List of Items Controlled).\nLicense Requirements\nReason for Control:\nNP, AT\nControl(s) Country Chart (See Supp. No. 1 to part 738) NP applies to entire entryNP Column 1 AT applies to entire entryAT Column 1\nControl(s)\nCountry Chart (See Supp. No. 1 to part 738)\nNP applies to entire entry\nNP Column 1\nAT applies to entire entry\nAT Column 1\nList Based License Exceptions (See Part 740 for a description of all license exceptions)\nLVS:\nN/A\nGBS:\nN/A\nList of Items Controlled\nRelated Controls:\n(1) Equipment “specially designed” or prepared for the production of heavy water is subject to the export licensing authority of the Nuclear Regulatory Commission (see 10 CFR part 110). (2) See ECCNs 1E001 (“development” and “production”) and 1E201 (“use”) for technology for items controlled by this entry.\nRelated Definitions:\nThe “internal contactors” controlled by 1B229.b are segmented trays that have an effective assembled diameter of 1.8 m (6 ft.) or greater, are designed to facilitate countercurrent contacting, and are constructed of stainless steels with a carbon content of 0.03% or less. These may be sieve trays, valve trays, bubble cap trays, or turbogrid trays.\nItems:\na. Water-hydrogen sulfide exchange tray columns, having all of the following characteristics:\n1B229.a\nCan operate at pressures of 2 MPa or greater;\na.1. Can operate at pressures of 2 MPa or greater;\nConstructed of carbon steel having an austenitic ASTM (or equivalent standard) grain size number of 5 or greater; and\na.2. Constructed of carbon steel having an austenitic ASTM (or equivalent standard) grain size number of 5 or greater; and\nWith a diameter of 1.8 m (6 ft.) or greater;\na.3. With a diameter of 1.8 m (6 ft.) or greater;\n“Internal contactors” for the water-hydrogen sulfide exchange tray columns controlled by 1B229.a.\nb. “Internal contactors” for the water-hydrogen sulfide exchange tray columns controlled by 1B229.a.",
      "structure": {
        "identifier": "1B229",
        "heading": "1B229 Water-hydrogen sulfide exchange tray columns and “internal contactors”, as follows (see List of Items Controlled).",
        "label": "1B229 – 1B229 Water-hydrogen sulfide exchange tray columns and “internal contactors”, as follows (see List of Items Controlled).",
        "content": [
          {
            "type": "text",
            "text": "License Requirements"
          },
          {
            "type": "text",
            "text": "Reason for Control:"
          },
          {
            "type": "text",
            "text": "NP, AT"
          },
          {
            "type": "html",
            "tag": "TABLE",
            "html": "<TABLE border=\"1\" cellpadding=\"1\" cellspacing=\"1\" class=\"gpotbl_table\" frame=\"void\" width=\"100%\"><TR><TH class=\"gpotbl_colhed\" scope=\"col\">Control(s)\n</TH><TH class=\"gpotbl_colhed\" scope=\"col\">Country Chart (See Supp. No. 1 to part 738)\n</TH></TR><TR><TD align=\"left\" class=\"gpotbl_cell\" scope=\"row\">NP applies to entire entry (1B229)</TD><TD align=\"left\" class=\"gpotbl_cell\">NP Column 1\n</TD></TR><TR><TD align=\"left\" class=\"gpotbl_cell\" scope=\"row\">AT applies to entire entry (1B229)</TD><TD align=\"left\" class=\"gpotbl_cell\">AT Column 1</TD></TR></TABLE>",
            "text": "Control(s) Country Chart (See Supp. No. 1 to part 738) NP applies to entire entryNP Column 1 AT applies to entire entryAT Column 1",
            "id": null
          },
          {
            "type": "text",
            "text": "Control(s)"
          },
          {
            "type": "text",
            "text": "Country Chart (See Supp. No. 1 to part 738)"
          },
          {
            "type": "text",
            "text": "NP applies to entire entry"
          },
          {
            "type": "text",
            "text": "NP Column 1"
          },
          {
            "type": "text",
            "text": "AT applies to entire entry"
          },
          {
            "type": "text",
            "text": "AT Column 1"
          },
          {
            "type": "text",
            "text": "List Based License Exceptions (See Part 740 for a description of all license exceptions)"
          },
          {
            "type": "text",
            "text": "LVS:"
          },
          {
            "type": "text",
            "text": "N/A"
          },
          {
            "type": "text",
            "text": "GBS:"
          },
          {
            "type": "text",
            "text": "N/A"
          },
          {
            "type": "text",
            "text": "List of Items Controlled"
          },
          {
            "type": "text",
            "text": "Related Controls:"
          },
          {
            "type": "text",
            "text": "(1) Equipment “specially designed” or prepared for the production of heavy water is subject to the export licensing authority of the Nuclear Regulatory Commission (see 10 CFR part 110). (2) See ECCNs 1E001 (“development” and “production”) and 1E201 (“use”) for technology for items controlled by this entry."
          },
          {
            "type": "text",
            "text": "Related Definitions:"
          },
          {
            "type": "text",
            "text": "The “internal contactors” controlled by 1B229.b are segmented trays that have an effective assembled diameter of 1.8 m (6 ft.) or greater, are designed to facilitate countercurrent contacting, and are constructed of stainless steels with a carbon content of 0.03% or less. These may be sieve trays, valve trays, bubble cap trays, or turbogrid trays."
          },
          {
            "type": "text",
            "text": "Items:"
          },
          {
            "type": "text",
            "text": "a. Water-hydrogen sulfide exchange tray columns, having all of the following characteristics:"
          }
        ],
        "children": [
          {
            "identifier": "1B229.a",
            "heading": null,
            "label": "1B229.a",
            "children": [
              {
                "identifier": "1B229.a.1",
                "heading": "Can operate at pressures of 2 MPa or greater;",
                "label": "1B229.a.1 – Can operate at pressures of 2 MPa or greater;",
                "content": [
                  {
                    "type": "html",
                    "tag": "P",
                    "html": "<P>a.1. Can operate at pressures of 2 MPa or greater;</P>",
                    "text": "a.1. Can operate at pressures of 2 MPa or greater;",
                    "id": null
                  }
                ],
                "isEccn": true,
                "boundToParent": true,
                "requireAllChildren": false
              },
              {
                "identifier": "1B229.a.2",
                "heading": "Constructed of carbon steel having an austenitic ASTM (or equivalent standard) grain size number of 5 or greater; and",
                "label": "1B229.a.2 – Constructed of carbon steel having an austenitic ASTM (or equivalent standard) grain size number of 5 or greater; and",
                "content": [
                  {
                    "type": "html",
                    "tag": "P",
                    "html": "<P>a.2. Constructed of carbon steel having an austenitic ASTM (or equivalent standard) grain size number of 5 or greater; <I>and</I></P>",
                    "text": "a.2. Constructed of carbon steel having an austenitic ASTM (or equivalent standard) grain size number of 5 or greater; and",
                    "id": null
                  }
                ],
                "isEccn": true,
                "boundToParent": true,
                "requireAllChildren": false
              },
              {
                "identifier": "1B229.a.3",
                "heading": "With a diameter of 1.8 m (6 ft.) or greater;",
                "label": "1B229.a.3 – With a diameter of 1.8 m (6 ft.) or greater;",
                "content": [
                  {
                    "type": "html",
                    "tag": "P",
                    "html": "<P>a.3. With a diameter of 1.8 m (6 ft.) or greater;</P>",
                    "text": "a.3. With a diameter of 1.8 m (6 ft.) or greater;",
                    "id": null
                  }
                ],
                "isEccn": true,
                "boundToParent": true,
                "requireAllChildren": false
              }
            ],
            "isEccn": true,
            "boundToParent": true,
            "requireAllChildren": false
          },
          {
            "identifier": "1B229.b",
            "heading": "“Internal contactors” for the water-hydrogen sulfide exchange tray columns controlled by 1B229.a.",
            "label": "1B229.b – “Internal contactors” for the water-hydrogen sulfide exchange tray columns controlled by 1B229.a.",
            "content": [
              {
                "type": "html",
                "tag": "P",
                "html": "<P>b. “Internal contactors” for the water-hydrogen sulfide exchange tray columns controlled by 1B229.a.</P>",
                "text": "b. “Internal contactors” for the water-hydrogen sulfide exchange tray columns controlled by 1B229.a.",
                "id": null
              }
            ],
            "isEccn": true,
            "boundToParent": true,
            "requireAllChildren": false
          }
        ],
        "isEccn": true,
        "boundToParent": false,
        "requireAllChildren": true
      }
    },
    {
      "version": "2023-02-24",
      "fetchedAt": "2025-10-02T20:33:42.390Z",
      "sourceUrl": "https://www.ecfr.gov/api/versioner/v1/full/2023-02-24/title-15?format=xml",
      "heading": "1B229 Water-hydrogen sulfide exchange tray columns and “internal contactors”, as follows (see List of Items Controlled).",
      "title": "Water-hydrogen sulfide exchange tray columns and “internal contactors”, as follows (see List of Items Controlled).",
      "category": "1",
      "group": "1B",
      "supplement": {
        "number": "1",
        "heading": "Supplement No. 1 to Part 774 - The Commerce Control List"
      },
      "breadcrumbs": [
        "B. “Test”, “Inspection” and “Production Equipment”"
      ],
      "ancestors": [],
      "text": "1B229 Water-hydrogen sulfide exchange tray columns and “internal contactors”, as follows (see List of Items Controlled).\nLicense Requirements\nReason for Control:\nNP, AT\nControl(s) Country Chart (See Supp. No. 1 to part 738) NP applies to entire entryNP Column 1 AT applies to entire entryAT Column 1\nControl(s)\nCountry Chart (See Supp. No. 1 to part 738)\nNP applies to entire entry\nNP Column 1\nAT applies to entire entry\nAT Column 1\nList Based License Exceptions (See Part 740 for a description of all license exceptions)\nLVS:\nN/A\nGBS:\nN/A\nList of Items Controlled\nRelated Controls:\n(1) Equipment “specially designed” or prepared for the production of heavy water is subject to the export licensing authority of the Nuclear Regulatory Commission (see 10 CFR part 110). (2) See ECCNs 1E001 (“development” and “production”) and 1E201 (“use”) for technology for items controlled by this entry.\nRelated Definitions:\nThe “internal contactors” controlled by 1B229.b are segmented trays that have an effective assembled diameter of 1.8 m (6 ft.) or greater, are designed to facilitate countercurrent contacting, and are constructed of stainless steels with a carbon content of 0.03% or less. These may be sieve trays, valve trays, bubble cap trays, or turbogrid trays.\nItems:\na. Water-hydrogen sulfide exchange tray columns, having all of the following characteristics:\n1B229.a\nCan operate at pressures of 2 MPa or greater;\na.1. Can operate at pressures of 2 MPa or greater;\nConstructed of carbon steel having an austenitic ASTM (or equivalent standard) grain size number of 5 or greater; and\na.2. Constructed of carbon steel having an austenitic ASTM (or equivalent standard) grain size number of 5 or greater; and\nWith a diameter of 1.8 m (6 ft.) or greater;\na.3. With a diameter of 1.8 m (6 ft.) or greater;\n“Internal contactors” for the water-hydrogen sulfide exchange tray columns controlled by 1B229.a.\nb. “Internal contactors” for the water-hydrogen sulfide exchange tray columns controlled by 1B229.a.",
      "structure": {
        "identifier": "1B229",
        "heading": "1B229 Water-hydrogen sulfide exchange tray columns and “internal contactors”, as follows (see List of Items Controlled).",
        "label": "1B229 – 1B229 Water-hydrogen sulfide exchange tray columns and “internal contactors”, as follows (see List of Items Controlled).",
        "content": [
          {
            "type": "text",
            "text": "License Requirements"
          },
          {
            "type": "text",
            "text": "Reason for Control:"
          },
          {
            "type": "text",
            "text": "NP, AT"
          },
          {
            "type": "html",
            "tag": "TABLE",
            "html": "<TABLE border=\"1\" cellpadding=\"1\" cellspacing=\"1\" class=\"gpotbl_table\" frame=\"void\" width=\"100%\"><TR><TH class=\"gpotbl_colhed\" scope=\"col\">Control(s)\n</TH><TH class=\"gpotbl_colhed\" scope=\"col\">Country Chart (See Supp. No. 1 to part 738)\n</TH></TR><TR><TD align=\"left\" class=\"gpotbl_cell\" scope=\"row\">NP applies to entire entry (1B229)</TD><TD align=\"left\" class=\"gpotbl_cell\">NP Column 1\n</TD></TR><TR><TD align=\"left\" class=\"gpotbl_cell\" scope=\"row\">AT applies to entire entry (1B229)</TD><TD align=\"left\" class=\"gpotbl_cell\">AT Column 1</TD></TR></TABLE>",
            "text": "Control(s) Country Chart (See Supp. No. 1 to part 738) NP applies to entire entryNP Column 1 AT applies to entire entryAT Column 1",
            "id": null
          },
          {
            "type": "text",
            "text": "Control(s)"
          },
          {
            "type": "text",
            "text": "Country Chart (See Supp. No. 1 to part 738)"
          },
          {
            "type": "text",
            "text": "NP applies to entire entry"
          },
          {
            "type": "text",
            "text": "NP Column 1"
          },
          {
            "type": "text",
            "text": "AT applies to entire entry"
          },
          {
            "type": "text",
            "text": "AT Column 1"
          },
          {
            "type": "text",
            "text": "List Based License Exceptions (See Part 740 for a description of all license exceptions)"
          },
          {
            "type": "text",
            "text": "LVS:"
          },
          {
            "type": "text",
            "text": "N/A"
          },
          {
            "type": "text",
            "text": "GBS:"
          },
          {
            "type": "text",
            "text": "N/A"
          },
          {
            "type": "text",
            "text": "List of Items Controlled"
          },
          {
            "type": "text",
            "text": "Related Controls:"
          },
          {
            "type": "text",
            "text": "(1) Equipment “specially designed” or prepared for the production of heavy water is subject to the export licensing authority of the Nuclear Regulatory Commission (see 10 CFR part 110). (2) See ECCNs 1E001 (“development” and “production”) and 1E201 (“use”) for technology for items controlled by this entry."
          },
          {
            "type": "text",
            "text": "Related Definitions:"
          },
          {
            "type": "text",
            "text": "The “internal contactors” controlled by 1B229.b are segmented trays that have an effective assembled diameter of 1.8 m (6 ft.) or greater, are designed to facilitate countercurrent contacting, and are constructed of stainless steels with a carbon content of 0.03% or less. These may be sieve trays, valve trays, bubble cap trays, or turbogrid trays."
          },
          {
            "type": "text",
            "text": "Items:"
          },
          {
            "type": "text",
            "text": "a. Water-hydrogen sulfide exchange tray columns, having all of the following characteristics:"
          }
        ],
        "children": [
          {
            "identifier": "1B229.a",
            "heading": null,
            "label": "1B229.a",
            "children": [
              {
                "identifier": "1B229.a.1",
                "heading": "Can operate at pressures of 2 MPa or greater;",
                "label": "1B229.a.1 – Can operate at pressures of 2 MPa or greater;",
                "content": [
                  {
                    "type": "html",
                    "tag": "P",
                    "html": "<P>a.1. Can operate at pressures of 2 MPa or greater;</P>",
                    "text": "a.1. Can operate at pressures of 2 MPa or greater;",
                    "id": null
                  }
                ],
                "isEccn": true,
                "boundToParent": true,
                "requireAllChildren": false
              },
              {
                "identifier": "1B229.a.2",
                "heading": "Constructed of carbon steel having an austenitic ASTM (or equivalent standard) grain size number of 5 or greater; and",
                "label": "1B229.a.2 – Constructed of carbon steel having an austenitic ASTM (or equivalent standard) grain size number of 5 or greater; and",
                "content": [
                  {
                    "type": "html",
                    "tag": "P",
                    "html": "<P>a.2. Constructed of carbon steel having an austenitic ASTM (or equivalent standard) grain size number of 5 or greater; <I>and</I></P>",
                    "text": "a.2. Constructed of carbon steel having an austenitic ASTM (or equivalent standard) grain size number of 5 or greater; and",
                    "id": null
                  }
                ],
                "isEccn": true,
                "boundToParent": true,
                "requireAllChildren": false
              },
              {
                "identifier": "1B229.a.3",
                "heading": "With a diameter of 1.8 m (6 ft.) or greater;",
                "label": "1B229.a.3 – With a diameter of 1.8 m (6 ft.) or greater;",
                "content": [
                  {
                    "type": "html",
                    "tag": "P",
                    "html": "<P>a.3. With a diameter of 1.8 m (6 ft.) or greater;</P>",
                    "text": "a.3. With a diameter of 1.8 m (6 ft.) or greater;",
                    "id": null
                  }
                ],
                "isEccn": true,
                "boundToParent": true,
                "requireAllChildren": false
              }
            ],
            "isEccn": true,
            "boundToParent": true,
            "requireAllChildren": false
          },
          {
            "identifier": "1B229.b",
            "heading": "“Internal contactors” for the water-hydrogen sulfide exchange tray columns controlled by 1B229.a.",
            "label": "1B229.b – “Internal contactors” for the water-hydrogen sulfide exchange tray columns controlled by 1B229.a.",
            "content": [
              {
                "type": "html",
                "tag": "P",
                "html": "<P>b. “Internal contactors” for the water-hydrogen sulfide exchange tray columns controlled by 1B229.a.</P>",
                "text": "b. “Internal contactors” for the water-hydrogen sulfide exchange tray columns controlled by 1B229.a.",
                "id": null
              }
            ],
            "isEccn": true,
            "boundToParent": true,
            "requireAllChildren": false
          }
        ],
        "isEccn": true,
        "boundToParent": false,
        "requireAllChildren": true
      }
    }
  ]
}